1;8;Kyle;You bastards!
1;8;Jimbo;The last three are getting away, shoot 'em Ned.
1;8;;Ned picks off the remaining three birds.
1;8;Stan;We did it!!
1;8;;As the town celebrates, some townsfolk are still beating on the birds, one of them with a large mallet.
1;8;Mephesto;My God, what have we done?
1;8;Chef;We've saved Thanksgiving!
1;8;Mephesto;But all those poor turkeys, theh- they're all dead.
1;8;Chef;Every turkey dies, not every turkey truly lives.
1;8;Mephesto;As horrible as they were theh- they felt like a part of me. Perhaps I shouldn't be toying with God's creations, perhaps I should-
1;8;Chef;Yeah, yeah, yeah.
1;8;;Two secret service agents approach Chef and Barbrady, ignoring the carnage.
1;8;Agent 2;Excuse me sir, we're looking for a little starving Ethiopian boy who was accidentally delivered to South Park instead of a Teiko sports watch.
1;8;;Showing a picture of Marvin.
1;8;Agent 1;Have you seen anyone fitting this description.
1;8;Officer Barbrady;Oh, that could be a hundred kids in this town mister.
1;8;;Marvin approaches the two agents.
1;8;Agent 1;There you are. Are you ready to go home now?
1;8;;Marvin looks at Mr. Garrison, then at Chef, then at Officer Barbrady. He quickly shakes an affirmative. The agents lead him away, but he turns back to get some turkeys. Stan and Kyle look on as Kenny's corpse lies motionless behind them.
1;8;Stan;Wow, it sucks he has to leave.
1;8;Kyle;Yeah, I like him a lot more than Cartman.
1;8;Stan;You know, I think I've learned something today. It's really easy not to think of images on TV as real people.
1;8;;Kenny's head moves.
1;8;Stan;But they are. That's why it's easy to ignore those commercials, but, people on TV are just as real as you or I.
1;8;Kyle;Yeah.
1;8;;A rat moves in and out of Kenny's empty eye socket, then scurries away.
1;8;Kyle;And that means that McGyver is a real person too.
1;8;;Ethiopian Desert. Three Red Cross workers are present.
1;8;Red Cross Chick;We're terribly sorry about the mix-up little boy. We'll get you back home immediately.
1;8;Cartman;That's right you will, God-Damnit.
1;8;;A male agent checks his watch.
1;8;Cartman;Move it POVs, I'm an American!
1;8;;A plane lands. Marvin exits the plane.
1;8;Ethiopian;A baba, gluck gluck bababab ga.
1;8;Marvin;Baba gook gook ba.
1;8;;The cargo door lowers in back of the plane and a bunch of dead turkeys fall out. The Ethiopians grab the turkeys and raise Marvin on their shoulders in triumph. They march away, passing by a spit on which Sally Struthers has been tied, with an apple in her mouth.
1;8;Sally Struthers;(What are you doing? Let me off of here!)
1;8;;Kenny's House.
1;8;Stuart;Lord, on this day of thanks, we would like to extend our deepest gratitude for this incredible bounty of green beans you have bestowed upon us. And though for some reason you found it necessary to take our son from us, and though you for some reason find pleasure in watching us suffer, still, we give thanks. Amen.
1;8;Carol;Amen.
1;8;;She takes a brief look around.
1;8;Carol;Does anybody have a can opener?
1;8;Stuart;God Damn-it.
