9;10;Mrs. Garrison;Well it's here! You'd better make damn sure it doesn't reach these steps uncracked! [shoves him away and returns to the mic] Haha, anyhow, as I was saying, we put one egg into the hands of two male students. [far away from the podium the cab screeches to a stop and the left back door opens. Stan hops out]
9;10;Kyle;[pays the cabbie] Thanks dude! [hops out behind Stan]
9;10;Stan;There! Over there! [they run through the crowd, taking care the egg doesn't fall out and break] Excuse us! Excuse us please!
9;10;Jakartha;[runs alongside them, aiming at the egg] Yeeeeaah! [opens fire. People begin to fall away left and right]
9;10;Stan;Jesus Christ!
9;10;Kyle;Keep running! [other people hear the gunfire and look around]
9;10;Mrs. Garrison;The the egg that the two boys were given just-
9;10;Kyle;Hang on! Wait! [Jakartha bumps someone aside and starts detonating hidden bombs around the plaza. Groups of people are thrown off in all directions. The Governor begins to pay attention]
9;10;Mrs. Garrison;In conclusion, Governor, you can rest assured that-! [one last blast is especially deadly. The area fills with dark brown smoke. As the smoke clears, Stan and Kyle hobble towards the podium, tattered clothes and all]
9;10;Stan;[tired, voice breaking] Teacher, our egg is... okay. [falls onto his back and passes out, holding the egg high for all to see]
9;10;Bill Owens;[kneels to inspect the egg] This egg is fine. [rises and steps forth] Gays can get married! [everyone cheers and gay couples hug each other in celebration.]
9;10;Mrs. Garrison;Noo! Noooo!!
9;10;Kyle;[still woozy] Gays can get married? What??
9;10;;Wedding of Big Gay Al and Mr. Slave, at a gazebo nearby. The guests are in place, the happy couple and the minister are on the gazebo floor.
9;10;Fr. Maxi;I now pronounce you man... and man. [both men, Al and Slave, are wearing wedding dresses. They turn to face each other and kiss on the lips. Everyone present cheers, and Mr. Slave and Al run down the aisle to their new life together. Stan and Kyle appear as the crowd disperses]
9;10;Randy;[walks up and kneels next to Stan] Boys, I'm really proud of you. You've done an amazing thing for marriage rights. [rises and walks away. Wendy walks up]
9;10;Kyle;[still confused] What did we do?
9;10;Wendy;Stan, I'm sorry I doubted you. You really made a great dad.
9;10;Stan;[smugly] Like I give a crap about what you think, Wendy. [Wendy's face falls, then she turns and walks away sadly.]
9;10;Mrs. Garrison;"Love, love lost long ago, it was special then, it's over now.
Guess that I'll never know how it all went wrong. How how how?
Well perhaps I should try and boldly go and rekindle that love lost long ago."
