9;10;;South Park Elementary, day. Mrs. Garrison arrives to start class. A carton of eggs sits on her desk.
9;10;Mrs. Garrison;Okay, children, this week we are all going to learn about parenting. [writes the word on the board.] I'm going to pair all the boys and girls in class into couples, and give each couple... [opens the carton of eggs and holds an egg up for the class to see] an egg. You must care for and look after this egg just like a baby for one full week. If you break your egg, it means you have a dead baby, and if you kill your baby, you get an F. When I announce your names, please move and sit with the person you're paired with. [on a magnetic board she has the girls listed on a table and the boys listed outside the table. She pairs the boys up with the girls as he calls them.] Heidi, you'll be with Eric.
9;10;Heidi;[dissatisfied] Awww!
9;10;Mrs. Garrison;Annie, you'll be a family with Timmy.
9;10;Timmy;Timmiih!
9;10;Mrs. Garrison;Millie, your husband is Craig. Powder, you and Kenny are a loving couple now.
9;10;Stan;[worried] Oh no, dude, he's gonna put me with Wendy.
9;10;Kenny;(So?)
9;10;Mrs. Garrison;Aaand let's see who else we have here, uh...
9;10;Stan;So, I haven't even spoken to Wendy since we broke up.
9;10;Mrs. Garrison;And, Wendy? Wendy will be with Kyle.
9;10;Stan;Kyle??
9;10;Mrs. Garrison;"Bebe, you're paired up with Stan. Lola and Tolkien, Red and Craig, and Esther and Bradley. [the kids begin to pair up. Mrs. Garrison begins to distribute the eggs] Now, I'm going to sign each of your eggs myself, so that we'll know it's the same one at the end of the week. That way if anybody cheats and tries to replace their eggs, we'll know, Eric. [gives him a stern look] All you have to do is make it to Friday with your egg unharmed to prove what great little parents you are. [Tolkien is somewhat shocked that he got a brown egg. Mrs. Garrison returns to the front of the class] Okay children, you can now take the rest of the school period to decorate your egg however you wish. Good luck, and remember, a dead baby means an F for the parents. [the kids begin decorating their eggs, and music begins to play]
[seated at his desk gazing at the students, daydreaming]
Just look at all these little families
Newfound couples in a happy home.
It takes me back to another time
When I had a love of my own. [holds in her hands a signed portrait of Mr. Slave]

[bolts up and starts singing aloud]
Love, love lost long ago, it was special then, it's over now.
[picking flowers in a meadow]
Love, so darn frail, you know? It shriveled and died. I don't know how.

[Stan wanders through the neighborhood with hands in his pockets and reaches Wendy's place. He looks through a window and sees Kyle and Wendy working on their assignment in the kitchen. Mr. Garrison appears next to him]
Love, love lost long ago, it was special then, it's over now.
[prances through town and stops at a bridal shop. She imagines himself as the bride]
Guess that I'll never know how it all went wrong. How how how? 
[sits on her bed holding the portrait, then decides to drive to Mr. Slave's house.]
Well perhaps I should try and boldly go and rekindle that love lost long ago.
[steps out of his car, goes up to the doorbell, and rings it. Mr. Slave opens there, then expresses a muted surprise] Hello, Mr. Slave. [bats her eyes at him]"
9;10;Mr. Slave;Mr. Garrison! Ohoh, Jezuth!
9;10;Mrs. Garrison;[sweetly] Just let me say what I came here to say. I know we had a falling out and... things were said that... shouldn't have been said. I want to apologize for calling you a faggot.
9;10;Mr. Slave;That's, that's wonderful, Mr. Garrison!
9;10;Mrs. Garrison;Well, wait, wait, it gets better. I've forgiven you for walking out on me after I had my sex change, and uh... [gushes] And I'm ready to take you back, Mr. Slave!
9;10;Mr. Slave;Ooooo...
9;10;Mrs. Garrison;Well, give us a kiss!
9;10;Big Gay Al;[appearing in the background] Say, honey, is that the pizza? [Mrs. Garrison is dismayed that it's Big Gay Al Mr. Slave is with]
9;10;Mrs. Garrison;[storms inside] What the hell is he doing here?!
9;10;Mr. Slave;Mr. Garrison, Al and I have been living together for a few months.
9;10;Mrs. Garrison;Well, that didn't take you long, did it?!
9;10;Big Gay Al;Slave, should I leave you two alone?
9;10;Mrs. Garrison;Yes!
9;10;Mr. Slave;No! [walks over to Big Gay Al and stands next to him] Mr. Garrison, there's something you should know. Al and I are getting married.
9;10;Mrs. Garrison;Married?!
9;10;Big Gay Al;[holds Mr. Slave's hand] Yes.
9;10;Mrs. Garrison;You can't get married! You're faggots!
9;10;Mr. Slave;[puts his hand to his forehead] Oh, Jesus Christ.
9;10;Mrs. Garrison;Mr. Slave, I am legally a woman now! If you wanna get married, you have to marry ME!
9;10;Big Gay Al;Oh that's not true! Colorado is about to pass a bill which allows same-sex marriage.
9;10;Mr. Slave;We're getting married right after the bill passes on Saturday.
9;10;Mrs. Garrison;Oh, that's just great! They're gonna let queers and homos get married, huh?!
9;10;Mr. Slave;Okay, that's enough. Out, Mr. Garrison.
9;10;Mrs. Garrison;We'll just see about this, you fudge-packin' fags!! I'll stop that gay-marriage law! [turns and leaves for the front door]
9;10;Mr. Slave;Oh my God, you're just saying that because you're jealous.
9;10;Mrs. Garrison;[turns around] Jealous of what?! I'm doin' this out of principle! To protect the sanctity of marriage! [backs up towards the front door] Fags are gettin' married over MY DEAD BODY!! [slams the door shut. Mr. Slave and Al look at each other]
9;10;;Stan's house, living room. Stan sits at the coffee table steaming over the pairing of Wendy and Kyle. A cordless phone sits before him. He picks it up and dials it. It rings at a house, and Kyle goes over to answer it.
9;10;Kyle;Hello? Oh, hey, dude.
9;10;Stan;So, what are you and Wendy doing?
9;10;Kyle;Oh, we're just makin' a cradle out of an egg carton for our egg. We figure that way it'll be easier to keep safe so we can get an A.
9;10;Stan;Uh huh...
9;10;Kyle;I don't think it's gonna be that hard to keep it from breaking. This whole assignment is stupid.
9;10;Stan;Yeah, well, so is your hat. [hangs up and sets the phone down. Kyle is puzzled, Stan is upset. The doorbell rings and Stan goes to answer it]
9;10;Bebe;[holding their egg] Stan, I need you to watch the egg for a while.
9;10;Stan;I can't. I'm busy.
9;10;Bebe;I've been looking after it all day. I have to go to the hair salon and the candy store!
9;10;Stan;...So take it with you!
9;10;Bebe;Stan, this is our egg. We're both supposed to take care of it.
9;10;Stan;[crosses his arms, turns around and goes inside] Well, maybe I didn't want to have an egg with you, okay, Bebe?!
9;10;Bebe;"[follows him in] Well, whether you wanted to or not, doesn't really matter now! We're going to get graded together! It's your egg too! Own up to your responsibilities! [leaves the egg with him and walks out. Stan stands there with the egg for a few moments, then sits on the sofa and tosses the egg aside. He turns on the TV to catch an episode of ""One Day At A Time""]"
9;10;;South Park, in front of the library. Mrs. Garrison is speaking to a large crowd gathered there.
9;10;Mrs. Garrison;These homosexuals think they can just step all over our traditions! Well I say: Marriage is a holy sacrament between a man and a woman! [the crowd applauds]
9;10;Woman;Who is that lady?
9;10;Man;I don't know, but she is pissed.
9;10;Mrs. Garrison;They passed this law behind our back! We need to tell the governor and the world that gay marriage is not okay! That homosexuals cannot muddy our traditions! And there is only one way for us, all together, to make that message very clear! We need to round up three or four queers and beat the livin' hell out of them! [Everyone else falls silent. She steps out from behind the podium and crouches a bit] Come on, everybody! Let's get some queers, and some trucks, and have us a good old-fashioned fag drag!
9;10;Man 2;Well uh, we were thinkin' we would, you know, just go appeal to the Governor.
9;10;Mrs. Garrison;Appeal to the Governor? Oh,come on! Where's your balls?! Fag drag!
9;10;Man 3;"We don't ""hate"" homosexuals, we, we we just don't want them to be able to marry."
9;10;Man 4;Yeah, we were just thinkin' o' goin' and askin' the Governor to veto the bill.
9;10;Man 5;Yeah.
9;10;Mrs. Garrison;[looking all alone now] Eh fah, fag drag?
9;10;;Governor's building, day. Mrs. Garrison stands with a crowd of supporters inside the Governor's office.
9;10;Mrs. Garrison;Governor, we have collected over one thousand signatures requesting that you veto this gay-marriage bill!
9;10;Bill Owens;[with emotion] Oh jeez, I knew this would happen. First the gay people come in here wanting equal rights, then this bill gets passed and now all the people against it want me to veto it. [slams his right fist on his desk] Why do I have to make this decision??
9;10;Mrs. Garrison;Because you're the governor?
9;10;Bill Owens;I just wanted a big house and lots of respect. I didn't want this kind of responsibility. [rises form his desk and turns away, walking towards a window] I mean, I don't know anything about gay marriage. What argument can I use to deny them their right to a family?
9;10;Mrs. Garrison;Well, think of the children! If you allow gays to get married, then you're also givin' them full rights as parents to adopt. You think kids can be raised by queers??
9;10;Bill Owens;I can't use that argument. There's never been a study done which proves that either way.
9;10;Mrs. Garrison;[gets an idea] But, if you had such a study, a scientific study which proved same-sex couples are incapable of raising a child...
9;10;Bill Owens;Then I would have something to fall back on. So-something to take all the pressure off of me.
9;10;Mrs. Garrison;[confidently] Mr. Governor, I will get you that study.
9;10;;South Park Elementary, day. The kids trickle into class. Bebe approaches Wendy, each one holding an egg.
9;10;Bebe;Hey Wendy, how's your egg doing?
9;10;Wendy;Oh great. It's a pretty easy project. Kyle's really good with the egg. [beams at Kyle. Stan looks on, miffed]
9;10;Bebe;Yeah. [gets angry] I wish I had a partner like Kyle! I went to go pick up the egg from Stan yesterday, and his dog had it in its mouth! Our egg isn't gonna last a week with Stan around!
9;10;Mrs. Garrison;[enters with four big books and drops them on her desk] Okay, students, change of plan! [walks over to the magnetic chalkboard] You've all been doing a great job taking care of your eggs, but now we're going to mix it up a little. Wendy and Kyle will no longer be together.
9;10;Stan;[points at Kyle] HA!
9;10;Mrs. Garrison;Let's see what happens when we put two same-sex couples together to take care of an egg, shall we?! Kyle, you are now with Stan! And Wendy is with Bebe! [Kyle and Wendy exchange glances]
9;10;Kyle;Why?
9;10;Mrs. Garrison;Come on, Bebe. We'll take your egg for you and Wendy to look after.
9;10;Bebe;Oh, goodie. [moves over to take a seat next to Wendy]
9;10;Mrs. Garrison;And we'll just take this egg for Stan and Kyle to look out for. [takes Wendy's egg...]
9;10;Wendy;No. No, that's my egg.
9;10;Mrs. Garrison;Wendy, we're doing an experiment. [...and gives her Bebe's egg...] Here you go, boys. [...and gives Wendy's egg to the boys]
9;10;Wendy;But I made that egg. Mr. Garrison, please. Youyou can't give my egg to Stan, he'll break it.
9;10;Mrs. Garrison;[ebullient] Hoh now, what makes you say that, Wendy? I'm sure two boys can handle an egg just fine... [goes towards the chalkboard, scheming] And if not, we'll certainly prove a point to that goddamned Governor, won't we?
9;10;Kyle;Who?
9;10;Mrs. Garrison;[shifty] Never mind, just carry on, children. Just carry on as two reckless little boys will.
9;10;;Kyle's house, day. He and Kyle are in the kitchen. Kyle is designing a container for their egg.
9;10;Kyle;Okay, there. Now we can carry this egg around in this case without it getting cracked.
9;10;Stan;Alright, give it to me. I'll take it home tonight.
9;10;Kyle;Look, Stan, you want me to just take care of this egg?
9;10;Stan;[suspicious] Why do you say that?
9;10;Kyle;It's just that... I really need this A, Stan. And Bebe did say you almost broke your last egg.
9;10;Stan;That's because I was pissed off!
9;10;Kyle;At who? [the doorbell rings] Heh- hang on. [goes to answer the door and finds Wendy outside]
9;10;Wendy;[wistfully] I wanna see my egg.
9;10;Kyle;Huh?
9;10;Wendy;[enunciates] I want to see my egg.
9;10;Kyle;Wendy, it isn't your egg anymore!
9;10;Wendy;Yes it is. I made it, I decorated it.
9;10;Kyle;Well, you might have made it, but we're the ones who are taking care of it now. You have your own egg to look out for!
9;10;Wendy;...I just wanna hold my egg for a couple of minutes.
9;10;Kyle;[consoles her a bit, but turns her away] Wendy, I just wanna get an A, okay? Let's not make this any more confusing than it already is. <>[Stan peeks out from the kitchen and sees Kyle's arm around Wendy]
9;10;Wendy;Don't let anything happen to it, please. [Stan gets upset and disappears back into the kitchen]
9;10;Kyle;Wendy, nothing's gonna happen to the egg. You can have it when the week is over and I have my grade. [slams the door on her and returns to the kitchen, where an angry Stan is sitting in his chair with his arms crossed] Freakin' weirdos, man.
9;10;Stan;You think you're so great, don't you?! Well guess what?! Maybe I don't need your help! I'm taking the egg home tonight, and I'm gonna show everybody tomorrow that I'm every bit as good an egg-take-care-over as you! [hops off the chair and rushes out the side door]
9;10;Kyle;What the hell is wrong with everybody?
9;10;;South Park Elementary, day. Mrs. Garrison enters with more books.
9;10;Mrs. Garrison;Okay, children, it's Wednesday! Time for an official egg check! Heidi and Eric?
9;10;Heidi;Our egg is fine.
9;10;Mrs. Garrison;[writes OK on their row] Okay, Annie and Timmy?
9;10;Timmy;TimmiIH!
9;10;Mrs. Garrison;[writes OK on their row] Good. Millie and Clyde, I saw yours before class. [writes OK on their row] Powder and Kenny?
9;10;Kenny;(Our egg is okay.)
9;10;Mrs. Garrison;[writes OK on their row] Now how about our gay couples? Stan and Kyle?
9;10;Stan;[determined, willful] Fine!
9;10;Mrs. Garrison;What?
9;10;Stan;No problems at all!
9;10;Mrs. Garrison;[turns around in anger] That's impossible! [snatches the egg from Stan's hand and looks it over carefully] Are you sure you didn't break it and switch eggs on me?! Where's my signature?!
9;10;Stan;It's right there, see? [leans towards Kyle in fear. Wendy looks down and away from the action]
9;10;Mrs. Garrison;Two boys can't possibly take care of an egg!
9;10;Kyle;Dude, it's totally fine.
9;10;Mrs. Garrison;It isn't fine! It has two daddies! You call that fine?! It may be fine on the outside, but inside it's confused and embarrassed! Look at the freak egg! It has two daddies! [taunts the egg directly] Two daddies! Two daddies! Come on, class, let's rip on the freak egg! Two daddies! Two daddies!
9;10;;Governor's building, day.
9;10;Field reporter;Tom, I'm standing outside the Governor's office, where in just two days, the Governor can either sign or veto the new bill allowing gay marriage. Same-sex couples from all over the state have shown up in support, [Mr. Slave and Big Gay Al are there] while dissenters have also converged. The governor is about to give a statement.
9;10;Bill Owens;"I believe that I might have come up with a compromise to this whole problem that will make everyone happy! People in the gay community want the same rights as married couples, but dissenters don't want the word ""marriage"" corrupted. So how about we let gay people get married, but call it something else? [everyone listens quietly] You homosexuals will have all exactly the same rights as married couples, but instead of referring to you as ""married,"" you can be... butt buddies. [long silence] Instead of being ""man and wife,"" you'll be... butt buddies. You won't be ""betrothed,"" you'll be... butt buddies. Get it? Instead of a ""bride and groom,"" you'd be... butt buddies."
9;10;Mr. Slave;We wanna be treated equally!
9;10;Bill Owens;"Y-you are equal. It's just that instead of getting ""engaged,"" you would be... butt buuuddies. And everyone is happy!"
9;10;Woman;Well what about lesbians?!
9;10;Bill Owens;Well like anyone cares about fuckin' dykes. [the crowd goes into an uproar] Oh, God, I was sure that would work.
9;10;;South Park Elementary, day. Mrs. Garrison is at her desk reviewing daily egg evaluations. He's reading Stan and Kyle's.
9;10;Mrs. Garrison;Damnit, damnit! Stan and Kyle's egg is still doin' fine! Those little assholes are screwin' up my entire plan! [there's a knock on the classroom door] Yes, what?! [Cartman walks in with his shattered egg and sits on the chair next to the desk. He places the egg on the desk, crosses his arms and looks away. Mrs. Garrison looks at the egg and is dismayed] What the hell is this?!
9;10;Cartman;I broke the egg.
9;10;Mrs. Garrison;You broke your egg?? Uh but you're partnered with a girl.
9;10;Cartman;I tried to cover it up, tried to put it back together with modeling glue, tried to seal it with a soldering gun, but, I give up. I can't hide it, I broke the egg.
9;10;Mrs. Garrison;Did you tell anyone else about this?
9;10;Cartman;...No.
9;10;Mrs. Garrison;Did you tell your egg partner, Heidi?
9;10;Cartman;No. That's why I'm here. I think you should still give Heidi an A on the project. You see, I broke the egg, not her. And so, I should get an F, and she should get an A, which means that together the grade should average out to C minus for both of us.
9;10;Mrs. Garrison;I can't do that, Eric!
9;10;Cartman;Damnit! I knew you'd say that! You always have it out for me!
9;10;Mrs. Garrison;You have to get an A, Eric. Here: I'll sign this new egg for you. We'll pretend this never happened, all right? [goes about making a duplicate egg for Cartman] Just... put on the old hair, color in the same eyes... There we go, good as new. [places it near Cartman and puts the shattered one in his desk drawer] Go enjoy the rest of your recess.
9;10;Cartman;[thinks about what just happened] Mr. Garrison..., you've never been this cool to me before.
9;10;Mrs. Garrison;...Okay, well, you're welcome, Eric. Now, just run along. [continues grading papers]
9;10;Cartman;...Why are you doing this?
9;10;Mrs. Garrison;Because I'm a nice teacher, all right?
9;10;Cartman;What do you want from me?
9;10;Mrs. Garrison;Nothing! It's all okay! Just take your damn egg!
9;10;Cartman;...No.
9;10;Mrs. Garrison;[quickly grabs Cartman by the collar] Eric, you've never been anything but a problem for me! You're taking that egg! And if you break it again, I'll break both your legs, and burn down your house! Do you hear me?!
9;10;Cartman;[choking] Yes teacher.
9;10;Mrs. Garrison;[releases him] Get out of my face! [Eric gets his new egg and rushes out of the classroom] Urrgh, this scientific study isn't turning out the way I planned! Looks like I'm gonna have to... intervene.
9;10;;Akbar, night, a seedy side of town. Mrs. Garrison enters and looks around, sees her target and walks over. She sits opposite a rough-looking man.
9;10;Mrs. Garrison;Are you Jakartha?
9;10;Jakartha;Who the hell are you?!
9;10;Mrs. Garrison;Mrs. Garrison. I spoke to your associates on the telephone.
9;10;Jakartha;Ahh yes, you are interested in my services.
9;10;Mrs. Garrison;I have a little... problem I need taken care of. I heard you're the best.
9;10;Jakartha;Who do you want me to kill? [Mrs. Garrison pulls out a photo from her purse and puts it face down on the table, then slides it towards Jakartha. Jakartha picks it up and looks at it. It's a picture of Stan and Kyle's egg] What is this?
9;10;Mrs. Garrison;It's an egg.
9;10;Jakartha;You want me to kill an egg?
9;10;Mrs. Garrison;I can pay two thousand now, three more when the job is finished.
9;10;Jakartha;What do you expect me to do with it?
9;10;Mrs. Garrison;I don't care. Scramble it, fry it, do what you will! It has to look like an accident.
9;10;Jakartha;I am a serious assassin! Get out of my face!
9;10;Mrs. Garrison;What's the matter? You... afraid you can't do it? Can't say that I blame ya. That egg has caused me nothin' but problems since day one! [rises and steps away from the table] I guess... you're not as good as they say you are...
9;10;Jakartha;[jabs a Bowie knife into the table and rises violently] I am the greatest killer the world has ever seen!!
9;10;Mrs. Garrison;Then why are you scared of one little egg?!
9;10;Jakartha;I will murder that egg! Then I will make it curse the day it was laid!
9;10;Mrs. Garrison;That's more like it!
9;10;;Stan's house, dawn. Stan packs his books into his backpack, then goes to the phone table to see his egg.
9;10;Stan;Day five. I made it! [the phone rings, and he answers] Hello?
9;10;;Kyle's house, dawn. His family is eating breakfast in the kitchen.
9;10;Kyle;Dude, did you hear what's happening?
9;10;Stan;What?
9;10;Kyle;Garrison is taking us all on a field trip today. He wants to do the final egg check in front of the Governor's office!
9;10;Stan;Governor's office?
9;10;Kyle;She's really taking this grade seriously, Stan. I'm gonna come over so that we can take our egg to school together, all right?
9;10;Stan;Aah, you'd like that, wouldn't you?! I took care of this egg, Kyle, not you!
9;10;Kyle;Okay, Stan, you've been an asshole to me all week! What is up?!
9;10;Stan;What's up?! Oh, nothing except that you've been trying to impress Wendy all week long like a pathetic dickhole!
9;10;Kyle;Impress Wendy??
9;10;Stan;You've set it all up to look like you're this awesome prince and I'm just a loser!
9;10;Kyle;What the hell are you talking about?!
9;10;Stan;"Well guess what?! I'm gonna take this egg to class myself! And I'm gonna hold it up in front of Wendy, and say ""See?! I'm every bit as good as Kyle is."" [a laser dot snakes its way up the egg. Stan notices this with some surprise, and the egg explodes in his hand. Some of it lands on his face and cap. Jakartha appears behind the bushes across the street and lowers his sniper rifle]"
9;10;Jakartha;Almost too easy. [drops down and crawls away]
9;10;Stan;AAAAAAAAAAAAAAAA!
9;10;Kyle;Stan?
9;10;Stan;AAAAAAAAAAAAAAAA! AAAAAAAAAAAAAAAA!
9;10;;Stan's house, day. He's in his room with his head down on his desk buried in his arms, with the shattered egg next to him. His door opens and Kyle steps in.
9;10;Kyle;Stan? Stan, I think we should talk.
9;10;Stan;[softly crying, muffled] Dude, you should just go be with Wendy and be happy.
9;10;Kyle;Stan, I don't like Wendy. [Stan's raises his head and listens] All I cared about was getting an A in this stupid project!
9;10;Stan;Yeah well, I blew it. Now we're gonna fail and Wendy thinks I'm a total loser.
9;10;Kyle;I thought you didn't care about Wendy anymore.
9;10;Stan;I don't. She's totally lame. [he drops his head into his arms again.]
9;10;Kyle;Stan, there was never anything between Wendy and I. [Stan's raises his head again] I wouldn't go out with my best friend's ex-girlfriend.
9;10;Stan;[hops off his chair and approaches Kyle, head down] I'm sorry I didn't trust you, Kyle. I'm obviously just a crappy best friend to have.
9;10;Kyle;Yyeah well, I-I'm sorry I didn't trust you either.
9;10;Stan;Huh?
9;10;Kyle;[turns away and walks a few paces] It was really important for me to get an A, Stan. And Bebe said you were so reckless with your egg, so I made a fake one for you [reaches into his jacket and pulls out an egg] and kept the original safe with me.
9;10;Stan;That... [walks up to Kyle and points at the egg] That's the real egg with Garrison's signature?
9;10;Kyle;Yeah dude. I'm sorry.
9;10;Stan;Then... then Wendy won't think I'm a total loser!
9;10;Kyle;Yeah. And I can still get my A!
9;10;Stan;Come on, buddy, let's go! [walks happily towards his door. Kyle steps forward, then stops]
9;10;Kyle;Stan... [Stan turns, then he turns away] Do you really think my hat is stupid?
9;10;Stan;[walks back and puts his left hand on Kyle's shoulder] As a matter of fact,... I think it is the nicest hat I've ever known. [Kyle smiles and Stan pats him twice on the back] Come on! [they head out]
9;10;;Governor's office, outside. The Governor is speaking.
9;10;Bill Owens;Today is a very big day in which I'm supposed to make a very big decision. As some of you know, my biggest issue with gay marriage regards child-rearing. And a new study has just been concluded which will give me the ability to take no personal responsibility in this decision.
9;10;Big Gay Al;A new study?
9;10;Bill Owens;Here with the results of that study is the lovely Mrs. Garrison. [steps aside and gives her the podium.]
9;10;Mrs. Garrison;[floats in like a diva] Thank you, Governor.
9;10;Mr. Slave;[strokes his temple] Oh, Jesus Christ.
9;10;Mrs. Garrison;Ladies and Gentlemen, with the help of some adorable fourth-grade students, we've completed our scientific, non-biased study of fags having kids. Come on up, children. [the kids file into view and spread out before the podium. Jakartha shows up as well and stands next to the white chalkboard.] The parents were grouped together as male and female. As you can see...
9;10;Aide;[rushes up with a phone] Uh, Mrs. Garrison. You have an emergency phone call.
9;10;Mrs. Garrison;[takes the phone and answers] Yes, what is it?! I'm a little busy!
9;10;Kyle;[in the back seat of a speeding cab with Stan] Mr. Garrison, it's Kyle! Our egg is okay! We'll be there in a couple of minutes!
9;10;Mrs. Garrison;[turns away from the mic] What?? Y-your... you're too late!
9;10;Kyle;Don't fail us! We'll be right there!
9;10;Mrs. Garrison;No you can'- Hello? Hello!! [hauls Jakartha into view by the lapel] You told me you killed that freak egg!!
9;10;Jakartha;I was sure I did!
