2;16;Stinky;Quiet down, we're watching television. [Terrance and Phillip laugh]
2;16;Terrance;Oh, Phillip, what a precious gift! [opens it]
2;16;Phillip;That's right, Terrance. This is the season for sharing. [farts on the gift, and both laugh]
2;16;Howard;[appears with rifle in hand] The cops are here!
2;16;Grandma;Howard!
2;16;Harold;How did you get out, son?
2;16;;Outside. The officers have hunkered down.
2;16;Police Chief;[on the bullhorn] All right, Manson, we know you're in there! Come out peacefully, and we'll shoot you!
2;16;Officer;[whispers into the chief's ear] Tell him we won't shoot him, Boss.
2;16;Police Chief;[whispers back] Oh, yeah. That's a good idea. [on the bullhorn] Come out peacefully, and we won't shoot you! [Howard and Grandma peek out]
2;16;Grandma;Oh, look. Police Chief Stevens got a new haircut.
2;16;Howard;[points the rifle at her] Get down, Ma!
2;16;Manson;Hey, man, don't point a gun at your own mother!
2;16;Howard;What the hell is wrong with you, Manson? You're acting all funny! Everybody just sit down and shut up! We're not going back to the big house!
2;16;Harold;Well, Howard, you've done it again! You've ruined Christmas!
2;16;;Outside Grandma's house. The press shows up.
2;16;Field Reporter;This is Robert Pooner reporting live from Nebraska, where escaped convict Charlie Manson has walled himself up in a house. [the camera zooms in on Grandma's house] We understand that there are hostages, and that the situation is critical, [zoom out], so we would like to remind you all that this live hostage crisis is being brought to you by Palmoral Sun Block [SPF 200]. Remember, if it isn't Palmoral, you're gonna get cancer.
2;16;;Off camera, the Marshes drive up and get out. Sharon approaches the police.
2;16;Sharon;What's going on here?!
2;16;Chief Stevens;We've got a critical situation, ma'am. Charlie Manson is holding everybody inside hostage.
2;16;Sharon;Is this the Cartman residence?
2;16;Chief Stevens;Yes, ma'am.
2;16;Sharon;Give me that! [grabs the bullhorn and] Stanley! This is your mother!
2;16;;Inside
2;16;Stan;Oh ooh.
2;16;Kyle;What's your mom doing here, dude?
2;16;Sharon;[outside] Young man, I have had it! You have disobeyed me for the last time! [Grandma, Howard and Manson look out the window. They turn to face Stan.]
2;16;Howard;Wow, she's really pissed.
2;16;Manson;[pointing] I'm glad I'm not you right now, kid.
2;16;;Outside.
2;16;Sharon;What do you have to say for yourself, Stanley?!
2;16;Stan;[from inside the house] ...Sorry.
2;16;Robert Pooner;Still more developments in the Manson hostage crisis. Uh, it appears now that eight-year-old Stan Marsh [picture shown] is in BIG, big trouble. He apparently disobeyed his parents, left home without telling them, and uh, Tom, his- his mother is very disappointed with him.
2;16;Howard;Damn it! What are we gonna do?
2;16;Florence;Sshhhh! We're watching television.
2;16;;Terrance and Phillip are teasing a reindeer with a red nose - Rudolph. Terrance runs up and farts on its face, and the deer flinches. Terrance runs back as both men laugh.
2;16;Phillip;[running up] Waitwaitwaitwait. [farts on Rudolph's rear and runs back laughing]
2;16;Terrance;[running up] Check out this one.  [farts on Rudolph's face and runs back laughing]
2;16;Phillip;[running up] Hold on, hold on. Over here, over here. [farts on Rudolph's rear and runs back laughing]
2;16;Terrance;[running up] Okay, here I come, okay. [farts on Rudolph's face and runs back laughing]
2;16;Phillip;[running up] Okay, waitwait waitwait. [farts on Rudolph's rear and runs back laughing]
2;16;;The living room.
2;16;Chief Stevens;[outside, with bullhorn] Come out with your hands up!
2;16;Howard;Damnit, Dad, why didn't you put a back door on this house?!
2;16;Harold;"Well, there's that old window in the bathroom; you could probably squeeze through there."
2;16;Howard;That's it! We're going out the bathroom window! Come on, Manson!
2;16;Manson;But I gotta see what happens.
2;16;Howard;Come on, damn it! [Manson hurries, panting] Well, it's good seeing you all. Don't move until we're gone or I'll shoot you dead. Happy holidays.
2;16;The Adults;Happy holidays. [Uncle Howard and Manson leave]
2;16;Stan;[walks to the window, looks out, sees his parents, then turns to Kyle] Dude, they're gonna kill me.
2;16;Chief Stevens;[outside] All right, Manson, this is it! We're coming in after you! There's gonna be a lot of bloodshed, and a lot of innocent people are gonna die! You've got until 100-Marshmallow to come out!
2;16;Officer;1-Marshmallow, 2-Marshmallow,...
2;16;;The bathroom. Howard works on the window.
2;16;Howard;"[""3, Marshmallow,"" The window opens] All right, it's open! Let's go!"
2;16;Stan;[walking in] 'Scuse me. I wanna go with you.
2;16;Manson;Huh?!
2;16;Stan;Please, I don't wanna go back with them.
2;16;Manson;But Stan, your mother and father are out there!
2;16;Stan;I know! They've come to punish me. All they wanna do is make me pay for comin' to Nebraska in the first place.
2;16;Howard;All right, kid, you can come. Now, let's go. [starts going through the window. Stan steps on the toilet seat, but Manson stops him.]
2;16;Manson;Stan, I wanna talk to you about family. [Uncle Howard is out.]
2;16;Stan;What?!
2;16;Howard;[popping up] What?!
2;16;Manson;You see, I had a family once. At least, I called them my family. Really, they were nothin' but a gang of people I thought were my friends. Ah after we killed a bunch of people together, I realized that my real family was who took care of me, and who took the time to care about what I did.
2;16;Stan;But they don't care about me, they just want to punish me.
2;16;Manson;If they don't care about you, would they have driven nine hours to Nebraska?
2;16;Stan;[pondering] I guess you're right, Uncle Charlie. Thanks. [they hug]
2;16;Howard;Now can we go??
2;16;Manson;No, Howard. You go ahead. I've got something to say. [walks out the bathroom door]
2;16;Howard;Oh, weak!
2;16;;The living room. Manson walks in.
2;16;Manson;Folks, I apologize for this whole mess. I'm going to surrender. Somebody show the police a white flag.
2;16;;Outside. The countdown continues.
2;16;Officer;[on the bullhorn] 90-Marshmallow, 91-Marshmallow [to Police Chief Stevens] This is making me hungry for marshmallows [on the bullhorn] 92-Marshmallow [the front door opens and the police get into positions. The flag appears, followed by Kenny, carrying it]
2;16;Chief Stevens;Look out, he's got a white flag! [his officers fire away, killing Kenny and breaking the flagpole in half]
2;16;Manson;[peering out] Oh my God, they killed the little orange-coat kid!
2;16;Kyle;[peering out] You bastards! [the police don't react. Everyone now pours out of the house]
2;16;Chief Stevens;[surprised] They're surrendering!
2;16;Cops;[run up and handcuff the pair] Okay, grab a hold of him. You're under arrest, buddy. [two of them beat on Kenny's corpse]
2;16;Blond Cop;All right you, spread 'em! [puts the cuffs on Kenny]
2;16;Chief Stevens;[helping in Manson's arrest] You're going back to prison to rot, Manson!
2;16;Manson;Good! I deserve to!
2;16;Chief Stevens;What??
2;16;Manson;[hands behind his back] I can never make it up to the families that I destroyed, but at least I'll make an example for anyone else thinking that crime [softly] is an answer.
2;16;Chief Stevens;Stop that. [the officer releases Manson]
2;16;Manson;You see, I get it now! I finally understand what the holidays are all about. Boys, don't you see? You can't let things get you down during the holidays, because being happy is what the holidays are all about!
2;16;Kyle;Charlie's right! I'm not gonna let some fake Mr. Hankey spoil my holidays.
2;16;Manson;"I've been such a bastard all these years, and I finally understand. And it it it feels great! If I feel like- I feel like I'm in my own Christmas special. You see...
Holidays are that special time
When we laugh and sing and feel warm and cozy
Forget about being angry for a day [picks Elvin up]
Remember how it felt to be a child
Opening presents on Christmas mornin' 
That's the way that we should all feel now
So I say Happy happy happy happy holy happy happy happy
Holidays"
2;16;Everyone Else;Happy happy happy happy holy happy happy happyHolidays
2;16;Manson;"Happy Kwanzaa, too
From me to you
Happy Holidays, you guys."
2;16;Chief Stevens;Happy Holidays, Bob.
2;16;Officer Bob;Happy Holidays, Chief.
2;16;Chief Stevens;Come on, Manson. You belong in jail. [finally cuffs him]
2;16;Manson;You're darn right I do.
2;16;Howard;[being cuffed] Well, I guess I'll be going, Mom and Dad. I hope you can forgive me.
2;16;Grandma;Oh, of course we forgive you, son. It was nice of you to pop in for the holidays.
2;16;Grandpa;Yes. Now, watch that ass in prison, son.
2;16;Howard;I always do. See ya, Eric. Thanks for all your help.
2;16;Cartman;See ya, Uncle Howard. [mad] Thanks for being such a great role model for me. [very softly] Piece of crap.
2;16;Stan;I hope you can forgive me, too, Mom.
2;16;Sharon;Oh, Stanley. Let's just forget the whole thing and have a nice holiday back home.
2;16;Stan;Really?
2;16;Randy;Sure. We'll punish you after the holidays.
2;16;Stan;Hooray! Uh, I mean, wait. What?
2;16;Robert Pooner;[wrap up] And so, Manson is hauled off to jail to rot in his cell. Everything is back to normal, and I guess the only thing left to say is, God bless us, everyone.
2;16;;Nebraska State Penitentiary.
2;16;Manson;"[in a cell with three other mates, reading from his latest book] ""And I guess that's what I've learned. I'm sorry for what I did, but that doesn't make up for it. I deserve to be in jail. All I hope is that I don't make mankind lose faith in itself. Yes, there's murderers in the world. There's rapists and thieves. But those are the vast minority. The majority of mankind is made up of caring people, who try every day to do what they think is right. And that's the spirit of the season."" What do you think, guys?"
2;16;Inmate;"It sucks, just like all your other books. [Manson puts his book next to the others and walks off: ""AH, MILAN,"" ""OBSERVATIONS FROM THE FOREST,"" ""Are You There God? It's Me. Manson""]"
2;16;Manson;Well, Guh Good night, you guys. Happy Holidays.
2;16;Inmate;Shut up! [Manson turns off the lights. Soon, noise is heard outside the cell]
2;16;Manson;What was that? [turns off the lights] What the?! [surprised to see the Cartmans and the boys inside the cell]
2;16;Cartmans/Boys;"Merry Christmas, Charlie Manson! 
[Grandma bears a cake. Manson melts, smiling. End credits soon roll]
""Hark,"" the herald angels sing,
""Glory to the newborn King
Peace on earth, and mercy mild
God and sinners reconciled""
[Manson joins them] Joyful all ye nations rise
Join the triumph of the skies
With angelic host proclaim..."
2;16;Stan;Dude, this is pretty fucked up right here.
