2;17;Stan;How do we stretch that into five minutes?
2;17;Tweek;"They're taking my underpants![""We won't stop until we have underpantsYum tum yummy tum day""]"
2;17;Kyle;"[looking down] Will you stop with the underpants gnomes, Tweek?! We have to work here!  [""Time to go to work""]"
2;17;Tweek;"[points at the gnomes] Aaaggghhh! [""work all nightSearch for underpants, hey""They open the bottom drawer and go for the underpants]"
2;17;Stan;"What the hell? [""We won't stop""]"
2;17;Cartman;"[""until we have underpants""] Well, I'll be damned."
2;17;Tweek;"[""Yum tum yummy tum day!""] That's my last pair of underpants! [""Time to go to work, work all nightSearch for underpants, hey..."" The gnomes go for the door, and the boys hop off the bed to follow. One gnome stops and faces the boys]"
2;17;Kyle;Sshh, don't scare him.
2;17;Stan;Hey there, little guy.
2;17;Cartman;Bad! [whacks the gnome with a stick]
2;17;Kyle;Cartman!
2;17;Cartman;What?!
2;17;Kyle;Why do you always have to hit stuff with a stick?!
2;17;Cartman;Well, look at him. He's all, you know, uh l-look at him. [whacks him again]
2;17;Gnome;Is that all you've got, pussy?
2;17;Cartman;What?! [advances]
2;17;Stan;Hey, he talks!
2;17;Cartman;Yeah, he called me a pussy! I'm not a pussy, you're a pussy!
2;17;Gnome;You're a pussy, pussy!
2;17;Cartman;Ey!
2;17;Stan;Dude, why are you taking Tweek's underpants?
2;17;Kyle;Yeah, look what you're doing to this poor kid.
2;17;Tweek;Waggh.
2;17;Gnome;Stealing underpants big business.
2;17;Stan;Business? Wait, do you know anything about business?
2;17;Gnome;Sure, that's what gnomes do.
2;17;Kyle;Show us.
2;17;Gnome;O-kay. Follow me. [goes for the door]
2;17;Cartman;[muttering] Little pussy gnome. Don't call me a pussy, pussy gnome.
2;17;;The woods. The gnome leads them on to his cave.
2;17;Gnome;Not much longer now.
2;17;Cartman;Oh, are you gonna take us to your little pussy house?
2;17;Gnome;No, pussy, I'm taking you to my village.
2;17;Cartman;Oh, your pussy village?
2;17;Stan;Cartman, will you just shut up and let him show us?
2;17;Gnome;[reaches a tree, knocks on its base and a door opens] Follow me.
2;17;Cartman;[the boys look at him] I hope we're not wasting our time with this little pecker.
2;17;;Starbucks, early morn. Workers put on the finishing touches to the coffee store.
2;17;Postum;Well, it looks like Harbucks will never make it in this town. [turns around] All right, boys, that's it. Pack it up, we're movin' out of town.
2;17;Worker 1;Aw, but we just finished.
2;17;Postum;I know, but these folks obviously don't want us here.
2;17;Worker 2;But what will become of us?
2;17;Postum;Oh, quit being so melodramatic, Sanchez. Jesus Christ!
2;17;;Underground. The boys are still following the gnome.
2;17;Stan;Damn, dude, this place is huge!
2;17;;Before them is a pile of underpants as tall as a man. Some of them are colored.
2;17;Kyle;Yeah. It's almost as big as Cartman's ass.
2;17;Cartman;[exhales] No it isn't, you guys!
2;17;Gnome;This is where all our work is done.
2;17;Cartman;So what are you gonna do with all these underpants that you steal?
2;17;Gnome;Collecting underpants is just phase 1. Phase 1: collect underpants.
2;17;Kyle;Sooo, what's phase 2?
2;17;Gnome;[has no response. Looks around, then calls out to the other gnomes on the underpants mound] Hey, what's phase 2?
2;17;Gnome 2;Phase 1: we collect underpants.
2;17;Gnome;Yeah yeah yeah, but, what about phase 2?
2;17;Gnome 2;[says nothing, then] Well, phase 3 is profit. Get it?
2;17;Stan;I don't get it.
2;17;Gnome 2;[walks up to a large chart] You see,Phase 1: collect underpants. Phase 2: ... Phase 3: Profit.
2;17;Cartman;Oh, I get it.
2;17;Stan;No you don't, fatass!
2;17;Kyle;Do you guys know anything about corporations?
2;17;Gnome;You bet we do!
2;17;Gnome 2;Us gnomes are geniuses at corporations.
2;17;Gnomes;[three of them move a cart up a track]Time to go to work, work all nightSe--
2;17;Center Gnome;[the cart falls off the track and on down] Jesus Christ, look out!
2;17;;The cart lands on Kenny.
2;17;Stan;Oh my God, they killed Kenny.
2;17;Kyle;You bastards. Listen, we have to give a huge speech tomorrow about corporate takeovers.
2;17;Gnome;Holy shit! We've killed your friend!
2;17;Stan;Yeahyeahyeah. Look. We've gotta know about corporate takeovers tomorrow or we're screwed.
2;17;Gnome 2;Christ, we squished him like a bug!
2;17;Stan;Do you know anything about corporate takeovers?
2;17;Gnome;Well, we can explain that to you easily.
2;17;Gnome 2;Yes, for a price.
2;17;Kyle;What?
2;17;Gnome;You know.
2;17;Stan;Underpants?
2;17;Gnomes;Underpants!
2;17;;Harbucks, daytime. Prop. 10 supporters are out in force and Toto is performing.
2;17;Lady Member;[taking the stage] Toto, ladies and gentlemen!
2;17;;The band leaves.
2;17;Prop. 10 Supporter;Yeah, Toto! Whoo, Toto! Woo!
2;17;Lady Member;All right. And now, before we all vote yes on Prop. 10, here to remind us why are the lovable, innocent children.
2;17;Stan;Uh. Since we are so concerned with the corporate takeovers, we went and asked our friends, the underpants gnomes, and they told us all about big corporations.
2;17;Supporter;Underpants gnomes?
2;17;Kyle;Big corporations are good!
2;17;Supporter;What?
2;17;Supporter 2;What's this?
2;17;Supporter 3;Good? [the Lady Member is cross]
2;17;Kyle;Because without big corporations we wouldn't have things like cars and computers and canned soup.
2;17;Stan;Even Harbucks Coffee started off as a small, little business. But because it made such great coffee, and because they ran their business so well, they managed to grow and grow until it became the corporate powerhouse it is today. And that is why we should all let Harbucks stay!
2;17;;The crowd is stunned.
2;17;Townsman;Ogh.
2;17;Lady Member;That's not what you said last time.
2;17;Kyle;Uuuh. Well, the truth is, we didn't write that paper last time.
2;17;;Gasps from the crowd.
2;17;Mr. Garrison;You little turds!! You've ruined my life for the last time!!
2;17;;Officer Barbrady and another man haul him off. Mrs. Tweek claps for the boys and goes onstage.
2;17;Mrs. Tweak;These boys are absolutely right. We've been using these poor kids to pull at your heartstrings for our cause, and it's wrong. We're as low and despicable as Rob Reiner. You keep protesting and complaining, but did any of you ever even bother to taste Harbucks coffee? [shot of the town committee. The crowd blinks] Harbucks coffee got to where it is by being the best. Don't you think you should at least try it?
2;17;;The crowd parts as Postum exits Harbucks with a tray of his coffee, then closes in to get the coffee. Some people taste it.
2;17;Townsman;Hey, this is pretty damn good.
2;17;Townsman 2;Yeah, it doesn't have that bland, raw, sewage taste that Tweek's coffee has.
2;17;Richard;[comes over for a taste] Hey. Hey, that is good.
2;17;Postum;It's a French roast.
2;17;Richard;It's subtle and mild. Mild, like that first splash of sun on an April  morning. This coffee is coffee the way it should be.
2;17;Postum;Hehey, no hard feelings, Tweek. You know, we still need someone to run this Harbucks coffeehouse. I'm sure it will make a lot of money.
2;17;Richard;Thank you, Mr. Postum, but I think we'll be happy with the money we make selling our son into slavery.
2;17;Tweek;Aggghhh!
2;17;Richard;Just kidding, son.
2;17;;Everyone laughs. The gnomes come and remove the pants from a townsman behind Tweek's right shoulder.
2;17;Cartman;I love you guys. [more laughter]
2;17;;'[End of Gnomes. And what do the gnomes sing?Time to go to work, work all nightSearch for underpants, hey!We won't stop until we have underpantsYum tum yummy tum day!]'
