2;2;;South Park.
2;2;Dr. Doctor;Listen, Team B. We've found another path to the generator. There's actually a nice heated walkway to it, so you don't need to walk through all that sewage.
2;2;Kenny;(Are you fuckin' telling me that I could've fuckin' gone that way?!)
2;2;Dr. Doctor;Oh... Well, forget I said that, then. Listen, Team B, you should be seeing a large drift of snow with some metal sticking out of it just to your left.
2;2;Kenny;(Yup! I see it in the drift.)
2;2;Dr. Doctor;Good. Head towards it. Team A out.
2;2;Cartman;What if Mephesto never wakes up, and I never find out who my father is?
2;2;;Kenny heads toward the generator and a dinosaur casts its shadow on both of them.
2;2;;The studio. Ned, Jimbo and the Mayor are eating again. The camera shows that Greenfield and the assistant have joined Eric Roberts as casualties to cannibalism. Barbrady is seen working on a leg and some ribs.
2;2;Mayor McDaniels;My God, what a harrowing tale of human drama this is. All of us doing what we must to survive.
2;2;Jimbo;It is amazing what people can do under stress. Just look at the pyramids. Nobody knows how they built those, or who.
2;2;Announcer 1;Who built the pyramids? Was it the Babylonians? Officer Barbrady? Samaritans?
2;2;;The generator. Kenny has opened the door and is ready for new orders.
2;2;Kenny;(Okay, I've reached the generator)
2;2;Dr. Doctor;Roger, Team B. [To Team A.] He's reached the backup generator. [To Kenny.] Team B, can you see the two copper nodes?
2;2;Kenny;(Roger.)
2;2;Dr. Doctor;Good. Now, is there a wire connecting them?
2;2;Kenny;(Negative.)
2;2;Dr. Doctor;Damn! The wire connecting the nodes is gone! We need to complete the circuit between them, or we're screwed.
2;2;Kyle;D'you have any wire here?
2;2;Dr. Doctor;There's no time! Once these lights flicker out all the patients on life-support are going to die!
2;2;Kenny;(I'll stick 'em together)
2;2;Dr. Doctor;No, Kenny, you can't. There must be some other way! He's going to make the connection himself, with his hands.
2;2;Kyle;No, he'll die!
2;2;Cartman;Go, Kenny!
2;2;Dr. Doctor;Kenny! Nnnoooooo!
2;2;Kenny;(Goodbbyyyyee-ugh!)
2;2;Stan;Oh my God, they've killed Kenny!
2;2;Kyle;You bastard!
2;2;;The lights stabilize.
2;2;Chef;The power!
2;2;Dr. Doctor;Quickly! Get the scanner running again!
2;2;;The scanner is brought in.
2;2;Dr. Doctor;We've got a chance now!
2;2;;The White House. Liane has bedded her way up to the President, and she's in bed with him now.
2;2;President Bill Clinton;Well, okay, Mrs. Cartman, I'll legalize 40th trimester abortions for you.
2;2;Liane;[Relieved and joyful.] Oh, thank you, thank you.
2;2;Clinton;We'll have the pregnancy terminated immediately. [Her eyes widen.]
2;2;Liane;[Pulls back.] Terminated?
2;2;Clinton;Why yes, that's what an abortion is.
2;2;Liane;Oh no uh- I didn't mean that. I meant the other thing you can do-what's that other A word?
2;2;Clinton;Adoption?
2;2;Liane;Yess, that's what I mean. Adoption.
2;2;Clinton;Well, that's- pretty different.
2;2;Liane;Oh, I should tell my son the truth about everything myself. Good day, Mr. President.
2;2;;She quickly leaves the bed. Now to a Colorado sunrise.
2;2;Dr. Doctor;Well, we made it. The power is on, the snow is melting, and your friend Mephesto is doing fine.
2;2;Mephesto;[Coming to.] Where... where am I?
2;2;Chef;You're at the hospital, Mr. Mephesto. You were shot. Now, we don't know who tried to shoot you, but--
2;2;Mephesto;Ohh. I'm sure it was my brother again. He tries to shoot me every month.
2;2;Chef;Ooohhh.
2;2;Dr. Doctor;Where's the little fat boy? He'll be delighted that Mephesto's awake.
2;2;Chef;He went off looking for Mr. Kenny.
2;2;;Outside, Stan, Kyle, and Cartman are at the generator. I guess the raptors have left.
2;2;Stan;He was a good friend, and I'll miss him.
2;2;Kyle;He was very brave. He risked his life so that Mephesto could live.
2;2;Cartman;Yeah. And now he's a freezy-pop.
2;2;;Kenny is shown iced over, and the boys simply stare.
2;2;Stan;[To Kyle.] Dude! D'you think if we hit him with a shovel, he'd shatter?
2;2;Kyle;I don't know. Let's find out.
2;2;;"""Ave Maria"" begins to play. Jimbo is the first to shovel his way out of the studio. Mr. Garrison follows, then Ned, then the Mayor, then..."
2;2;Mr. Garrison;Ohh. It's over! We're free!
2;2;Officer Barbrady;Yes, but at what cost, Mr. Garrison? At what cost?
2;2;Jimbo;Listen, everybody. We did what we had to in there.
2;2;Mayor McDaniels;But- hhhow will we live with ourselves now?
2;2;Ned;Mm-one day at a time, Mayor. Mm-one day at a time.
2;2;Singer;"[A la Aaron Neville]
Ave Maria...

[The camera pulls back, and back...]"
2;2;Mr. Garrison;Well, I'm bringing home some Eric Roberts in a doggie bag. Does anybody else want some?
2;2;;The hospital. Mephesto is recuperating, and Kevin is back at his side. All the possible fathers are present, including the Denver Broncos.
2;2;Mephesto;I'm glad that you could all come. I can finally reveal who the father of Eric Cartman is. But first, I want to thank Kenny McCormick for sacrificing his life--
2;2;Cartman;Just tell us already!
2;2;Mephesto;Alright alright. The father of Eric Cartman is... Say, did anybody see that Terrance and Phillip special last month? Wasn't that just the funniest thing--
2;2;Cartman;[Boiling.] Dammit! Tell me who my father is already!
2;2;Mephesto;Oh. As I said before, the father is somebody in this room. The father is... Mrs. Cartman. [All gasp.]
2;2;Chef;What???
2;2;Liane;[Back with her cookies.] Yes, it's true.
2;2;Mr. Garrison;Noo, that doesn't make sense!
2;2;Mephesto;Yes. It took quite a while for me to understand as well. You see, Mrs. Cartman is a hermaphrodite. [She looks guilty.]
2;2;Mr. Garrison;Uh-meaning what?
2;2;Mephesto;Meaning that she has both male and female genitals.
2;2;Liane;It's true.
2;2;Chef;You mean, at the Drunken Barn Dance, when we all got together with her, she was a he?!
2;2;Mephesto;No no, not exactly. But she did have a penis.
2;2;;Ned, Barbrady, and Chef vomit. The rest just cup their mouths. Gerald is shocked.
2;2;Mephesto;The fact of the matter is, hermaphrodites cannot bear children, so Mrs. Cartman's DNA match with Eric can only mean that she is his father, and she got another woman pregnant at the Drunken Barn Dance.
2;2;Cartman;Ugh. Man, this is fuckin' weak.
2;2;Stan;Dude! You're a big fatass, and your mom's a hermapholite!
2;2;Liane;I'm sorry I never told you, Eric.
2;2;;Eric and Stan look up at her.
2;2;Liane;I just thought, maybe it would be a little shocking to you.
2;2;Cartman;Oh, wow, gee whiz, you think so, Mom?!
2;2;Mephesto;Well, that's that. Thank you all for playing.
2;2;Cartman;No no, wait a minute! If... if she's my dad, then... who's my mom?!
2;2;Announcer 1;Who is Eric Cartman's mother? Is it Mrs. Crabtree? Sheila Broflovski? The Mayor?
2;2;Cartman;Ooohhh, forget it!
