2;2;;South Park.
2;2;Announcer 2;Previously, on South Park: an air of sobriety fills the laboratory as the men of South Park gather to find out which one of them fathered this boy.
2;2;;A shot of Cartman chowing down on cookies and milk.
2;2;Announcer 1;Who is Eric Cartman's father? At the end of this episode, you will know the answer.
2;2;;Opening warning and theme song. Much has been added. Then the episode resumes at the laboratory.
2;2;Mephesto;And now, to continue, the father is indeed someone in this room.
2;2;Cartman;Man, this feels like the longest minute of my life.
2;2;;Kenny is restored to the story line. Kyle notices.
2;2;Stan;Oooh- hey, Kenny.
2;2;Mephesto;Gentlemen, the father is...
2;2;;The lights go out.
2;2;Mr. Garrison;Hey, what the hell's going on?
2;2;Jimbo;It's a power outage!
2;2;;Two gunshots, then a body is heard falling. The lights go back on and the men settle down.
2;2;Chef;Is everybody okay? That sounded like a gunshot!
2;2;Officer Barbrady;Oh my God, look!
2;2;;Mephesto lies shot on the floor, his ass-headed cane next to him.
2;2;Kenny;(Oh my God, they killed Mephesto!)
2;2;Kyle;You bastards!
2;2;Mr. Garrison;Mephesto's been shot.
2;2;;Everyone gathers around Mephesto.
2;2;Chef;Is he ...dead?
2;2;;Jimbo and Ned stand near a newly broken window.
2;2;Jimbo;Hey! This window is shot out, too! That means the killer was not someone in this room!
2;2;Mr. Garrison;Then who was it?
2;2;Announcer 1;Who shot Mephesto? Was it the school counselor? Or was it Ms. Crabtree? Or was it--
2;2;Cartman;Ey! Wait a minute! I didn't find out who my father was!
2;2;Announcer 1;Or was it Sheila Broflovski?
2;2;Chef;[Listening to Mephesto's chest.] Waait! [Getting up.] He's still breathin'! He's not dead.
2;2;Cartman;[Grabbing Mephesto's shirt.] Goddammit! Who's my father?
2;2;Chef;[About to lift Mephesto.] We've got to get him to the hospital.
2;2;Cartman;You've got to be kidding me!
2;2;Chef;Come on, children!
2;2;;Chef carries Mephesto out the door. Cartman follows.
2;2;Cartman;Eeeehh..!
2;2;Gerald Broflovski;Oh, that poor kid. It must be hell for him going through all this.
2;2;;Ms. Cartman sighs deeply and moves away.
2;2;Jimbo;There's a murderer free in South Park. We have to find out who it is before they kill again.
2;2;Mr. Garrison;Yeah. God only knows who they'll kill next.
2;2;Announcer 1;Who will they kill next? Will it be Jimbo? Barbrady? The Denver Broncos?
2;2;;Chef is driving up a hill with the kids and Mephesto.
2;2;Cartman;Is he awake yet?
2;2;Kyle;[Checking.] He's bleeding pretty bad back here.
2;2;Chef;Don't let him bleed on my Meredith Baxter-Birney memorial towel.
2;2;Kyle;What's a Meredith Baxter-Birney memorial towel?
2;2;Chef;I actually was with Meredith Baxter-Birney in this very car. And afterwards we used that towel to... [Mad at himself.] Wait a minute. Why am I telling you this?
2;2;Stan;Could you pull over so I can get out?
2;2;Chef;What? We have to get to the hospital.
2;2;Stan;"I have to get out first. I'm not gonna make it; I can't stand hospitals."
2;2;Chef;Sorry, Stan. We just gotta drop Mephesto off and then we can get outta there, alright?
2;2;Kyle;Man, it's really starting to snow.
2;2;;The scene outside is filled with snow falling as Chef drives by.
2;2;Kyle;I hope they don't close the roads.
2;2;Cartman;They can't. Mephesto can't die.
2;2;Kyle;Maybe it's better you don't know who your father is, Cartman.
2;2;Cartman;"No way, dude! I can't stand to leave things unfinished. It's like when you hear the first part of that song, ""Come Sail Away"", by Styx. If I hear the first part of that song, I have to finish it."
2;2;Kyle;Really?
2;2;Cartman;Yeah, du-I can't do anything until it's done.
2;2;;Kyle looks at Stan, who looks back. Kyle begins.
2;2;Kyle;I'm sailing away...
2;2;Cartman;No! Don't!
2;2;Kyle;Set an open course for the virgin sea...
2;2;;Cartman tries to resist, but the pull is just too strong.
2;2;Cartman;Eh--
2;2;;Two short gasps follow, then Cartman races through...
2;2;Cartman;"For I've got to be free,
Free to face the life that's ahead of me,
On board I'm the captain, so climb aboard,
We'll search for tomorrow, on every shore,
And I'll try, oh lord, I'll try to carry on,
Maymaynemay Maymaynemay Maymaynemay Maymaynemay,
A gathering of angels appeared above my head,
They sang to us this song of hope,
And this is what they said,
Come sail away, come sail away, come sail away with me... lads,
Come sail away, come sail away, come sail away with me"
2;2;;The car passes a sign for Hell's Pass Hospital.
2;2;Cartman;"I thought that they were angels, but to my surprise
We climbed about their starship and headed for the skies
Come sail away, come sail away, come sail away with me... lads
Come sail away, come sail away, come sail away with me... lads"
2;2;;Cartman is out of breath, breathing heavily, Chef keeps driving.
2;2;Kyle;Whoa, dude!
2;2;;City Hall, first night. Sheila, Officer Barbrady, Sharon, and Jimbo are assembled before the Mayor.
2;2;Jimbo;What are we gonna do, Mayor? This killer is on the loose!
2;2;Sheila;We can't even leave our homes for fear of our children's safety.
2;2;Sharon;Uh... Where are our children?
2;2;;They look around.
2;2;Mayor McDaniels;Officer Barbrady, let's pretend for one second that we had a competent law enforcer in this town: what would he do?
2;2;Officer Barbrady;Hmmm... That's a good question, Mayor. Let me get right on that with thinking.
2;2;;A man and his boom mic operator rush in.
2;2;Man;Mayor! Mayor!
2;2;Mayor McDaniels;[Aside to an aide.] The press is here.
2;2;Sid Greenfield;My name is Sid Greenfield. I'm the director from Los Angeles for America's Most Wanted.
2;2;Mayor McDaniels;[Amazed.] Youuu certainly made it up here quickly.
2;2;Greenfield;We're desperate for stories.
2;2;;The boom mic operator thumps him.
2;2;Greenfield;A-and this one is so compelling.
2;2;Mayor McDaniels;[Aroused.] Really??
2;2;Greenfield;Sure. This story has everything. People. Furniture. Talking-ih it's a real American story.
2;2;Officer Barbrady;Hey, I thought of something. [Close-up.] Uh... no, wait, that's subtraction.
2;2;Mayor McDaniels;Mr. Director person, what exactly do you want to do?
2;2;Jimbo;Mayor, shouldn't we be focusi--
2;2;Mayor McDaniels;Shh.
2;2;Greenfield;We just want to do a recreation of the story for our show. Then we'll flash a number on the screen that people can call if they have any information regarding the identity or location of the shooter. That's it. You win, we win, America wins.
2;2;Mayor McDaniels;Are you sure this wouldn't make our little town look dangerous?
2;2;Greenfield;Don't worry, Mayor. America's Most Wanted is not about violence, it's about family.
2;2;Cameraman;It is?
2;2;Mayor McDaniels;[Thoughtfully.] Weelll, in that case, I guess it's okay!
2;2;Greenfield;Great! We'll get started with auditions immediately. What part should we cast first?
2;2;Announcer 1;Who will the director cast first? Will it be Mr. Garrison? Officer Barbrady? Chef?
2;2;;At the Unplanned Parenthood Clinic, it is snowing.
2;2;Liane;I want to have... an abortion.
2;2;Receptionist;Uoh well, we can do that. This must be a very difficult time for you, Mrs...
2;2;Liane;Cartman. Yesuh- it's such a hard decision, but I just don't feel I can raise a child in this screwy world.
2;2;Receptionist;Yes, Ms. Cartman. If you don't feel fit to raise a child, then abortion probably is the answer. Do you know the actual time of conception?
2;2;Liane;About eight years ago.
2;2;Receptionist;[Processing.] ...I sseee, so the fetus is...
2;2;Liane;Eight years old.
2;2;Receptionist;Ms. Cartman, uh- eight years old is a little late to be considering abortion.
2;2;Liane;Really?
2;2;Receptionist;"Yes, this is what we would refer to as the ""fortieth trimester""."
2;2;Liane;But I just don't think I'm a fit mother.
2;2;Receptionist;"Wuh... But we prefer to abort babies a little- ...earlier on; in fact, there's a law against abortions after the second trimester."
2;2;Liane;Well, I think you need to keep your laws off of my body.
2;2;Receptionist;Hmmmmm. Tsk, I'm afraid I can't help you, Ms. Cartman. If you want to change the law, you'll have to speak with your congressman.
2;2;Liane;[Rises from the chair.] Well, that's exactly what I intend to do. Good day!
2;2;;She leaves, meanwhile at the Hell's Pass Hospital, Chef and the children have arrived.
2;2;Chef;Come on, children! We've gotta find a doctor! [Kenny follows him in.]
2;2;Stan;[Stops.] Ugh. I can't do it, dude. [Kyle and Cartman pass him.]
2;2;Kyle;Come on, Stan. Hospitals aren't all that bad.
2;2;Cartman;Yeah, stop being a wuss!
2;2;;Operating room. A patient lies on the table, and the doctor is being assisted by a female nurse with no arms below the elbow. Chef and the kids enter.
2;2;Chef;Doctor!
2;2;Dr. Doctor;One moment, please. Nurse, I need 20 cc's of sodium pentathol, stat!
2;2;;She reaches for the syringe and grabs it with her mouth.
2;2;Kyle;Whoa, dude! She doesn't have any arms!
2;2;Dr. Doctor;We're an equal-opportunity employer here, son.
2;2;;She spits out the syringe, and he catches it along the cartridge end.
2;2;Chef;Doctor! We've got a shot cracker outside!
2;2;Dr. Doctor;I'll be right with you, right after I inject this man with a long needle.
2;2;Stan;[Pained.] Oh man. [Grabs his stomach.] I'm gonna be sick.
2;2;Dr. Doctor;There there, young man. Medical science is nothing to be afraid of.
2;2;;Squeezes out any air left in the syringe. A few drops escape, and he rams the needle into the man's side.
2;2;Stan;Oogh.
2;2;;Scraping sounds are now heard.
2;2;Nurse;Ooooo, I think you're hitting the bone.
2;2;Stan;Ooooogh.
2;2;;Dr. Doctor is still driving the syringe.
2;2;Dr. Doctor;Yes. I can hear the needle scraping against the bone inside.
2;2;;Blood starts bursting from the injection site.
2;2;Dr. Doctor;Oops, he's hemorrhaging.
2;2;;A burst lands next to Stan, who is wide-eyed at this point.
2;2;Stan;Aghh!
2;2;Dr. Doctor;[Plop.] Ooo! His head fell off.
2;2;Stan;I'm gotta get outta here!
2;2;Kyle;Stan!
2;2;Dr. Doctor;Ugh, some people just have a weak stomach.
2;2;;America's Most Wanted temporary set.
2;2;;Greenfield is accompanied by his assistant in the auditorium.
2;2;Mephesto Tryout;And the father of Eric Cartman is... Bang! Oh, Jiminy! I've been shot! [Drops the cane.]
2;2;Greenfield;Oh, thank you very much. We'll get back to you. [The actor departs.] I think I've seen enough genetic engineers. Let's move on to the auditions for the part of Mister-uhh Garrison.
2;2;Assistant;Call the Mr. Garrison auditions!
2;2;Garrison 1;Boy, I sure hope I'm not Eric Cartman's father, Mr. Hat.
2;2;Mr. Hat 1;[Just a sock with two purple disks for eyes.] You can say that again, Mr. Garrison!
2;2;Greenfield;Alright, not bad. Let's keep him on the top pile. Next!
2;2;Mr. Garrison;I sure hope that I'm not Eric Cartman's father, Mr. Hat.
2;2;Mr. Hat;You can say that again, Mr. Garrison!
2;2;Greenfield;Thank you! Next!
2;2;Mr. Garrison;[Shocked.] What?
2;2;Greenfield;Next!
2;2;;Mr. Garrison leaves, dejected, as another actor enters.
2;2;Garrison 2;[An actor with a deep voice.] I sure hope that I'm not Eric Cartman's father, Mr. Hat.
2;2;Mr. Hat 2;[A fist with a face drawn on it.] You can say that again, Mr. Garrison.
2;2;Greenfield;Perfect! You got it! Let's move on to the Chefs!
2;2;;Mr. Garrison stands dumbstruck. Meanwhile Liane is in bed with her congressman.
2;2;Liane;...And so you see, Congressman O'Reilly, that's why I think abortion laws should be changed.
2;2;O'Reilly;Well, all I know is that third-trimester abortions are illegal. I don't really know anything about 40th.
2;2;Liane;But the person at Unplanned Parenthood said you were who I had to talk to about changing the law.
2;2;O'Reilly;No- No, I think youah gotta talk to the governor about that stuff.
2;2;Liane;Oh, dear.
2;2;;Back at the hospital, Mephest is still on the operating table, sedated.
2;2;Dr. Doctor;Well, this is about all I can do for him.
2;2;Cartman;Can't you get him to talk? I have to know who my father is.
2;2;Dr. Doctor;Sorry, son, it might be a while.
2;2;;Cartman bounds atop Mephesto and begins slapping him around.
2;2;Cartman;Wake up, you son of a bitch!
2;2;Chef;Whoa!
2;2;;Dr. Doctor lowers Cartman from atop Mephesto.
2;2;Dr. Doctor;Now, son, that's not's gonna do him any good. I'll let you know if there's a change in his condition.
2;2;Cartman;I can't wait anymore. What am I supposed to do?
2;2;Kyle;Hey, Cartman.
2;2;Cartman;What?
2;2;Kyle;I'm sailing ay...
2;2;Cartman;"--way; Set an open course for the virgin sea
For I've got to be free, free to face the life that's ahead of me
On board I'm the captain, so climb aboard..."
2;2;Stan;Okay okay, let's get outta here now!
2;2;Cartman;...We'll search for tomorrow on every shore...
2;2;Kyle;[Looking out at the snow storm.] I don't know if that's gonna be too easy.
2;2;Cartman;...And I'll try, oh lord, I'll try to carry on...
2;2;Dr. Doctor;My God, that's a hell of a storm.
2;2;Cartman;"I look to the sea; Reflections--
--in the waves spark my memory..."
2;2;Stan;Oh, weak.
2;2;;Kenny looks up towards the window.
2;2;Cartman;"...Some happy, some sad; I think of childhood friends and the dreams we had
We lived happily forever, so the--"
2;2;;Back at the studio, auditions have ended, Greenfield is looking at the storm.
2;2;Greenfield;God, I hate mountains. This better not push back our shooting schedule.
2;2;;The actors for Mephesto, Barbrady, and Chef are on the laboratory stage. Greenfield takes the megaphone.
2;2;Greenfield;Okay, people, let's rehearse the reenactment from the top before we shoot it.
2;2;;Greenfield sees a new actor and turns to his assistant.
2;2;Greenfield;Who's that?
2;2;Assistant;Oh, that's TV's Eric Roberts. We were able to get him to play the part of the little monkey guy.
2;2;Greenfield;"Whoa. Talk about ""all washed-up"", huh? Great to have you, Eric!"
2;2;;Eric Roberts stops munching a doughnut long enough to wave and smile.
2;2;Greenfield;Here we go, aaand action.
2;2;Mephesto Actor;I want to announce who the father is.
2;2;Greenfield;Bang!!
2;2;Mephesto Actor;Oh, I've been shot! [Falls over.]
2;2;Barbrady Actor;Nobody move! I'm a law officer!
2;2;Chef Actor;My God, I think he's gone into cardiac arrest!
2;2;Mephesto Actor;[As Chef Actor speaks] Whoaw..!
2;2;Barbrady Actor;You seem somewhat unnerved by this, Chef.
2;2;Chef Actor;Are you accusing me, Barbrady? Because if you are accusing me, don't hide behind your clever riddles!
2;2;Barbrady Actor;Our differences must be set aside for now, Mr. Chef. I'm simply a man, a man trying to do my job.
2;2;Officer Barbrady;Whoa, this is a good movie!
2;2;;Back at the hospital.
2;2;Cartman;"Come sail away, come sail away, come sail away with me... lads
Come sail away, come sail away, come sail away with me-hee"
2;2;;The boys are in the emergency room with a bunch of patients bleeding, getting nauseous, etc.
2;2;Stan;Ohh. Dude, when can we get out of here?
2;2;;The doctor bursts through the emergency doors with the nurse, a blonde is bleeding from a gash on her neck.
2;2;Blonde;Doctor, I can't focus!
2;2;Dr. Doctor;We're doing the best we can, ma'am. They've closed the pass and none of the other doctors can get through. For now, it's just me, and Nurse Goodly.
2;2;;She tosses the stethoscope around for a better hold.
2;2;Chef;Wait a second. They've closed the pass??
2;2;Dr. Doctor;Yes, I'm afraid we're critically understaffed. Unless we get help soon, all these people in here are completely fucked.
2;2;;Everyone turns to him and gasps. He quickly retracts.
2;2;Dr. Doctor;Metaphorically speaking, that is.
2;2;Cartman;What about Mephesto? Are you taking care of him?
2;2;Dr. Doctor;He's on full life-support and breathing fine. He shouldn't need any help - so long as the power doesn't go out.
2;2;;Bzht. Everything goes black.
2;2;Dr. Doctor;Oof. Who didn't see that coming a mile away, huh?
2;2;;Show time! A siren rotates, there's a hold-up and a helicopter zooms in on a raid from above. There's also a ground shot of the arrest. Lady Justice appears. A suspect is thrown behind bars.
2;2;Voice-over;Tonight, on America's Most Wanted, a shooter is on the loose in Colorado, and its residents are up in arms! Here's your host, John Walsh.
2;2;John Walsh;Good evening and welcome to America's Most Wanted. Tonight: terror invaded the small mountain community of South Park, Colorado, when Dr. Alphonse Mephesto [His picture appears.] was gunned down in his laboratory. America's Most Wanted has reconstructed this heinous crime [The South Park Genetic Engineering Ranch is seen.] in hopes that your calls could help solve the case.
2;2;;A reenactment plays.
2;2;Mephesto Actor;[Pfff. The actors flinch and he throws away the cane] I've been shot!
2;2;Garrison Actor;[Catches him.] My God, Mr. Hat! Get some help!
2;2;Mr. Hat Actor;Right away, Mr. Garrison.
2;2;Eric Roberts as Kevin;No, no! My lifetime partner and friend, gone, taken away in the wink of an eye. O, Fortune, why do you mock me?
2;2;Greenfield;What the--? Bu-eh. Eric Roberts is improvising lines again!
2;2;Chef Actor;I'm going to get the man to a hospital. Who will help me?
2;2;Eric Roberts;This is not a world I want to live in! Doesn't anyone want--
2;2;Greenfield;God-dammit!
2;2;;Outside, a pine tree falls on the studio's power lines. The lights dim and all action comes to a halt.
2;2;Greenfield;What the hell is this?!
2;2;Cameraman;We've lost the feed to L.A.
2;2;John Walsh;Uuuhm... We-we seem to have lost our linkup to the South Park crew, sso I guess we'll be going to our featured movie, Who Framed Roger Rabbit.
2;2;Announcer 1;Who framed Roger Rabbit? Was it Jimbo? Mr. Garrison? Chef?
2;2;Greenfield;Somebody go see why we lost the hookup!
2;2;;The doors fly open and snow is swept in.
2;2;Jimbo;Holy smokes, that blizzard is getting crazy!
2;2;;Back at the hospital. Lights can be seen in most of the rooms. Inside, the backup generator has come online and everyone is running around.
2;2;Nurse Goodly;Don't panic, anybody. The power lines are down, but the backup generator is running just fine.
2;2;Dr. Doctor;[Opening the operating room doors wide.] Nurse, I could use some help in here!
2;2;Goodly;Coming!
2;2;;Cartman stands in her way stopping her.
2;2;Cartman;Lady-m? Is Mephesto gonna be okay?
2;2;Goodly;Yes, for now. But I'm afraid the generator won't run for long. The batteries run out in half an hour. Time is very short.
2;2;Dr. Doctor;Nurse, please! I need another pair of hands in here!
2;2;;She looks at him and glares.
2;2;Dr. Doctor;Oh, sorry.
2;2;;Liane at the Governor's mansion, in bed with him.
2;2;Liane;Don't you see, Governor? I should have a right to have an abortion if I want one.
2;2;Governor;[Smoking.] Mmaarr. I don't know-uh, I might need some more convincing, hm-hm-hm.
2;2;;He edges closer to her.
2;2;Liane;I mean, what right do I have bringing another child into this overpopulated world? Then again, I should've thought of that before having sex. then againuh-- Oh, I just don't know...
2;2;;Back at the hospital.
2;2;Dr. Doctor;Please, Mr. Chef. I've over 100 people to attend to an-and only myself and Nurse Goodly.
2;2;Chef;What do you want me to do?
2;2;Dr. Doctor;Do you know anything about surgery?
2;2;Chef;I used to watch Quincy.
2;2;Dr. Doctor;What?! Why the hell didn't you say so? Put on some scrubs! Boys, I'm making you all honorary doctors. You can help us save these people's lives.
2;2;Stan;No way, dude!
2;2;;America's Most Wanted studio, in the dark, Jimbo opens the door and a pile of snow pours in on him.
2;2;Jimbo;Well, [Opens his right eye.] we're not going anywhere for a loong time.
2;2;Greenfield;We're snowed in?
2;2;Mayor McDaneils;Yes. We're trapped!
2;2;Mr. Garrison;[Snuggling up to Greenfield.] Like sailors on a submarine.
2;2;Mayor McDaniels;My God, this is the worst storm I've ever seen.
2;2;Assistant;Oh I have to get out of here, I haven't eaten since breakfast.
2;2;Officer Barbrady;Yeah, I'm gettin' hungry, too. [Rubs his belly.]
2;2;Jimbo;I hope you all realize what we might be facing here.
2;2;;Everyone is now focused on Jimbo.
2;2;Jimbo;Our only option might be to... eat each other to stay alive.
2;2;;Gasps are heard all around.
2;2;Greenfield;Uuuhh, it's only been like, four hours. Aren't you resorting to cannibalism a little quickly?
2;2;Jimbo;That's the law of land, Mr. Director. It ain't pretty, but if a few of us must die so the rest can stay alive, so be it.
2;2;Mayor McDaniels;"Buut, how do we decide ""who""?"
2;2;Jimbo;Well, we draw straws.
2;2;Greenfield;Now, wait a minute. We all had a big breakfast: can't you people go without eating for a little while?
2;2;Jimbo;Calm down, soldier! We need every person here to keep his head! Barbrady, fetch some straws.
2;2;Greenfield;Well- who the hell made you the boss anyway?
2;2;Announcer 1;Who the hell made Jimbo boss? Was it Barbrady? Chef? Mr. Gar--
2;2;;Same night, the hospital. The doctor is operating with his motley crew. Stan and Kyle are on one side, Cartman and Kenny are on the other. Chef stands at one end of the table between Cartman and Kyle, and the doctor is at the other end.
2;2;Dr. Doctor;Miles' appendix has burst. I have no choice but to operate now with our limited power. I need you all to be strong for me. [Stan raises his brows.] Nurse Goodly will take care of the anesthesia. Chef, you act as her arms. [He withdraws.] Boys, you have to help with suction and bandages. Ready?
2;2;Stan;No.
2;2;Dr. Doctor;Okay. First, I'll make an incision on the chest, over the heart.
2;2;Stan;[Queasily.] Oh boy.
2;2;;The doctor slices the flesh vertically over the X he has marked over the heart. It splits open and Stan removes his mask.
2;2;Stan;Bleech!
2;2;;The vomit goes right into the open incision.
2;2;Kyle;Duhuhude! You barfed into the incision!
2;2;Cartman;Sweet.
2;2;Dr. Doctor;Suction!
2;2;;Kenny places the suction cup over the incision. The power begins to flicker, and he removes the cup.
2;2;Cartman;Hey, who's screwing with the lights?
2;2;Announcer 1;Who is screwing with the lights? Is it Barbrady? Or Jimbo? Or the 1991 Denver Broncos?
2;2;Cartman;[To Kenny.] That is really starting to piss me off.
2;2;;America's Most Wanted studio, nighttime. Barbrady stands holding the straws.
2;2;Jimbo;Alright. So far, everybody has a long piece of straw. We'll keep drawing. [Draws.] Whew.
2;2;Mr. Garrison;[Draws] Whew.
2;2;;Sees that his straw is short and throws it away, behind himself.
2;2;Officer Barbrady;Wooo!
2;2;Jimbo;Wait a minute! Where the hell is the short one?
2;2;Officer Barbrady;The short what?
2;2;Jimbo;Dammit, Barbrady! When you draw straws, you're supposed to have one of them short! That's how you decide who loses!
2;2;Barbrady;That's not how I played it!
2;2;Mr. Garrison;Uuugh, could we hurry this up? My stomach is growling.
2;2;;Back at the hospital.
2;2;Dr. Doctor;I found a map that shows the location of a backup generator. Apparently, they built a large self-sustaining generator- for just this kind of emergency. But it's out and away from the hospital.
2;2;Chef;So how do we get to it?
2;2;Dr. Doctor;We must split up into two teams: Team A, and Team B. Team A will consist of myself, Stan, Kyle, Eric, Chef, and Nurse Goodly. Team B will consist of Kenny.
2;2;;Kenny is stunned. The doctor pats his head.
2;2;Dr. Doctor;Now, listen closely, Team B. Your goal will be to turn on the backup generator. To do this you must brave the storm outside and get into this sewage duct.
2;2;;Dr. Doctor points it out to him on the map.
2;2;Dr. Doctor;Meanwhile, Team A will go to the holding area, here [Points to it.] where there is a television, and some cocoa. We will drink the cocoa and watch family programming until Team B makes it through the sewage duct. By that time, Team B- remember, that's you, Kenny- should reach the outer core of the generator. It will be a cold and dangerous climb to the top, and there could be velociraptors- here.
2;2;;He points to an area between the holding area and the generator.
2;2;Dr. Doctor;Once you reach the top, you should be able to get a clear view from this windows of us drinking cocoa and watching television. Then, you could proceed down into the generator, and power it on. Are there any questions?
2;2;Cartman;Nnoh, that sounds pretty sweet to me.
2;2;Dr. Doctor;Great, then, let's do it. Go, Team!
2;2;Kenny;(Huh?)
2;2;;The studio.
2;2;Mr. Garrison;I... can't... go on... eh. So... hungry...
2;2;Mayor McDaniels;We're all going to die in this horrible place. [She covers her eyes.]
2;2;Jimbo;We have to have the energy to make it through the night. We have to eat.
2;2;Greenfield;How can we? How could we live with ourselves?
2;2;Jimbo;There's only one answer: eat Eric Roberts. [He's shown squatting on the floor.]
2;2;Mayor McDaniels;[Thoughtfully.] Yes, of course. Nobody gives a shit about Eric Roberts.
2;2;Mr. Garrison;[Madly] Eat Eric Roberts!
2;2;;The rest of the group goes mad, Ned gets up and everyone prepares to do him in.
2;2;Eric Roberts;No! No, please!
2;2;;Later. Eric's arms, legs, and head have been removed, and bees hover around the corpse.
2;2;Mayor McDaniels;Well, there's no going back now. [Ned and Jimbo keep eating.] We're cannibals. [Someone burps.] God save us.
2;2;Jimbo;God wants you to live, Mayor. Fight!
2;2;Assistant;[Coolly.] Well I have to admit, Eric Roberts was much juicier than I expected.
2;2;Greenfield;[Miffed.] Aaww.
2;2;Mr. Garrison;This snow just isn't letting up. We're gonna die here, I know it.
2;2;Jimbo;What time is it, Barbrady?
2;2;Barbrady;It's almost midnight.
2;2;Mr. Garrison;Oh! I can't... go on. [Drops to his side.]
2;2;Jimbo;We'll give the storm another hour. After that, we might have to eat again.
2;2;Greenfield;What? Christ, are you people diabetic or something?
2;2;;The hospital. Kenny has made it through the tunnel and exits the manhole. He's pretty soiled. He turns on his communicator.
2;2;Dr. Doctor;Team B? Come in, Team B.
2;2;Kenny;(This is Team B.)
