2;3;Bus Driver;Indeed, you did. How did you know I would strike here?
2;3;Officer Barbrady;By reading Teetle the Timid Taxidermist.
2;3;Bus Driver;You did?! Really?! Then it worked! My whole plan worked absolutely perfectly! [Pleased.]
2;3;Stan;What are you talking about, dude?!
2;3;Bus Driver;When I heard that Officer Barbrady couldn't read, I knew I had to motivate him somehow. So I formulated a plan to encourage him to learn the magic of reading!
2;3;Kyle;So you fucked a bunch of chickens?
2;3;Bus Driver;Yes! Yes, exactly! Don't you see? Only by fucking chickens could I get Officer Barbrady to become literate.
2;3;Stan;That doesn't... make a whole..lot of sense, dude.
2;3;Bus Driver;Oh, no? He who was blind can now see!
2;3;;No reaction from the kids.
2;3;Bus Driver;I got Officer Brabrady to read. My plan worked perfectly.
2;3;Officer Barbrady;"Well, I guess I should say ""Thanks?"""
2;3;Bus Driver;You're welcome. And now, my reading friend, you've proven that you are ready for the big time. I give you this hardback copy of Atlas Shrugged, by Ayn Rand.
2;3;Cartman;[Rushing up.] Freeze! Put your hands in the air!
2;3;Kyle;Cartman!
2;3;Cartman;I got reports that the suspect is in this area!
2;3;Kyle;Well, he is. It turns out that the bookmobile driver here was the one making love to chickens.
2;3;Cartman;A-ha!
2;3;;Cartman hits him with the baton.
2;3;Bus Driver;Ow, that hurts!
2;3;Kyle;Whoa, dude!
2;3;Stan;Cartman!
2;3;;Officer Barbrady picks Cartman up and takes the baton from him.
2;3;Officer Barbrady;No, no, that's not how you uphold the law! [He puts him down.]
2;3;Cartman;Well, he is not listening to my authoritah!
2;3;Barbrady;Oohhh, ohh, you've got it all wrong, my little friend. You do it like this: [Paf.]
2;3;Bus Driver;[Going down, squealing.] Heee--!
2;3;Barbrady;"You've gotta get 'em in the head; they go down quicker."
2;3;;Cartman looks at the driver and removes his shades.
2;3;Cartman;Ooohhhh.
2;3;Kyle;I guess you should leave police work to the professionals, huh, Cartman?
2;3;Barbrady;Well anyway, I'm relieving you of your duties. I've proved that I can read, and now I'm back on the job!
2;3;;He spins the cylinder on his pistol.
2;3;Stan/Kyle;Hooray!
2;3;;Cartman watches as Barbrady leaves the petting zoo, Stan calls out to Barbrady.
2;3;Stan;Hey! So what are you going to do now?
2;3;Barbrady;Now? [Turns around.] Well, I-ee uh... I think I'll get in the bathtub, and then curl up with a good book.
2;3;;He displays the book for a moment, then holds up his right thumb for the camera to see. The end credits begin to roll, but only the executive producer is listed. The boys watch for a moment more, then walk off to the right. The chicken just walks around pecking at the straw. A bunny hops across the yard and Bebe chases after it.
2;3;;Newscast.
2;3;Anchor;And so today South Park held a parade to honor Officer Barbrady and his heroic work on the Chickenfucker case.
2;3;;Tape is shown of the parade. Confetti is flying everywhere. The South Park High School band is marching before Barbrady's car. He is in the car with Stan, Kyle, and Cartman.
2;3;Officer Barbrady;Thank you, everybody. Thank you.
2;3;Man 1;Speech! Speech!
2;3;Officer Barbrady;[Lowers his arms.] What?
2;3;Stan;"They want you to give a speech, Officer Barbrady; about the whole experience over the last couple of days."
2;3;Officer Barbrady;Oh. Okay, uh... Well, first of all I'd like to thank the town of South Park, the town that bore me and eventually will rob me of my life precious.
2;3;;The town cheers.
2;3;Man 2;Oh, yeah!
2;3;Officer Barbrady;Second, I'd like to say to all those out there who think they can screw chickens just to teach people to read, your days are numbered! [More cheering.] And finally, I'd like to say that [Enunciating.] reading totally sucks ass!
2;3;Stan/Kyle;Hooray!
2;3;Officer Barbrady;Yes, at first, I was happy to be learning how to read. It seemed exciting and magical. But then I read this: Atlas Shrugged, by Ayn Rand. I read every last word of this garbage, and because of this piece of sh-shit, I'm never reading again!
2;3;Stan, Kyle;Hooray for Barbrady!
2;3;;The crowd cheers again.
2;3;Kyle;Wow! I guess reading really does suck ass!
2;3;Cartman;Ey, that's what I've been saying all along, you guys.
2;3;Stan;I'm just glad everything turned out okay, and Barbrady got his job back.
2;3;Kyle;It's poetic justice.
2;3;Officer Barbrady;[Leaning forward.] Thanks, boys.
2;3;;The end credits roll again, this time normally. When the producer is listed, Kenny is shown in a clear area behind the crowd. A tree falls, flattening him.
2;3;Kenny;(Ow!)
2;3;;Blood oozes from under the tree. End credits continue, showing more scenes from the parade.
