5;7;Bebe;Yeah! Just take your diseases and go away forever!
5;7;Stan;Ha! They're your diseases!
5;7;Kyle;Yeah! You get out of town!
5;7;Cartman;Here, talk to them, Butters.
5;7;Butters;[lifts up his mask] Uh, me?? Huh, what the heck am I supposed to say?
5;7;Cartman;Just tell them that if they leave town peacefully, we won't have to resort to violence.
5;7;Butters;[lowers his mask and speaks into the mike. A deep raspy voice comes out] Just walk away. You can put a stop to all this. Just walk away and we will spare your lives. Just walk away.
5;7;Kyle;[to Stan] Man, he's pretty good.
5;7;Bebe;We'll never walk away. Never! [tosses a boomerang towards the boys. Clyde ducks as the boomerang comes towards him, and Kenny is struck dead]
5;7;Kenny;(Waa-ooo!) [falls back and expires]
5;7;Cartman;Oh, bitch!
5;7;Stan;That does it! Attack! [the boys rush the stronghold]
5;7;;Ms. Choksondik's house, at that moment. They have books open
5;7;Mr. Mackey;M'kay, so apparently the lesson plan tomorrow is s'posed to involve the secretion of bodily fluids, m'kay.
5;7;Ms. Choksondik;I've already gone through that with the girls. [closes her book and sets it down] It's pretty simple. Do you wanna drink?
5;7;Mr. Mackey;Why, sure. [she goes to get drinks] Hey uh I think I can... get through that stuff pretty quick, mm... [he gets a good look at her derriere] Uh, maybe we should come up with another lesson plan.
5;7;Ms. Choksondik;[hands Mr. Mackey his drink] Something about how nerve endings play an important part in intercourse. [sits down]
5;7;Mr. Mackey;Uh, right, right, uh, like in the ...nipples.
5;7;Ms. Choksondik;Or the... shaft... of the penis? [they look away from each other]
5;7;Mr. Mackey;It... says here that the uh, head of the penis is actually the... most sensitive... part, m'kay.
5;7;Ms. Choksondik;Why, yes. The nerve endings are the most concentrated at- the- tip of the penis. Like they are in the... [looks at him. They draw close to each other] clitoris of the woman.
5;7;Mr. Mackey;And these... are the two areas most important to-
5;7;Ms. Choksondik;Sexual stimulation. [they kiss quick, then kiss full and long. Some love music comes up. She pulls back] Oh, is this wrong?
5;7;Mr. Mackey;I don't know. It doesn't feel wrong. [they kiss full again] I've been thinking about you a lot, Ms. Choksondik.
5;7;Ms. Choksondik;Yeah? What do you do when you think about me?
5;7;Mr. Mackey;I go crazy.
5;7;Ms. Choksondik;Do you touch yourself?
5;7;Mr. Mackey;Yeah. Hmm. [they embrace. She takes off his tie. He stands, walks some distance, and takes off his shirt. She stands, takes off her top, and tosses it away. She approaches him and removes his belt. He takes off his pants. She looks at him again and goes down to remove his briefs. She tosses them aside. He bends down to remove her underwear and tosses them aside. She coaxes him down, and he follows]
5;7;Ms. Choksondik;[writhing] Haawww. Haawww.
5;7;Mr. Mackey;G'oh, m'kay.
5;7;Ms. Choksondik;Oh my God. Oh God, yeah! Stop! Stop!
5;7;Mr. Mackey;Huh, what's wrong?
5;7;Ms. Choksondik;It's your turn. [goes down to work on him]
5;7;Mr. Mackey;Mm, oh, oh Ms. Choksondik. M' kay! M'kay!
5;7;Ms. Choksondik;[gets up] Do you want me?
5;7;Mr. Mackey;I do.
5;7;Ms. Choksondik;Tell me.
5;7;Mr. Mackey;I want you. M'kay. [they go down, then moments later quickly get up]
5;7;Ms. Choksondik;Wait wait wait! Do you have a condom?
5;7;Mr. Mackey;Well. No.
5;7;Ms. Choksondik;[looks into his eyes and then] Oh well, fuck it [they go down, and the consummation begins] Oh God, give it to me! [his ass rises for the first time]
5;7;Mr. Mackey;Oh yeah. Woh. [his ass appears again]
5;7;Ms. Choksondik;Woh. [his ass appears again] Ooh, that's it baby! That's it!
5;7;Mr. Mackey;[his ass appears again] Aw, this feels so good, m'kay. [his ass appears again]
5;7;;The empty field. later. The battle is joined. Kids run around seeking positions from which to shoot. Seven boys come up to the stronghold gate. Millie fires a Gatling gun at them from the left side, and they scatter, dropping their weapons
5;7;Boys;WAAAAHHH!! [two boys prepare a Molotov cocktail, and one of them tosses it at the tires on the right side of the gate entrance. The tires go up in flames. The boys run away, and a huge flash explosion rises inside the stronghold]
5;7;Girls;Waaaahh!! [they bail out immediately, and a much larger explosion rises, tossing kids away left and right]
5;7;;The Marsh house. Randy and Sharon are reading papers when the house moves about as if an earthquake had just rolled by. Sharon drops her paper
5;7;Sharon;What the hell was that?
5;7;;Ms. Choksondik's house. Mr. Mackey and Ms. Choksondik rise from their activity and look out the window
5;7;Ms. Choksondik;Did you feel something?
5;7;;Chef's house. The front door opens and he walks out. He's shocked at what he sees.
5;7;Chef;Oh, no!
5;7;;South Park Elementary. The four remaining staff members, Principal Victoria, Mr. Garrison, Mr. Adler, and Ms. Chosie, walk out and see the wreckage. Principal Victoria puts her hand over her mouth in dumbfounded shock
5;7;Mr. Garrison;Jesus Christ. [a shot of the burning wreckage, then of Butters, Cartman, Stan, and Kyle looking at the wreckage]
5;7;Cartman;Ooo, Butters? You're in big trouble now.
5;7;;The empty field. later. All the parents have come by to make sure their kids are okay. The wreckage still burns
5;7;Sharon;Well, I don't know what got into you kids. You should be ashamed of yourselves. [in the background paramedics pick up injured kids and put them in ambulances]
5;7;Stan;We just didn't want the girls giving us diseases.
5;7;Ms. Choksondik;I'm afraid this is all my fault. I... think I went a little overboard scaring the girls. I forgot to tell them that to get diseases from boys you... have to have sex with them first.
5;7;Kids;Oooohhh.
5;7;Chef;Well, I hate to say it, but you all got what you deserved.
5;7;Parents;Huh?
5;7;Chef;Look: Schools are teaching condom use to younger and younger students each day! But sex isn't something that should be taught in textbooks and diagrams. Sex is emotional and spiritual. It needs to be taught by family. I know it can be hard, parents, but if you leave it up to the schools to teach sex to kids, you don't know who they're learning it from. It could be from someone who doesn't know, [a shot of Mr. Mackey] someone who has a bad opinion of it, [a shot of Ms. Choksondik looking around] or even a complete pervert. [a shot of Mr. Garrison]
5;7;Mr. Garrison;Wha? Why did you pan to me just now? What the hell is that s'posed to mean?
5;7;Ms. Choksondik;He's right. I never knew how special and personal sex was un... until just recently.
5;7;Sharon;This whole mess started because we couldn't talk to our boy ourselves.
5;7;Sheila;It's easier to just leave it up to the school, but it's...just not a school subject.
5;7;Principal Victoria;Then it's decided: no more condom classes in grade school.
5;7;Kids;Hooray!
5;7;Stan;But Chef, when is the right age for us to start having sex?
5;7;Chef;It's very simple, children. The right time to start having sex is... 17.
5;7;Kyle;Seventeen? [Sheila and Gerald approach]
5;7;Chef;Seventeen.
5;7;Sheila;So you mean 17 as long as you're in love?
5;7;Chef;Nope, just 17.
5;7;Gerald;But, what if you're not ready at 17?
5;7;Chef;Seventeen! You're ready. [Stan walks up to Wendy]
5;7;Stan;Well, I guess we got a while to wait before we have to worry about sex and diseases, huh, Wendy?
5;7;Wendy;Yeah. Thank God.
5;7;Cartman;Well, I guess now that that's out of the way, we can get on with our lives. Come here, boy! [a dog enters the scene, and the camera begins to zoom out. Everyone is smiling and looking on as Cartman pleases the dog] That's it. Red rocket, red rocket. Come on, now. Come on, red rocket, dog. Red rocket now.
5;7;;End of Proper Condom Use, but Mr. Garrison has a few more things to say
5;7;Mr. Garrison;Okay children, so what other sexual positions have we talked about? Yeah, the wrap-around butt grab. Sure, can't forget that. Uh huh, reverse cowgirl. Good, Kevin. Hot Lunch, sure, she likes that. Donkey Punch, uh huh. Glass-bottom boat. Good one, yes. Fish-eye. Good, Jenny. Chili dog. Mm-hm.
