5;7;;South Park, day. A car with a woman seated in it appears on a hill — Jennifer Lopez doll with car, and some damage from the firecracker last time.
5;7;Stan;"[voice only] ""So, we meet again, Jennifer Lopez!"""
5;7;Kyle;"[face appears] ""No, no, please! This time I swear I won't make albums or movies."""
5;7;Stan;"[face appears] ""That's what you said last time [pulls out a magnifying glass from his back pocket], but obviously we must now resort to more drastic measures"" [moves the magnifying glass over the doll's body and fixes it there, focusing the sun's rays into a point]"
5;7;Kyle;"[fakes a cry] ""Oh God it burns! It bur-huhurns!"""
5;7;Stan;"""Scream for me, bitch!"""
5;7;Kyle;"""AAAAAAAH!"" [the doll's head begins to melt and shrivel, then Stan removes the magnifying glass]"
5;7;Stan, Kyle;Whoa! Awesome!
5;7;Cartman;[runs up excitedly] Ey you guys! You guys! Come 'ere, you guys, come check this out!
5;7;Stan;Oh no, what now?
5;7;Cartman;No, you guys, this is really cool. Come on! [goes away, and Stan and Kyle follow]
5;7;;Kenny's house, later. Cartman, Stan, and Kyle approach the house. Kenny's on the front lawn with a dog, and the other boys join him
5;7;Kyle;What's this all about, Kenny?
5;7;Kenny;(Wait until you see what I can do to the dog!)
5;7;Cartman;Watch this. It's sooo funny. [grins] Come 'ere, Garland, come on. [giggles as he starts jacking the dog's penis] Good dog. [the dog rolls over on its back ] Red rocket red rocket. [Stan and Kyle look at each other. Kenny starts to laugh and clap, and the dog's penis lengthens] Red rocket. Red rocket. [chuckles] Come on. [giggles]
5;7;Stan;Cartman, what the hell are you doing?
5;7;Cartman;I'm milking the dog. They make dog milk.
5;7;Kyle;No they don't!
5;7;Kenny;(Yeah they do!)
5;7;Cartman;[continues milking] Yeah, just hold on a minute. The fifth graders showed us how to do it. [concentrates on the dog] Red rocket. Come on, dog, red rocket! [the dogs ejaculates, and the semen lands on Cartman's face] Ohooohhh!
5;7;Stan;Whoa, cool! [the dog quickly stands up and walks off]
5;7;Kyle;That's awesome!
5;7;Cartman;I told you guys.
5;7;Stan;"I had no idea dogs made milk; do it again."
5;7;Cartman;[sighs] Dumbass, you can only milk a dog once every few hours. It doesn't work if you beat off the dog again right away.
5;7;Kyle;"You ""beat off?"""
5;7;Cartman;[rolls his eyes up] That's what it's called when you milk a dog: beating it off. [looks at Kenny] Don't you guys know anything?
5;7;Stan;Wow, you learned all this from the fifth graders?
5;7;Cartman;Yeah, I guess they thought we were cool, so they showed us how to do it—hey come here, dog. Dog, come here! [laughs as a gray dog approaches]
5;7;;Stan's house, night. Sharon is holding court in the living room, in a circle of chairs. She and Randy have parents of the Stotch, Tweak, Black and Tucker families over for some discussion...
5;7;Sharon;I was really happy with this month's book. I agree with what Bob and Linda said-
5;7;Stan;[rushes in with Sparky] Mom! Dad! You gotta see this!
5;7;Sharon;Not now, Stanley. This is Mommy and Daddy's book club night, remember?
5;7;Stan;But it's super-cool!
5;7;Sharon;Later, sweetie. [to the group] Anyway, I found myself enticed by Steinbeck's imagery.
5;7;Stephen;Uh the first chapter alone was filled with poetry.
5;7;Sharon;"[Stan takes the dog and sets up near the table, away from the club circle] Oh, wasn't it? I mean, the first sentence: [reads from ""Cannery Row."" Stan starts milking the dog]"
5;7;Stan;Red rocket. Red rocket, Sparky. Red rocket.
5;7;Sharon;"""Cannery Row in Monterey in California-"" [""Red rocket. Red rocket, Sparky. Red rocket.""] ""-is a poem, a stink, a grating noise..."" [The other adults lean in to see the action in the background. ""Red rocket. Red rocket, Sparky.""] It's amazing how with three images [Mrs. Tweek covers her mouth as Mr. Tweek looks on, surprised] he puts you right there, and..."
5;7;Stan;[his parents turn at the sound of his voice] Red rocket, red rocket!
5;7;Randy;[recognizes the activity] WAAAH!
5;7;Sharon;Stanley, what the hell are you doing?!
5;7;Stan;I'm beating off the dog. Red rocket, red rocket. [the other adults turn away or show shocked looks]
5;7;Sharon;[both parents now standing] STANLEY, YOU GO TO YOUR ROOM RIGHT NOW!
5;7;Stan;My room? Why?
5;7;Sharon;Go, Stanley! [he walks off to his room. Sparky looks at the group, then gets up and follows Stan out, with penis still erect. Sharon turns around and says sheepishly] Ahaha, ahem. Heheh, he, he gets very good grades.
5;7;;Stan's house, later. His parents have entered his room, quite upset at his behavior earlier. Stan rests his head on his hands.
5;7;Sharon;Stanley, do you know why you're being grounded for ten months?
5;7;Stan;No!
5;7;Randy;Beating off the dog is not appropriate when we have company! [Sharon glances at him] Ah I mean, ever! Beating off the dog is not appropriate ever!
5;7;Stan;Why?! What's the big deal?!
5;7;Sharon;Stanley, don't you understand what you are doing??
5;7;Stan;"I was doing ""red rocket"" to make the dog's milk come out."
5;7;Randy;No, Stan! What you were doing to the dog was-ss sexual.
5;7;Stan;Huh??
5;7;Sharon;You were stimulating the dog, Stanley! What came out of him was his... r-Randy?!
5;7;Randy;Well, you know, when you do that to a m-male... the... eh eh you make his... stuff come out. [Stan looks confused] Well, Jesus, haven't they taught you these things at school?!
5;7;Stan;What things??
5;7;Sharon;Sexual education. Haven't you learned that yet?
5;7;Stan;No!
5;7;Sharon;Oh. Look, well, you see, Stanley,... Well, your school should be teaching this stuff!
5;7;Randy;Yeah! Let's get that damned school on the phone! [walks out the door. Sharon follows him out. Stan looks ahead blankly]
5;7;;South Park PTA meeting, night. The parents are there, clamoring and arguing.
5;7;Principal Victoria;Okay, parents. I know a lot of you want a chance to speak, but we have to talk one at a time.
5;7;Sharon;[stands] Look, our kids are learning sexual things on the street and on television. There's no way we can stop it. The schools have to teach them sexual education at a younger age.
5;7;Principal Victoria;School policy has been to teach sexual education later. In the fifth grade.
5;7;Mr. Tweek;It isn't soon enough.
5;7;Stuart;Yeah. Why, just this afternoon our son was caught beatin' off our dog. [Randy and Sharon look at each other in recognition of the act]
5;7;Chef;Look, parents. Do you really want your children learning about sex? Part of the fun of being a kid is being naive! Let them be kids for a while.
5;7;Ms. Choksondik;Naive at what cost, Chef? Parents, we have to face facts: Children in America are having sex at younger and younger ages. STDs are affecting younger and younger kids all the time. The only way we can combat that is by educating children before they have sex.
5;7;Chef;The first thing that kids learn about sex shouldn't be some bitch-scare tactic about STDs.
5;7;Sheila;[rising] No, she's right! With all the teen pregnancies that are out today, I think my boy does need to know about sexual education. [sits, then rises again] From the school.
5;7;Adults;Yeah. Uh huh. Yeah, we have to.
5;7;;"South Park Elementary, day. ""Fourth Grade B"" is shown on a classroom door. Sixteen boys are present."
5;7;Mr. Mackey;"Okay, boys, this is the first day of sexual education, m'kay? Now, I know that some of you think this is very funny. Words like ""penis"" and ""vagina."" [Stan, Kyle, Kenny, and Cartman stifle some giggles] Nuh- now STOP that, m'kay! We're goin' tuh get through this by being mature and grown up, m'kay. [turns and goes over to turn off the light, and turn on the projector with a remote control. Color cross-sections of male and female anatomies show up on the screen. Mackey jabs the screen with his pointer. The boys, especially Kyle, analyze the pictures. Mackey then points to the male anatomy] Now, this is the male anatomy, m'kay. Here we see the testes and the scrotum. [Stan, Kyle, Kenny, and Cartman stifle some more giggles] STOP that, m'kay! The next person that laughs is gonna get a referral! [the boys stop quick] M'kay. Now, in order to have intercourse, the man takes his penis, and he... hmmm... uhh... [slows his speech a bit] let's see, the man takes his penis, and he... hm."
5;7;Stan;Dude, haven't you ever had intercourse, Mr. Mackey?
5;7;Mr. Mackey;Well, sure I have! It's just... I was about 19 at the time, so it's been about 21 years... m'kay. Let's see, uh... [turns around and starts again] I'm pretty sure I took th-yeah I took the penis, and I bu- uh, what the hell did I do with that damned thing??
5;7;;"South Park Elementary, day. ""Fourth Grade"" is shown on a classroom door — this is Ms. Choksondik's room. Twelve girls are present."
5;7;Ms. Choksondik;Alright girls, even though this may be stuff you don't want to hear, you need to hear it.
5;7;Wendy;Oh, we wanna hear it, Ms. Choksondik. We're excited.
5;7;Bebe;Yeah, we think it's gonna be fun!
5;7;Girls;Yeah!
5;7;Ms. Choksondik;Fun! It's going to be fun! Well let's start with our first lesson, then, shall we? [writes on the board] SEXUALLY TRANSMITTED DISEASES!! [the girls sit quietly] That's right, because unless you get boys to wear condoms you can and will get a sexually transmitted disease from them! How fun is that, hmmm?! Is that fun?
5;7;Wendy;I didn't mean that-
5;7;Ms. Choksondik;"Today over 20,000 Americans will contract a sexual disease! TODAY! Twelve thousand more tomorrow! And the reason is that you girls wake up in the morning and say, ""It's not going to happen to me."" You say, ""Oh, Ms. Choksondik, that happens to girls in Detroit, in Brooklyn, but not here in Colorado."" WRONG! [the girls look chastened] Gonorrhea, herpes, chlamydia, HPV, HIV, syphilis, hepatitis B, hepatitis C, the list goes on and on! These are serious diseases! They have serious consequences! [the girls are definitely afraid] You think that sex is about fun and games and love? [now with a folder in her left hand] Wrong! Sex is about disease! Here's a little picture of herpes."
5;7;Girls;AAAHHH!
5;7;Ms. Choksondik;And here's a little syphilis for you!
5;7;Girls;AAAHHH!
5;7;Ms. Choksondik;That's right, girls. Here's what happens when you don't get boys to use condoms!
5;7;;The school kitchen, lunch.
5;7;Chef;Hello there, children.
5;7;Boys;Hey Chef.
5;7;Chef;How is sexual education class going?
5;7;Stan;It's dumb. Mr. Mackey doesn't teach us nothin'.
5;7;Chef;Yeah, I don't think Ol' Mackey knows a hymen from a hysterectomy. And Choksondik? I'd be surprised if she's ever gotten laid in her life.
5;7;Kyle;"Yeah... Chef, what's ""laid""?"
5;7;Chef;...Oh, nothin'. Now, move along, children, you're holdin' up the line.
5;7;;The school cafeteria, moments later. The boys exit the kitchen. Behind them are Tweek, Tolkien, Clyde, Butters, Kevin and Timmy.
5;7;Kyle;Hey! Maybe we should ask the girls what they learned in sex ed.
5;7;Stan;Yeah. [they approach the girls] Hey Wendy, did you guys get-
5;7;Girls;AAAAHHH! [hurry away from their table]
5;7;Kyle;What the hell is wrong with them? [the boys move towards the girls, who now have their backs against the far wall]
5;7;Stan;You guys, we just wanna know-
5;7;Girls;AAAAHHH!
5;7;Wendy;Stay away from me, Stan!
5;7;Stan;Why?
5;7;Wendy;Are you wearing a condom?
5;7;Stan;...A what?
5;7;Girls;AAAAHHH!
5;7;Bebe;Do any of you have your condoms on?
5;7;Kyle;No.
5;7;Girls;AAAAHHH!
5;7;Wendy;Don't you know that without wearing a condom you could get a disease?
5;7;Kyle;Nuh uh.
5;7;Bebe;Yuh huh! If you don't wear a condom, you're gonna get AIDS.
5;7;Cartman;AIDS?
5;7;Butters;Oh, jeez. Ah I don't wanna get the AIDS, fellas.
5;7;Kyle;Is that what you learned in sex ed?
5;7;Cartman;Mr. Mackey didn't say nothin' about that.
5;7;Stan;Dude, Mr. Mackey didn't know anything about anything.
5;7;Wendy;You guys have to wear condoms. Now, please, just, just go away. We don't want your AIDS.
5;7;Stan;[moves towards Wendy] But Wendy, we don't understand how that-
5;7;Girls;AAAAHHH! [they throw their food up in the air and scatter, leaving the boys confused]
5;7;Kyle;Oh my God, dude.
5;7;Butters;Uh what are we gonna do, huh?
5;7;Stan;Dude, we gotta go get condoms quick.
5;7;Boys;Yeah. [they set their meals down at nearby tables and walk away. Cartman returns for his meal and takes it with him]
5;7;;South Park pharmacy. The boys go in: Stan, Kyle, Cartman, Kenny, Clyde, Tolkien, Butters, Kevin, Tweek, and Timmy
5;7;Pharmacist;Can I help you boys?
5;7;Stan;Yeah, we need condoms!
5;7;Pharmacist;[looks at them funny] Condoms?
5;7;Kyle;Yeah. Quick!
5;7;Pharmacist;How old are you boys?
5;7;Stan;Why does that matter?
5;7;Butters;Ha-I'll be nine next week.
5;7;Pharmacist;Sorry, kids, I'm not selling you condoms.
5;7;Kyle;Well why not? You want us to get AIDS?
5;7;Pharmacist;I just don't think kids your age should be-
5;7;Assistant;[intervening] Mark, we have to be willing to supply condoms to anyone who requests them.
5;7;Mark;But... they're... children!
5;7;Assistant;Would you rather them do it unprotected?
5;7;Cartman;Yeah, you want us unprotected, asshole?!
5;7;Mark;I just think that all this sex ed and condom talk in elementary school is wrong!
5;7;Assistant;Kids are going to do what they do, and it's up to us to make sure they're protected.
5;7;Stan;Well, I'm glad this lady's on our side.
5;7;Mark;I don't think we have any that'll even fit them!
5;7;Assistant;Sure we do. We just got in the new Gladiators for kids. 'Lil Mini's. They're specially designed for kids under 10, and they're only five ninety five for a box of fifty.
5;7;Butters;Fifty?? Uh, can't we just use the same one every day?
5;7;Assistant;No, you have to change it.
5;7;Kyle;Oh, jeez, we're gonna have to buy tons of these things.
5;7;;Ms. Choksondik's house, night. Mr. Mackey has come by for a visit. Books sit on two tables and the floor
5;7;Mr. Mackey;Uh thanks so much for letting me come over, Ms. Choksondik.
5;7;Ms. Choksondik;Oh, it's no problem, Mr. Mackey. It's probably best we come up with a lesson plan together anyway.
5;7;Mr. Mackey;"Yeah I've already gone over most of the basics, you know, uh with the boys, but I uh... eh just wanted to see what else you were teaching the girls, in case I... ""missed"" anything."
5;7;Ms. Choksondik;[reaches for a book and opens it] Well we should make sure our students are good and scared of the consequences. We have to teach them that diseases are possible even with just oral sex.
5;7;Mr. Mackey;Right! Oral sex, which of course would be...
5;7;Ms. Choksondik;[reading, then she looks at him] Using your mouth on the penis or vagina.
5;7;Mr. Mackey;Penis or vagina, right. Oral sex, m'kay.
5;7;Ms. Choksondik;It's just too bad these girls are having sex so young.
5;7;Mr. Mackey;Yeah, why d-uh, did you?
5;7;Ms. Choksondik;Did I what?
5;7;Mr. Mackey;Well uh, how long did you wait before you had... uh... doobers.
5;7;Ms. Choksondik;Well, if you must know, I'm still somewhat of a virgin. [thinks, then quickly adds] But I'm not ashamed of it! I wasn't sought after much in high school or college. [rises and moves off some distance] I was made fun of most of my life for having such large glasses. [looks down at her rims] The only boyfriend I ever had was this attractive popular boy named Steven Garrett. I liked him very much, but I... found out that he was dating me because he lost a bet on the Super Bowl. The loser had to go out with me for three days.
5;7;Mr. Mackey;Oh, I'm... I'm sorry.
5;7;Ms. Choksondik;People can be very cruel. Anyway, I know it's hard to understand.
5;7;Mr. Mackey;Ah actually I understand perfectly. I... I wasn't exactly the captain of the football team, either, huh huh, hehehuh, [softly] anyhow [normal] And then as I got older my... my head just sorta seemed to get bigger while the rest of my body stayed the same. That's how I got my nickname in college. [places the book on the side table]
5;7;Ms. Choksondik;Your nickname?
5;7;Mr. Mackey;"""That guy with the really big head."""
5;7;Ms. Choksondik;...Right.
5;7;Mr. Mackey;Anyway, I... I sort of lost any confidence and found it impossible to ever ask a woman out, mm, hm mm.
5;7;Ms. Choksondik;Wow, I've... never met a man who is... as sexually unappealing as me.
5;7;Mr. Mackey;Neither have I.
5;7;Ms. Choksondik;[pause] Well, I'm quite happy without sex. I mean, with all the diseases and problems out there, who needs it, right?
5;7;Mr. Mackey;Uh not me! [they both giggle.] Huhuh, okay.
5;7;Ms. Choksondik;Well, back to the lesson plan, then.
5;7;Mr. Mackey;Right. [gets the book again]
5;7;Ms. Choksondik;"Okay. [they both open their books] ""Oral Sex"""
5;7;;Bus stop, day. The boys are gathered there waiting...
5;7;Stan;Doesn't it give any other directions?
5;7;Butters;"Nope. It looks like you're just supposed to roll it over your wiener. [takes a condom out and gives the bag it Kyle] ""If used properly, latex condoms are effective against pregnancy, AIDS and other studzes"""
5;7;Kyle;"Uh, what are ""studzes"""
5;7;Butters;How the heck should I know? [removes the wrapper from the condom] Why, it's just a little doughnut. [squeezes it a little] Hoh- it's all gooey.
5;7;Cartman;Just put it on, Butters.
5;7;Butters;Ha-a how come I gotta go first?
5;7;Cartman;Butters, will you stop ff-fili-bustering?
5;7;Butters;Ma-a-a-a-a-a alright, man. [turns his back to the camera and drops his pants, then slips the condom on] O-o-o-o-h, it's sticky.
5;7;Kyle;It says you gotta check it for holes or tears.
5;7;Butters;I don't even understand how this thing... ooh, wait. Oh, I see. [Cartman leans in for a better look]
5;7;Stan;Don't look at Butters' schlong, gaymo!
5;7;Cartman;I wasn't looking as his schlong, I was seeing how to put the condom on!
5;7;Kyle;Sure.
5;7;Butters;But it won't stay on. I- I need a rubber band or somethin'.
5;7;Tweek;Ah, I got rubber bands. [pulls a few out and walks over to Butters. Butters takes one]
5;7;Butters;[rubber band snaps in place] Ow! Huhuh, ow! Okay, eh. [snap] Ow! There. Okay, I think it's on.
5;7;Stan;How do you feel?
5;7;Butters;...Pretty good.
5;7;Cartman;Do you feel protected?
5;7;Butters;Yeah, there ain't nothin' that's gettin' in my wiener through this thing? A-and it's even got a little reservoir at the end so you can... pee in it.
5;7;Stan;Alright, here, everybody. [begins to move from his end to the other, visiting each of the boys] Tweek, give everyone a rubber band. Hey, somebody's gotta help Timmy put his condom on.
5;7;Timmy;Timmehah!
5;7;;South Park Elementary, day. Principal Victoria has called the teachers together in her office. Chef is there as well.
5;7;Principal Victoria;Teachers, I have some bad news. Last night I received a phone call from the local pharmacist. Apparently, almost all of our fourth graders are sexually active. And now that we've scared them a little they're buying condoms to use.
5;7;Ms. Choksondik;I knew it! Well, at least we scared them enough to protect themselves. But now maybe you'll believe me when I say that we need to be teaching even younger than fourth grade.
5;7;Principal Victoria;But how old do you think a student should be when they learn about proper condom use?
5;7;Ms. Choksondik;...Kindergarten.
5;7;Chef;Kindergarten?!
5;7;Ms. Choksondik;We've got to get to the students before they start having... sex. Nu-not after.
5;7;Chef;Aw, now this is getting ridiculous!
5;7;Mr. Adler;I have to agree with Ms. Choksondik. It's our responsibility to make sure our kids are safe if they're gonna screw around.
5;7;Principal Victoria;I guess we have no choice.
5;7;;Kindergarten, next day.
5;7;Mr. Garrison;Okay, children, who can tell me what a condom is? [puts a box of Gladiator condoms on the table. The kindergartners look at him, and finally a girl raises her hand] Yes, Jenny?
5;7;Jenny;It flies around and it's endangered.
5;7;Mr. Garrison;That's a con-dor, Jenny. Con-dor. [holds up the box] Con-doms are what we use to stop the spread of STDs. [Filmore raises his hand] Yes, Filmore?
5;7;Filmore;Can we do fingerpaint?
5;7;Mr. Garrison;NO, we can't do fingerpaint! You kids wanna get herpes?! Huh?! How about a nice bucket of AIDS?! Sound good?! Now pay attention, alright? I'm going to show you the proper way to put on a condom. [puts a phallus on the table] First of all you remove the condom from its package. [demonstrates] Then you find which way the condom rolls out. [demonstrates] Put it in your mouth... [puts it in his mouth] And apply. [proceeds to do so. The kids watch on astonished, and one of the boys finally cries. Mr. Garrison finishes and raises his head] And it's as simple as that. Any questions?
5;7;;Ms. Choksondik's classroom, same time.
5;7;Ms. Choksondik;Alright girls. Yesterday we went over the myriad of diseases you can get from boys, but today we're going to talk about the most horrible they can give you of all. [writes on the board] PREGNANCY! [turns around] That's right, since you girls have decided to be sexually active, teen pregnancy is at an all-time high! You seem to think it's gonna be fun and neat to have a baby-well, let's watch a little video, shall we?! [goes towards the door and wheels back a TV cart with VCR, and turns on the TV.]
5;7;Narrator;"[""The Miracle of Child Birth""] Snacky S'mores presents: The Miracle of Child Birth. [shot of the girls watching] The time is drawing close for delivery. Here we can see the water breaking."
5;7;Girls;Eeeeww. [as the narrator speaks, the girls get more and more shocked]
5;7;Narrator;Later, the contractions are happening closer together. Mom sure is in a lot of pain. Now we can see the crown of the baby's head, stretching the vaginal walls in ways never before thought possible by Mom. Finally, the miracle happens, and the baby is born. [Screen shot of baby being handled by the doctor is shown] but Mom's not done yet.
5;7;Girl;Eeww.
5;7;Narrator;She still got some afterbirth to push out of her. [shot of afterbirth being pushed out]
5;7;Girls;AAAAAAAA!!!! [they get out of their seats and rush out of the room]
5;7;Narrator;That's right.
5;7;Ms. Choksondik;[follows the girl to the door] Girls! Girls! Where are you going?! [gets no answer, but she sees Mr. Mackey in front of her, in the hallway ending at her door, about to enter another door. She looks down and notices his butt, and just stands there...]
5;7;;Mr. Mackey's class, later. Some of the boys, including Stan and Kyle, have their hands over their crotches.
5;7;Stan;Man, this condom's driving me crazy.
5;7;Kyle;Yeah. I've changed mine three times already 'cause it itches so much.
5;7;Cartman;Yeah, but it makes going to the bathroom easier. [takes a condom just filled with urine and tosses it at the trashcan. It hits the side and splatters the urine next to the can.]
5;7;Mr. Mackey;[enters with briefcase and books] Alright, boys, I now have all the information I need to teach you the female anatomy, hm'kay. [tosses the briefcase and books onto his desk and moves towards the light switch, grinning. He turns off the lights and starts the projector] M'kay, this part here is the vaginal opening. [a picture of the female reproductive system. He points to the opening. Cartman works on a new condom] This is where the man puts his- Eric, what the hell are you doing?
5;7;Cartman;I'm putting on a new condom. I filled the other one up.
5;7;Mr. Mackey;Why are you wearing a condom?
5;7;Cartman;So I don't get AIDS.
5;7;Mr. Mackey;Eric, you can't get AIDS from just sitting around, you have to get it from sex.
5;7;Stan;From sex??
5;7;Mr. Mackey;Yes.
5;7;Kyle;You mean, intercourse with a girl?
5;7;Mr. Mackey;Yes! Now will you all pay attention, please?! The vagina and the clitoris are on the outside, and they are in fact very easily visible to the naked eye.
5;7;Stan;All this time... It's the girls that give us diseases!
5;7;Cartman;I knew it! Girls lie! They lie right to your face!
5;7;Mr. Mackey;Now here we can see the interior female anatomy. Things like the uterus and the ovaries are on the inside
5;7;Kyle;Well that does it! If us boys are going to live, we have to get rid of the girls!
5;7;Stan;Yeah, come on guys, this is war! [leaves his seat and heads for the door. The other boys follow]
5;7;Boys;[among their statements] Yeah! That's right! Come on!  [The last of the boys leaves, and Mr. Mackey doesn't notice. He begins to daydream. The generic female drawing turns into one of Ms. Choksondik, and he grins. He goes to the screen again, and moves his hand over the image]
5;7;Mr. Mackey;And here we see the tender, magical uterus. Here we see the enticing, voluptuous Fallopian tubes, m'kay.
5;7;;Mr. Garrison's room, later
5;7;Mr. Garrison;Okay, children, now I wanna review the different sexual positions. Who can tell me which sexual positions we talked about?
5;7;Filmore;[raises his hand] Miss'nary position?
5;7;Mr. Garrison;[turns around and writes the position] Missionary position, good. A little boring, but tried and true. What else?
5;7;Girl;Doggie?
5;7;Mr. Garrison;[turns around and writes the position] That's right. Doggie style we went over, mhm.
5;7;Boy;Pile driver?
5;7;Mr. Garrison;[turns around and writes the position] Uh huh, pile driver position. Good, Quaid.
5;7;Flora;The Filthy Sanchez?
5;7;Mr. Garrison;[turns around and writes the position] Yes, good Flora, you remembered the Filthy Sanchez.
5;7;Boy 2;Hot Karl?
5;7;Mr. Garrison;[turns around and writes the position] Yes,you can give your partner the ol' Hot Karl, sure.
5;7;;A barren field near the school, day. An army of boys comes in from a distance in makeshift military vehicles. Butters is wearing a hockey mask. Clyde comes up and stops them.
5;7;Clyde;"There, you see? The girls have built some kind of stronghold to keep us out. [the stronghold has a moat and reads: ""Boys Keep Out""]"
5;7;Wendy;[at the helm of a gun turret] Stay away from us, bastards! We don't wanna get pregnant!
