Unh unh unh! Just go right back to your room and sing a ballad, mister!"
12;13;Bridon;Just let me go.
12;13;Mr. Gueermo;"Go ahead. Make my day. [gets down on his left knee and threatens] You get upstairs, or I will slap you until there's little red handprints all over face! [Bridon punches him on the nose] Ow! [covers his nose and stands up] Oh my God, what was that? [runs to his wife] Did you see that?! Oh my God, it hurts so bad! [she punches him harder] Ow. What the ""H"" is going on?! [she punches him again, and he runs off, crying. Bridon looks on in awe] What are you doing?! Everyone's crazy!"
12;13;;Stan's house, the same night. He's on the sofa immersing himself in the High School Musical movies. Kyle, Cartman, Kenny, and Scott enter.
12;13;Kyle;Well, I had to see it to believe it!
12;13;Cartman;I told you guys. He's been watching High School Musical over and over again.
12;13;Stan;Actually, this is High School Musical 2. It has a dance-along part.
12;13;Kyle;We said we wouldn't be a part of this fad and look at you!
12;13;Kenny;(Yeah, look at yourself, dude.)
12;13;Stan;Look, you guys might be fine with being outcasts and hanging out with Scott Malkinson, but I'm not!
12;13;Kyle;You know what? At least Scott Malkinson has some self-respect! At least Scott Malkinson doesn't cave into peer pressure and start doing musicals!
12;13;Stan;Scott Malkinson has a lisp and diabetes! Nobody's gonna let him do a musical!
12;13;Scott;'At's enough, you guys, it's not cool. Lots of kids have diabetes, and you shouldn't be-
12;13;Cartman;You shouldn't pick on kids with diabetes, that's not cool. I'm Scott Malkinson.
12;13;Stan;Look, guys. [gets off the sofa and walks away from the other boys] The world is changing. We can't fight it, we have to change with it. I've been watching these movies, and from the looks of it, there's gonna be a lot more singing and dancing when we get to high school. [turns around to face them] And if you think we'll gain any respect by ignoring this thing and being individuals, then think about this: right now, [points to them] everyone thinks Butters is way cooler than any of you.
12;13;Cartman;That's a low blow, Stan.
12;13;;"South Park Elementary, day, the school gym. A basketball game is in progress, five on five. Mr. Mackey and Mr. Adler are doing play-by-play. ""Rock & Roll Part II"" plays from the speakers"
12;13;Mr. Mackey;Third team foul on Westchester Bobcats, m'kay. Ball goes back over to the Cows.
12;13;Mr. Garrett;All right, you ready to get in there, Bridon?
12;13;Bridon;[approaches wearing #11] I'm ready, coach.
12;13;Mr. Garrett;Give 'em hell! [Bridon goes in and faces off against the Bobcats' #9. He tosses the ball over to #7, Bradley, and then notices his parents on the bleachers. His mom waves hi, his dad looks away displeased.]
12;13;Mr. Mackey;"Just a minute to go in the first quarter. [Bridon gets the ball back and shots from the top of the key for a 3 pointer. Everyone applauds him, but his father still isn't looking at him. Mr. Gueermo does, however, notice the crowd's excitement and soon gets into it himself. The song changes to ""We Will Rock You"" and the crowd gets into that with two stomps and a clap. Mr. Gueermo joins right in]"
12;13;;South Park, next day. The kids are milling around the entrance, so classes haven't started yet.
12;13;Bebe;Hey Bridon, how come you weren't at musical rehearsals last night?
12;13;Bridon;I joined the basketball team. I gave up singing and dancing forever. I'm just not into it.
12;13;Wendy;You gave it up?
12;13;Stan;"[walks into view with the other three boys] That's right. You know, sometimes you have to go with what your heart tells you. There's things we're all good at. And we just can't keep them bottled up inside. [music begins to play]

'Cause you gotta do what you wanna do.
Don't let nothin' get in your way, chase your dream every day. [walks up to a boy and girl]
True, girl, you know it's true,
that if you really wanna be you, you've gotta do what you wanna do. [walks back to Bridon]
He was unhappy 'cause he just wanted to play ball"
12;13;Cartman;"[approaches two other kids] 
But he finally got the courage to answer his heart's call."
12;13;Stan;"Just like me, all I ever wanted was to sing and dance.
And now that I stood up for my dream I finally have the chance.
[the four boys form a chorus line and dance]"
12;13;Boys;"You've gotta do what you wanna do. Even if other people don't really want you to.
[Kyle whips off his hat while approaching two girls]
True, girl, you know it's true, [returns to the chorus line] that the thing you wanna do is the thing that you should do.
[Kyle dances away to two other girls]"
12;13;Kyle;"Some kids think I'm strange 'cause I like studying for an exam
But I don't let that bother me, because it's who I am. [Cartman dances over to two kids]"
12;13;Cartman;"And I like nothin' better than makin' fun of Jews.
And ripping on black people, though some people think it's rude, but you gotta- [rejoins the chorus line with Kyle]"
12;13;Boys:;"Do what you wanna do.
Just make sure that what you're doing is what's cool and popular with everyone
Chew, baby, chew and chew.
When you're eating jerky, if eating jerky is what you wanna do."
12;13;Bebe;[arrives with Wendy, Red, and another girl during the song] Hey Bridon, can we watch you practice basketball?
12;13;Bridon;Uhh, sure. [the girls follow him to the gym. The other students go their separate ways.]
12;13;Kyle;Do what you want, don't have restraint.
12;13;Cartman;Don't stress about it or you just might faint.
12;13;Kenny;(If you wanna get high and jack off, it's cool.)
12;13;Stan;You gotta do what you wanna do!
12;13;Boys;"Do what you wanna do.
As long as what you wanna do is what everybody wants you to.
Glue, baby, buy some glue
Just in case if what you're doin' [Stan continues singing, they all keep dancing]"
12;13;Stan;involves needing scissors and glue!
12;13;Scott;Hey guys. Hey guys! [all stop. Stan looks around and doesn't see anyone else]
12;13;Stan;Huh? [the other boys turn around]
12;13;Kyle;Where did everybody go?
12;13;Scott;The girls all wanted to go watch 'at Bridon kid practice basketball.
12;13;Stan;But the girls like singing and dancing.
12;13;Scott;No, I think the girls just like that Bridon kid, no matter what he does. [leaves]
12;13;Stan;But... No, we just... No, no wait. We just got good at this! Aw!.
