12;5;Mrs. Garrison;"You did this to yourself, Garrison. Get your hopes up with a stupid genetic experiment and now all your money's gone along with your penis. [a squeaky thing is heard. Garrison notices and stops crying] Well what the? [raises her head and looks down, then looks towards her feet. The mouse that has been fleeing all night is now struggling to get on the bench] Why... it's my penis. [the mouse is now wholly on the bench] My penis came back. But why? [the mouse moves closer. Mrs. Garrison lowers her left hand to the bench. The mouse walks onto her hand, and she lifts it up] I guess it's true. What's that old saying? ""If you love your penis, let it go..."""
12;5;;Jim Davis High School Auditorium. Mrs. Miller addresses the audience while Mr. Cartmanez' class stands behind and to the left of her
12;5;Mrs. Miller;The standardized advanced placement test is considered one of the most difficult and carefully monitored tests in the country. Twenty-four of our students took the test and all twenty-four scored 100% [their parents applaud. Melita and a short boy look at each other]
12;5;Teen boy 6;Uh, can we say something?
12;5;Mrs. Miller;Sure. [leaves the podium. The short boy reaches for a plaque and hands it to the taller boy, who now takes the mic]
12;5;Teen boy 6;We would like to present this plaque to the person who taught us the White People Method. Mr. Cartmanez! [Cartman, standing far from the podium and off to one side, walks up to the podium and reaches the mic. The students gather 'round him and clap as adults take pictures.]
12;5;Cartman;[basking in the success] I reeached these keeeds.
12;5;;South Park Elementary, main entrance. Everyone is gathered there for a special occasion
12;5;Principal Victoria;Students and faculty, please put your hands together and help me in welcoming back, Mister Garrison. [everyone claps as Mr. Garrison makes his return]
12;5;Mr. Garrison;Thanks everyone. It's great to be back. I'm a man again. Thanks to my very special new friend. [the mouse that grew his penis climbs onto his right shoulder, the penis having been removed from it and attached to Mr. Garrison. Garrison turns around] But you know, I've learned that I've really been a dude all along. Because the key difference between men and women is that women can have babies. If you can't have babies, then, you're a man.
12;5;A Teacher;Whoa uh wait, uh, hang on a second. My wife had ovarian cancer, so she can't have babies.
12;5;Mr. Garrison;Well then get an AIDS test, Thompson, 'cause your wife's a dude, faggot! [Thompson is dumbfounded. Garrison turns around and jumps up to click his heels] Yeah! I'm back!
