12;6;;Stan's house, night. He's at his computer browsing the Internet. His mom pops in...
12;6;Sharon;Get off the internet, Stanley, It's time for bed
12;6;Stan;Mom, I just gotta do a couple more things
12;6;Sharon;Now, Stanley. The Internet will be waiting for you in the morning. Off!
12;6;Stan;[sighs] Aw man! [shuts off his monitor as Sharon leaves, then goes to bed. Sharon heads for Shelly's room]
12;6;Sharon;Shelly, off the Internet. It's bedtime.
12;6;Shelly;Mom, I'm i-chatting with my boyfriend in Montana!
12;6;Sharon;Now, Shelly! [leaves and closes the door]
12;6;Shelly;Why do you hate me?!
12;6;Sharon;[entering Randy's study] Randy, off the Internet.
12;6;Randy;Nooo. Naw come on, leave me alone.
12;6;Sharon;No, mister, it's time for night-night.
12;6;Randy;But Sharon, I've got stuff to do. I've gotta see my credit rating, I've gotta send an e-mail to Nelson and check out Foley's vacation photos-
12;6;Sharon;You don't have to do all that now! You can do one more thing and then it's bedtime. [leaves and closes the door]
12;6;Randy;[left to his thoughts] One more thing? [thinks a bit and then starts typing quickly] Ooooyeah... [starts masturbatng under the desk]
12;6;;Stan's house, next morning. The sky brightens just before dawn.
12;6;;Stan's room, 7:30 a.m. His alarm goes off and he sits up, turns the alarm off, and heads for his computer. He turns on his monitor and tries to visit Steam. His browser tells him he's not connected to the Internet
12;6;Stan;What the hell?
12;6;Randy;[entering, still in his night robe] Stan! Stan, I gotta use your computer! [reaches Stan's desk with urgency and moves Stan away]
12;6;Stan;What?
12;6;Randy;"My Internet's not working; I gotta use yours. An-and give Daddy some private time, will ya?"
12;6;Stan;My Internet's not working either.
12;6;Randy;What?! [sees but doesn't believe]
12;6;Shelly;[enters Stan's room with her laptop] Dad, the Internet's not working!
12;6;Randy;[pulling on some cables] I know that, okay?!
12;6;Shelly;I have to get online with my darling Amir before school starts!
12;6;Sharon;[enters] Randy, I can't get my e-mail to open.
12;6;Randy;[leaves the computer to be in the middle of his family] Everybody just, just calm down! Calm down, all right?! It's going to be okay! We just CAN'T. PANIC. [he's the only one looking panicked]
12;6;;The Broflovski house, moments later. The doorbell rings and Gerald answers in his pajamas. He's got a cup of coffee with him. The Marshes are there in their night clothes
12;6;Randy;[in despair] Gerald. Please help us.
12;6;Gerald;Randy. What happened?
12;6;Randy;Our house... It has no Internet.
12;6;Sheila;[arrives and stands next to him] Oh my God.
12;6;Randy;[enters the living room] We've got nothing! It's just gone.
12;6;Gerald;Come in. You can use our Internet until you figure out what to do.
12;6;Randy;[gratefully] Thank you Gerald. [the other Marshes enter]
12;6;Stan;[heads for a computer] I'm getting on it first.
12;6;Randy;[giving chase] Oh no you're not!
12;6;Stan;[steps into Kyle's room] Kyle, I need to use your Internet
12;6;Kyle;Ih it's not working.
12;6;Randy;[steps into Kyle's room] What?!
12;6;Kyle;I've even unplugged it and plugged it back in.
12;6;Gerald;No. [rushes to the computer to see for himself] No, our Internet can't be broken. Ah, I've gotta get an attachment Larry sent me last night.
12;6;Randy;[firmly] It's not working, Gerald.
12;6;Gerald;But it has to work! Maybe if I do a little-
12;6;Randy;Your Internet's not working, Gerald! Face it!
12;6;Kyle;I have to get online before school.
12;6;Stan;What about Starbucks? They have free Internet.
12;6;Randy;Right, Starbucks!
12;6;Gerald;"Everyone get your stuff; we can take my car."
12;6;;Outside. As the two families head for Gerald's SUV, Stephen Stotch walks by. Behind him, a couple stands looking at their laptop
12;6;Stephen;Hey, is your- is your guys' Internet working?
12;6;Randy;No! Nobody's is!
12;6;Man 1;[comes out of his house with a laptop] Whaaaaat's haaappeniiiiing?!
12;6;Randy;Jesus. Everyone's gonna go to Starbucks now.
12;6;Gerald;Everyone in the car. We have to beat them there. [everyone climbs in.]
12;6;;En route. They move down the road while on either side people have no idea what to do without the Internet.
12;6;Randy;God, the whole neighborhood's affected. [a man sticks a Yoshiba laptop in front of the windshield]
12;6;Gerald;Get out of the way, Peterson! [motions him away]
12;6;;Starbucks Coffee. A crowd is already gathered there hoping to get inside
12;6;Clerk;Folks, there's, there's no Internet here. It's not working, I tell ya.
12;6;Kyle;It's not working here?
12;6;Randy;Kids, get back in the car. We can go to the Mac store.
12;6;Man 2;No, don't. You're wasting your time.
12;6;Randy;How do you know?!
12;6;Man 2;Because we just came from there! There was nothing! Not one scrap of Internet!
12;6;Gerald;How can there be no Internet anywhere? What's going on?!
12;6;Stephen;Anybody got a Blackberry? Check Drudge Report.
12;6;Randy;Good idea! [walks forward a bit and pulls out a Blackberry] No wait, we can't check Drudge Report: there's no Internet!
12;6;Mr. Garrison;[with pipe and laptop] There has to be a way to find out what's going on.
12;6;Gerald;We can't! Don't you get it?! There's no Internet to find out why there's no Internet!
12;6;Man 3;What did we used to do to get the news before the Internet?
12;6;Randy;[thinks a moment] A television! [everyone else thinks, then moves down the street as if they were one]
12;6;;"Tele's, moments later. Randy walks up to the plate-glass window with a chair and smashes the chair through it. Jimbo walks into Tele's first and everyone else follows. Jimbo turns on a TV and everyone else gathers to see the news. Onscreen, the small floating window says ""This page cannot be displayed."" At the bottom of the screen is a crawl that reads ""THERE IS NO INTERNET"""
12;6;Anchorman;Once again we apologize, but we cannot bring you the news. It appears that we have no Internet here at News 4. We'll be happy to bring you up on current events just as soon as our Internet is back.
12;6;Randy;Jesus, it's statewide.
12;6;Gerald;It could be nationwide.
12;6;Anchorman;Hello? Do you have Internet? It it's Channel 4 News. No, we don't have Internet either. [everyone leaves Tele's]
12;6;Gerald;No Internet... anywhere...
12;6;Randy;Jesus... we're all alone... [POV change to a shot of the town from a distance. Another POV change to a shot of the town from even further away]
12;6;;South Park shopping district. The town seems empty. A window shutter opens and closes somewhere. It's Monday. Next scene is a shot of the Marsh house, eight days without Internet. Tumbleweeds begin to roll in. Inside, no one is doing much. Randy's asleep on the couch, Shelly's sadly looking outside, Stan sits on the floor, Grandpa is in his wheelchair. Randy begins to cough
12;6;Sharon;What's the matter?
12;6;Randy;I don't know. I need to get on Web MD and see why I have this cough, but I can't. [coughs]
12;6;Shelly;What if my sweetheart is online looking for me? He could be wondering why I don't get online with him. Maybe he thinks I'm dead. [looks at Stan] If my darling Amir gets another Internet girlfriend, I'm gonna kill him! And you! [starts punching Stan around like a punching bag. Stan screams]
12;6;Randy;[pulls Shelly away from Stan] Hey! Shelly, whoa, stop, stop!
12;6;Stan;Dad, you've gotta do something! She's out of control!
12;6;Randy;You're right. We can't just sit here any longer.
12;6;;Sometime later. The Marshes have packed and weighed their car down with everything they can load up on it.
12;6;Gerald;Randy, where will you go?
12;6;Randy;We're gonna head west. There's a rumor goin' around there might be some Internet out there. So we're headed out Californee Way.
12;6;Gerald;You don't know if there's any Internet in California.
12;6;Randy;Well there certainly ain't none here! Look, maybe it's time you all face reality! The Internet here is dried up!
12;6;Stephen;It could come back.
12;6;Randy;Yeah, and maybe it won't! In the meantime I got a family who needs the Internet right away. We'll head out Californee Way and ... see what we can find. [motions to Sharon] Come on, let's go.
12;6;Stephen;Look, if you... if you do find the Internet, let us know, will ya?
12;6;Randy;How. You won't have Internet. [starts the car and moves out]
12;6;;"En route to California. Randy takes the Mother Road, Route 66, all the way there. They enter Arizone and pass a man holding a sign saying ""Californee. Need Internet."" They stop at a Canyon Motel - which has no Internet"
12;6;Motel Clerk;[fanning himself] Sorry folks, we're full up.
12;6;Randy;Know anywhere else we can stay? We're... heading out Californee Way. Looking for some Internet.
12;6;Motel Clerk;You and everyone else. You'll have to stay out at the transient camp with all the others heading to Californee. [motions the direction of travel] It's about a mile down the road.
12;6;;Transient Camp. $50, night. The full moon shines brightly behind the trees. The camp is a tent and a farmhouse. Randy takes up the guitar and starts playing
12;6;Randy;"I'm goin' down the road feelin' bad.
I'm goin' down the road feelin' bad.
I'm goin' down the road feelin' bad, oh Lordy.,
My Internet done up and went away. [an elderly man weeps]"
12;6;Transient Man 1;Where are you from, old-timer?
12;6;Old-Timer;Kansas City. Had me a store there. Kind of... computer supply store. When the Internet went, the stores went too.
12;6;Transient Man 2;Things will be different when we get out to Californee. Soon as we get us some Internet we can all rest easy.
12;6;Transient Man 3;Why sure, Silicon Valley. They gots a whole mess of Internet up there. 'Say a man can practically roll around in it.
12;6;Transient Man 4;When I get to that Internet I'm gonna click on just about everything in sight. 'Might even click on a pop-up ad just for the heck of it.
12;6;Transient Man 1;Well I'm gonna sit down at that Internet and just stahrt e-mailin'. Just keep on e-mailin' till my fingers are sore to the bone.
12;6;Randy;Sure will be nice. [Stan looks really sad]
12;6;Transient Man 5;You folks all headin' to Silicon Valley?
12;6;Randy;That's right. We need to get online.
12;6;Transient Man 5;"Haha. ""Get online"" he says."
12;6;Stan;[annoyed] What's so funny about that?
12;6;Transient Man 5;Think about it. How many folk headin' out to Californee? A million? More? And how much Internet you think they got out there? [the other men look at each other] Might be some Internet, sure, but with everyone tryin' to use it at once, it's gonna go real slow-like. I knows it 'cause I seen it. My two children, they tried to load a Web page. Took them over three days. They sat there waitin', and by the time the loadin' bar was only half-full they was dead. [his eyes begin to well up] Starve on the Internet, with a belly stuck out like a big bladder... [weeps]
12;6;Randy;Come on, Stan, let's get some rest. [the group breaks up for the night]
12;6;;The campsite. The Marshes have set up camp. Stan heads for a sleeping bag when he notices Shelly crying.
12;6;Shelly;Amiiir... I miss you so much...
12;6;Stan;[walks up to her] Don', don't cry, Shelly. You'll be able to get online when we get to Californee. [she just sits up and punches him away like a beach ball, then lies down without a break in crying]
12;6;;The Marshes enter Californee
12;6;Randy;Everyone, wake up! [the others wake up] We're here! Silicon Valley, Californee! [takes an off-ramp]
12;6;;An Internet Refugee Camp, run by the Red Cross. A big-city skyline is seen in the distance. The camp is well-guarded, and cars go in one by one. Randy drives up to the entrance, where a Red Cross worker greets him
12;6;Worker;Name?
12;6;Randy;Do they have Internet here?
12;6;Worker;Name?
12;6;Randy;Marsh.
12;6;Worker;Service provider?
12;6;Randy;NetZero.
12;6;Worker;All right, stay in line. [moves on to the next car] Once you're inside, Red Cross volunteers will direct you to your campsite.
12;6;Randy;So is there Internet here?
12;6;Worker 2;[voice only, from the front] Stay in line and get to your campsite. [Randy drives forward and into the camp]
12;6;;The campsite interior. The camera scans the place until Randy's car comes into view. The car stops and the family steps outside. Randy walks up to two men sitting by a tent
12;6;Randy;Excuse me, we're looking for some Internet.
12;6;Refugee Man 1;Yeah, they've got it here. [Randy gives a thumbs up]
12;6;Stan;All right!
12;6;Refugee Man 2;But there ain't enough to go around. All they got is a little Internet. [curls his thumb and index finger to create a small space between them] Barely a bar a signal. So they have to ration it out, carefully.
12;6;Refugee Man 3;Ya... sign up over there and use your time when they call your name. Each family gets 40 seconds o' Internet per day.
12;6;Randy;Forty seconds? That ain't even long enough to check Wikipedia!
12;6;Volunteer 1;Well it's all we got, so we gotta make do.
12;6;Refugee Man 4;Look, honey, we ordered us some books on Amazon.
12;6;Volunteer 2;All right, time's up.
12;6;Refugee Man 4;No! No wait! I haven't entered the shipping information! [an MP hauls him away] NO! NOO!
12;6;Volunteer 2;Next? Brady, John H.
12;6;Randy;Awww, how am I supposed to see Internet porn that way? [Sharon is within earshot]
12;6;Sharon;[walks up to him] What did you say?
12;6;Randy;Uh, you go ahead, Sharon. Divide some Internet amongst the children. I- gotta talk to somebody.
12;6;;The Broflovski house, day. Another tumbleweed rolls by. The Broflovskis are watching TV. Two anchors are on screen with a fax machine between them
12;6;Anchorman;And that's about all we know. Uhh, there might be some Internet still in California and parts of Florida, though we certainly still don't have any here. [the fax machine starts printing]
12;6;Anchorman 2;A fax! A fax is coming through! [points to it with both index fingers with lots of enthusiasm]
12;6;Anchorman;Oh yeah, a fax!!
12;6;Anchorman 2;Oh a fax!
12;6;Anchorman;It's a fax, it's a fax! It's a fax, it's a fax!
12;6;Anchorman 2;It's a fax, we got a fax! [the fax copy pops out and both men grab for it. ] Uh-
12;6;Anchorman;"Oh! it says, ""The government has sent their best people to the Internet in order to repair it."""
12;6;Anchorman 2;[a few seconds later] We've gotta send a reporter out to the Internet!
12;6;Kyle;Where... is... the Internet?
12;6;;A bright morning in the Southwest desert. Military helicopters appear and descend on a secret landing
12;6;General;Gentlemen, the President is very angry that his Internet still isn't working.
12;6;Scientist 1;We've tried everything, sir, but the Internet has slowed to a trickle and we can't get it working correctly.
12;6;General;Take me down below! I want to see the Internet for myself!
12;6;;Down below is a huge cave with research equipment all over the place.
12;6;Scientist 2;Here it is, general. The Internet. [before them is a colossal router]
12;6;General;What's wrong with it?
12;6;Scientist 2;See that flashing orange light in the middle? It's supposed to be solid green.
12;6;General;[walks towards it a bit, in awe] My God.
12;6;;The refugee camp, later. Another man is looking at the Internet.
12;6;Transient Man 6;"Hahaha, thedancingkitty.com, heh, wum, I wonder what that is, hum? [the site appears in the browser] ""Click on the dancing kitty and you could win a prize!"" hoh, ahaha, ha."
12;6;Volunteer 2;All right, time's up.
12;6;Refugee Man 5;No, wait, I I just clicked on the kitty. I got it. [the MP comes up and hauls him off too] No! It wasn't long enough! NOO!
12;6;Volunteer 2;Next? Nelson, Peter T.
12;6;Randy;[approaches a volunteer] Excuse me, I need to uh, have some private Internet time.
12;6;Volunteer 3;Look, we're just tryin' to get by here. Everyone's gotta take what they can get.
12;6;Randy;[grabs the volunteer's arm, takes him aside and says in a soft voice] I haven't jacked off in over two weeks.
12;6;Volunteer 3;So jack off.
12;6;Randy;[lets go] You don't understand. [the volunteer crosses his arms] I need the Internet to jack off. I... got used to being able to see anything at the click of a button, you know? Once you jack off to Japanese girls puking in each other's mouths you can't exactly go back to Playboy!
12;6;Volunteer 3;What do you want us to do? Pick up the whole computer and put it inside for ten minutes just for you?!
12;6;Randy;Three minutes would be plenty.
12;6;Volunteer 3;Get lost! [walks away]
12;6;Randy;[feeling pain in his genitals] Ohhh.
12;6;;Back at the campsite.
12;6;Sharon;[handing out tickets to her children] All right, each of you take a ticket. When they call your name you can use the Internet.
12;6;Shelly;What number are you, turd?
12;6;Stan;Eight fifty one.
12;6;Shelly;[switches tickets with him] You're nine twenty three now.
12;6;Stan;Hey! Mom!
12;6;Sharon;[returns] Shelly, give your brother his ticket back!
12;6;Shelly;Can't you all see I'm in pain?! Nobody understands pure love! Amir and I are closer than anybody in this stupid family! [runs away]
12;6;;Randy walks slowly due to his aching balls. He doubles over from time to time
12;6;Refugee Man 5;Psst. Hey! Over here! [Randy looks over, then walks to the man] You... happen to be looking for Internet porn?
12;6;Randy;Yeah, how'd you know?
12;6;Refugee Man 5;Lots of us fellas came here for that reason. We all got used to seein' lots of really perverted stuff on the Internet, so now we can't go back to Playboy.
12;6;Randy;I know, right?
12;6;Refugee Man 5;"Anyway, we got us a simulator. You just call out what you wanna see and then say ""click""."
12;6;Randy;"""Internet Porn Simulator"" [the tent is an ""Internet Porn Simulator. Whatever you want to see.""]"
12;6;Refugee Man 5;"Give it a try. [lifts up one of the entrance flaps for Randy. Randy enters and sees a makeshift computer on a desk. The monitor is a hollow box. Randy sits down. A hand descends into the hollow box holding a sheet of paper that says ""Anything you want to see with the click of a button!""]"
12;6;Randy;Uh, Japanese girls exchanging bodily fluids? Click. [the hand goes up, some scribbling is heard, and the hand comes down again with a picture of one Japanese stick figure pissing on another's face while the second stick figure lies on her back. This does not arouse him. He rolls away from the desk] Oh this sucks! I can't jack off to this! [no one responds] Damn it. [rolls back to the desk and unzips his pants.] Uhm, let's see. Interracial gangbang. Click. [gets ready to masturbate in anticipation. The picture comes down, and it's three black stick figures with their cocks out surrounding a Japanese stick figure.] Agh. Les-shemales! Let's try shemales. Click. [another picture comes down, this one of a stick-figure woman with a penis. Randy is grinding away down there] Bestiality? Click, click on that. [the next picture is that of a stick-figure man fucking a stick-figure pet in the ass. Randy is close to climax] Ah, ah! Brazilian fart fetish porn?! Click! Click! [the next picture is that of a Brazilian stick-figure woman farting on a stick-figure man.] Dahya. [the climax fails to arrive] No. No, this isn't gonna work. [pounds his fist on the desk and walks out] It's just not the same.
12;6;Refugee Man 5;Well, sorry. And that'll be $49 on your credit card.
12;6;Randy;[reaches into his back pocket for his wallet] Well at least that part's like the Internet.
12;6;;The Broflovski house, day. The Broflovskis are watching the news
12;6;Anchorman;We, we now have a reporter on the scene. Uhl-let's go live!
12;6;Field Reporter;Tom, I'm at the Internet, where government officials are doing their best to get it running again.
12;6;General;[through a megaphone] All right, Internet. What do you want from us? [the collosal router does not reply] If we've angered you somehow, let us know. [lowers the megaphone] Try to communicate with it digitally again. [a scientist plays a few notes on a music keyboard. There's no reply. The scientist is about to play again when the original notes are sent back, with two others. That didn't go anywhere] I've had it with this thing! Fire a warning shot at it! [a sniper fires at it, but the bullet had no effect. It just bounced off the router]
12;6;Kyle;Hey, wait a minute. [gets off the couch and walks away to think alone] Is it possible that...
12;6;Gerald;[stands up] What is it, Kyle?
12;6;Kyle;I think... I know what's wrong.
12;6;;The refugee camp, night. A woman is looking at the Internet now
12;6;Shelly;This is taking too long! When do I get to use the Internet?!
12;6;Stan;It's gotta be our turn soon.
12;6;Volunteer 2;All right, folks, it's bed time. No more Internet for today.
12;6;Refugees;AWWW!!! [various protests are heard after this]
12;6;Woman;A little closer!
12;6;Volunteer 2;No, no, we're locking it away until tomorrow. [the MPs unplug the computer and carry it and the desk away] Everyone get to bed!
12;6;Refugees;Aw man! [everyone walks off mumbling, disappointed]
12;6;Woman;Wha?![puts her left hand on her head and walks off with her head tilted back]
12;6;Shelly;Gggggyyaaah! [punches Stan away, then walks away in the other direction]
12;6;;A storage room at the refugee camp. The volunteers put the computer away and Volunteer 2 locks the room shut. Randy sees an opportunity and mulls it over. Moments later he's at the room's window looking in. He tries sliding the window open and succeeds. He pulls himself into the room through the window, looks around, forgets to close the window, and walks over to the computer. He starts it up.
12;6;Randy;Uhuh... Finally! I'm online again! Yeeheeyes! [softly as he types] Japanese girls puking each other's mouths. [click. He finds a page right away. The girls are only heard, not shown]
12;6;Girl 1;"Haro Kiti kawaii n desho? [""Hello Kitty is cute, isn't it?"" puke]"
12;6;Girl 2;"Un. Choukawaii yo ne! [""Yes. Super cute, right?!""]"
12;6;Randy;Oh niice... Whoa... [begins masturbating]
12;6;Girl 1;"Watashi wa... daisuki! [""I"" puke ""love it!""]"
12;6;Randy;[types away] Now let's see some bestiality. [click. The sound of a woman being rammed by an elephant is heard. Randy is hitting his stride, then heads towards climax] Aahahaha, yes! Ogh! [types away] Let's get some Brazilian fart porn in there! [click. The Brazilian fart porn fetish page loads.] Oh that's good eh! Oh! [a view from outside the shed] Ohhhhhhhhh! Hoh! Hohhh! [other refugees here this and walk out of their tents to see what's going on. Sharon and the kids are out too, but they don't say a thing.]
12;6;Refugee Man 2;What is that?
12;6;Refugee Man 4;Sounds like someone's bein' attacked by a tiger.
12;6;Randy;Ohhhhhhhhhh! Ohhhhhhhhhh!
12;6;Volunteer 4;Get the keys! We gotta get in there. [volunteer 2 runs to the door and whips out his keys. Three other volunteers, one of them a woman, follow him up. They get the door open and enter the shed]
12;6;Randy;[voice descending] Ohhhhhhh! Ohhhhhhh! Ohhhhhhh! [the oldest volunteer turns on the lights and they all gasp in shock. Randy is spent, his semen all over the room, the desk, the computer, and himself.]
12;6;Volunteer 2;What the...? [Sharon and the kids rush in]
12;6;Stan;Dad?
12;6;Sharon;Randy!
12;6;Randy;"[trying to explain it away] Oh. Uhh. There was a, there was a ghost! A-a-and-this, this ectoplasm! [volunteer 4 heads for the computer] Did you see the ghost? [the volunteer begins typing on the keyboard] It ran through here; it sli-it slimed me!"
12;6;Volunteer 2;You son of a bitch!
12;6;Randy;Oh no it wasn't me, it was this spooky ghost! [volunteer 4 looks back at Randy, who looks back at him]
12;6;;The underground cave
12;6;Field Reporter;This is our last chance. With nowhere else to turn, the government is going to allow one brave nine-year-old boy [Kyle is shown standing before the router] to attempt his method to get the Internet running again. [shots of this breaking news airing all over the U.S.] It all comes down to this. Can the little Jewish boy reason with the Internet? Or will it be gone forever?
12;6;Scientist 1;All clear for procedure.
12;6;General;All right! Let's do it! [Kyle walks forward, then up the ramp. His parents fear for him. He walks up and to the right, sees the massive plug and walks to the socket. He just pulls the plug out, waits a few seconds, and plugs it back in. The router responds with a full green signal.]
12;6;Scientist 2;Look! The flashing yellow light is steady green now!
12;6;Scientist 1;He did it!
12;6;Scientist 3;I've got Internet!
12;6;Scientist 4;Me too!
12;6;Scientist 5;Internet activity in all sectors, sir. [everyone cheers. Kyle looks around a little puzzled]
12;6;;The refugee camp, moments later. The men from the camp the Marshes first visited are there
12;6;Transient Man 5;I've got Internet.
12;6;Transient Man 6;Me too!
12;6;Transient Man 3;It's back! [everyone begins to cheer there too]
12;6;;Breaking News. The two anchors are waiting for any news.
12;6;Anchorman;It's back? It's back! [the two anchors dance a jig]
12;6;;The refugee camp, moments later. Shelly hugs her laptop
12;6;Shelly;It's working! I can i-chat with my darling Amir now! [a boy in the background turns around and looks at Shelly]
12;6;Amir;Shelly. Shelly Marsh? [both Shelly and Stan turn around to look at him]
12;6;Shelly;What?
12;6;Amir;It's me. Amir.
12;6;Shelly;O... kay.
12;6;Amir;Your family came here too, huh?
12;6;Shelly;[bashful] Yeah. [the two of them look away from each other]
12;6;Amir;So uhhh, I guess I'll e-mail you as soon as I get back home.
12;6;Shelly;Yeah, okay. Sounds good.
12;6;Amir;Okay, s-see ya. [turns around and walks away]
12;6;Shelly;[turns around and skips away] We're back togehhhther! We're back togehhhther!
12;6;;South Park City Hall, day. Randy is addressing the town. He's dressed in a Native American shirt over his regular clothes
