12;9;Wendy;I don't care! [Cartman looks around. Butters gleefully dances in place waiting for the fight to start]
12;9;Cartman;Um, recess is almost over, I don't I don't know if there's really time.
12;9;A Girl;Shut up and fight! [everyone else joins in the demand. Wendy ties her hair up in a small bun behind her head]
12;9;Cartman;Alright, fine Wendy! I'll fight you, you big bully! [takes off his jacket and tosses it aside]
12;9;;The fighters dance around each other until Wendy lands a right cross. Cartman spins around and falls on his back. Wendy dances around and Cartman stands up, pulling up his pants in the process. Wendy lands two left jabs on Cartman's face, and Cartman finally responds with a right punch. It's strong enough to make Wendy stagger backwards
12;9;Kids;Ohhhhh!
12;9;;Cartman lands another punch on Wendy's face, then continues with a series of alternating punches, forcing Wendy backwards and into the crowd. Cartman lands a punch strong enough to send Wendy into the jungle gym, then continues punching her there. Wendy eventually catches one of his punches and outmuscles him, throwing Cartman into the jungle gym, then driving his face into one of the bars at least twice, and Cartman begins to bleed. The crowd is loving it, cheering her on. Wendy now delivers a long series of alternating punches, forcing Cartman back across the playground and into a hobby elephant. Cartman puts his arms up to deflect the punches, but it's ineffective.
12;9;Butters;Fuck him up, Wendy!
12;9;;Cartman finally tosses Wendy off him and throws a punch at her, but she punches faster, making him miss. She then punches him on the right temple, and Cartman wobbles a bit. As he recovers, Wendy delivers the finishing blow: a fierce right cross that turns Cartman's head around and sends his body flying. The scene is frozen in time and the various reactions are shown: Stan, Kyle, Tweek, and Jimmy are cheering Wendy on. Jimmy has his right crutch up in the air, cheering. Butters is swooning while the boys around him just watch the fight. Time speeds up and Cartman falls to the ground, losing a tooth. Wendy kicks him a few times for good measure. She runs out of strength, staggers backwards, and drops down on her ass, exhausted.
12;9;Mr. Mackey;[just arriving] Wendy?
12;9;Wendy;[pants and looks back at Mr. Mackey] I'm finished! [gets up and walks away. The girls look at her with astonishment]
12;9;Mr. Mackey;Eh, somebod - somebody call the principal! [Cartman gets up, sniffling. Some of the kids begin to leave. Cartman looks around]
12;9;Cartman;[demoralized] You don't have to say anything. I know how it is. I'm no longer the cool kid. Now you all think I'm a fahahahahahag. [begins to wail] My school life is over 'cause now all the guys don't think I'm coooohoohoohoohoohooooool. [wails some more]
12;9;Stan;Dude, we never thought you were cool.
12;9;Cartman;[with his head in his hands] That's not true! You're just saying that! [sobs]
12;9;Kyle;No, really. We've always thought you suck.
12;9;Jimmy;Yeah, nothing's changed. Our opinion of you can't possibly go any lower.
12;9;Cartman;You're all just saying that to make me feel better.
12;9;Craig;No, it's true. We've always hated you.
12;9;Butters;Well, yeah.
12;9;Cartman;Don't try and make me feel better, you guys, it isn't... Wait, wait a minute. Why would you guys be saying stuff to make me feel better? Unless... unless you do think I'm cool. [He begins to smile. The guys look at each other, sure that Cartman misunderstood them]
12;9;Craig;[confused] What?
12;9;Cartman;[seeing a positive side to this somehow] If you're all trying to make me feel better, then you must still like me. Oh, oh phew! Oh, you had me so worried about what you guys were gonna think of me getting beat up by a girl and... it turns out you think I'm cool no matter what. Oh, oh, oh God, what a relief! [jumps up and clicks his feet up in the air] Oh, yay! [jumps up again as the rest of the kids stare at him blankly]
