3;16;Crowd;We want God! We want God! We want God!
3;16;Jesus;"[""We want God""] Please, Father. Do something."
3;16;Crowd;We want God!
3;16;Jesus;[goes onstage again] Uh, folks, I'm afraid God can't make it tonight.
3;16;Randy;We came all the way to Las Vegas for this?!
3;16;Woman;This is the worst New Year's ever! Thanks a lot, Jesus!
3;16;Skeeter;Let's get him! [leads the charge to the stage]
3;16;;Craig Netzel with some breaking news. The crowd has begun to riot.
3;16;Netzel;"Well, Tom, I'm here live in Las Vegas in what is quickly becoming known as ""the gayest party ever."" Everyone is so outraged that they are building a large cross in which to once again crucify our Lord and Savior, Jesus Christ. [behind him, two men pop in and out of view. One holds a bat, the other runs back and forth. The man with the bat beats the other man down, but the other man pops up and continues running]"
3;16;Stan;[goes onstage] Jesus, why does God hate me?
3;16;Jesus;Huh? He doesn't hate you, he hates me. He's gonna let me be crucified again.
3;16;Stan;He hates me more. He doesn't answer my prayers. I prayed to him every day and he never answered me.
3;16;Jesus;Well, yeah, but just because God doesn't answer your prayers doesn't mean he doesn't care about you.
3;16;Stan;Well then, why didn't he give me what I wanted?
3;16;Jesus;Well, God can't just answer every prayer and suddenly give you everything you want. That takes all the living out of life.
3;16;Stan;What do you mean?
3;16;Jesus;If God answered all our prayers, there'd be nothing left for us to do ourselves. Life is about problems, and overcoming those problems. [becomes reflective] A-and growing and learning from obstacles. If God just fixed everything for us, then there'd be no point in our existence. [realizes something] That's why he wouldn't show up to my New Year's party.
3;16;Stan;I just wanted my period.
3;16;Jesus;I get it now, Father. I had to learn all this on my own. [Skeeter and five other men bring a large cross in] I was overcome with my new popularity and, and I let pride get in the way of good judgment. [a bright light appears in the sky and descends towards the stage. The crowd gapes in awe]
3;16;Man;Whoa, what is that??
3;16;Jesus;[the light approaches him] It's Dad.
3;16;Fr. Maxi;God? God is going to show himself??
3;16;Woman;Look, I can see him. [the light begins to bathe the crowd]
3;16;Jesus;Father. You came.
3;16;God;Now look upon Me, My children, and know Me. [now the crowd is shocked] Be ye not afraid. [God is shown as some kind of short-legged squirrel, elephant, cat, hippopotamus hybrid] Blessed art thou, my children. [a man's party blower falls from his lips]
3;16;Randy;That's God?
3;16;Jesus;Yea, 'tis my Father, the Creator. He is the Alpha and the Omega. [a snake's tongue lashes out from God's mouth] The Beginning and the End.
3;16;Mr. Garrison;Well, yeah, but that??
3;16;God;What did you expect me to look like, My son?
3;16;Mr. Garrison;[thinks a moment] ...Well not like that!
3;16;God;Since it is the end of the first 2000 years, I will allow you, My children, to ask me one question.
3;16;Gerald;[next to Mr. Mackey] One question?
3;16;Mr. Mackey;Only one?
3;16;Sharon;What should we ask him?
3;16;Chef;"We have to think carefully. We can ask him anything we want, like, ""What's the meaning of life?"" or ""Why are we here?""."
3;16;Stan;I have it. I have the question. [steps forth] Now you have to answer me once and for all! How come I haven't gotten my period yet?! [the crowd stands aghast]
3;16;God;[after a while] My child, you are a boy. Boys do not get periods. That's only for girls. Your friends were bleeding a little bit out of their asses because of an acute colon infection. And your friend Kyle simply lied about it.
3;16;Kyle;[exposed] How do know that?
3;16;God;You will hit puberty when the time is right. But you will never have a period, because you are a man — with titties. Thus spaketh the Lord. And now I return to heaven. [transforms into the light and returns the way he came]
3;16;Mr. Garrison;Hey, wait! That doesn't count as our question, does it??
3;16;God;I'll answer another on New Year's Eve, in the year 4000. [zips away]
3;16;Stan;"Did you hear that everybody? I'm not even supposed to have my period; that's why God wasn't answering me before! [people look at him, annoyed] Boy, I'm sure everything worked out okay. [looks around] I guess now we can all celebrate the New Year, huh?

Should auld acquaintance be forgot
[end credits roll]
And never brought to mind?
Should auld acquaintance be forgot
And auld lang syne?
For auld lang syne, my dear,
For auld lang syne..."
3;16;Skeeter;Let's get him.
3;16;Stan;"Let's have a cup o

-Aaaa! [mayhem ensues as people riot, breaking wood and glass all around. A gunshot is heard, a couple of women scream, and the rioting goes on]"
