3;2;Townsman 8;Give me that! [rips the Nobel medallion from Randy's neck, leaving the strap] Yeah!
3;2;Townsman 9;Damn you Marsh! Get out of town!
3;2;Townsman 10;You fraud! [two of the townsmen throw the statue onto Randy, who drags it away on his back. The crowd begins to stone him]
3;2;Randy;[struggling] Mr. Garrison, help me!
3;2;Mr. Garrison;[keeping Randy at arm's length] I, I do not know you, sir.
3;2;Townsman 11;Up your-
3;2;Townsman 12;Arrn!
3;2;Kyle;[throws a stone] Yeah, take that!
3;2;Stan;Dude, that's my dad!
3;2;Kyle;...Oh, yeah. Sorry.
3;2;;News 4 Special Report.
3;2;Tom;The spontaneous combustion problem escalates as more and more people go back to holding in all their farts. [a man combusts in front of his wife and child as he deposits a letter in a mailbox. A milk delivery man combusts after setting down a four-pack of milk. A boy combusts as he rides a bicycle] Meanwhile, the ozone layer continues to deplete as others refuse to hold in their farts for fear of combustion. As we all know, the cause for all of this is Randy Marsh, the son of a bitch who calls himself a scientist. We caught up with Mr. Marsh earlier today and he had this to say:
3;2;Randy;I-I don't know what to say.
3;2;Tom;What an asshole! I hate that guy, and so do you. And now, on to the weather. It's fucking hot, thanks to Randy Marsh, son of a bitch!
3;2;;Everyone has gone to the Marsh house. Stan and Kyle look out from the living room window as the crowd clamors outside with torches. A man knocks down the trashcan next to the garage.
3;2;Kyle;Dude, those people are pissed!
3;2;Stan;I know, huh?
3;2;Kyle;Where's your dad?
3;2;Stan;He's hiding down in the basement. I I don't know what to do.
3;2;Kyle;Well, you have to help him, just like I have to help my dad.
3;2;;Cartman is still on the cross.
3;2;;"Gerald's law firm. The sign reads ""Brovlofski & Jackson,"" so he's got a partner.  Gerald sits at his desk looking over papers."
3;2;Radio Talk Show Host;Still more up next from the heat wave caused by Randy Marsh. A giant glacier is melting above South Park and the entire town is doomed. And now, these messages.
3;2;Bob Dole;Having a hard time with male potency? [Gerald sits up and listens] Well, I don't, and I'm Bob Dole. What's wrong with you? Christ, I'm Bob Dole and I can get it up. [upset, he turns off the radio. The door opens and three prostitutes enter]
3;2;Blonde;Are you a lawyer?
3;2;Gerald;Yes.
3;2;Blonde;We want to sue Randy Marsh.
3;2;Gerald;Why?
3;2;Blonde;He gave us skin cancer.
3;2;Brunette;Yeah. He put the hole in the ozone, and now we have skin cancer all over our hot bodies. Look. [she takes off her clothes and stands before Gerald dressed in thong panties. The other does the same, and he is in shock]
3;2;;The Marsh house. Stan and Kyle go to the basement. Randy cowers in a corner wrapped in a blanket.
3;2;Stan;What are you doing, dad?
3;2;Randy;Stanley, I think its best you live with Kyle from now on. His dad is better than me.
3;2;Stan;No, he's not. He can't even get an erection.
3;2;Randy;Hm. Really?
3;2;Stan;Dad, you've got to work! People are dying, dad. You've got to come up with a solution!
3;2;Randy;Not me. I'm not a scientist, I'm a hack. Even if I found a solution, those people would still all hate me.
3;2;Stan;Well, that doesn't matter! I learned something from the Stations of the Cross.
3;2;Randy;What?
3;2;Stan;"See, at first, Jesus was all like, ""Why me?"" And he was all pissed off and stuff. But then he saw that what mattered most was everybody else. So he stopped thinking about his own misery, and did what had to be done. Right as Jesus was dying, [performs a Vulcan greeting] he raised his hand and said, ""The needs of the many outweigh the needs of the few."""
3;2;Randy;You're right, Stanley. You're absolutely right. [gets up and the boys go to the stairs] Hey, that Bible sounds like kind of a good book.
3;2;Stan;It ain't bad. You should try reading it sometime. [Randy returns to his work]
3;2;Kyle;Dude, that was Star Trek again.
3;2;Stan;Huh?
3;2;Kyle;"""The needs of the many outweigh the needs of the few?"" That was Wrath of Khan."
3;2;Stan;Uh, well, Bible, Wrath of Khan, what's the difference?
3;2;Randy;All right. Now, let's get to work.
3;2;You And Me, Girl;"[Intro. Randy mixes some chemicals, then writes some formulas on the chalkboard]
[Randy explains the hold in the ozone layer] I've been telling everybody that you're my girl
[Randy set off a reaction that boils over] Cause I'm not one to be shy
[Randy looks into a microscope] You don't have to go with me if you don't want to, just
[the boys approve] Tell everybody I'm your guy
[Monster chases Randy and the boys all over the house] You and me, girl, it's forever
Sha la la la la laaa
I've been telling everybody that you're my girl,
Cause I'm not one to be shy
[Randy and the boys as a band] I've been telling everybody that you're my girl,
Cause I'm not one to be shy
[Randy and the boys in hearts on moiré] You don't have to go with me if you don't want to, just
Tell everybody I'm your guy
[Randy and the boys floating up through clouds] You and me, girl, it's forever
Sha la la la la laaa
[Randy and the boys play, and a monster appears]
You and me, girl, forever and ever
You and me, girl, forever and ever
You and me, girl, forever and ever... [fade. Randy's humming]"
3;2;Stan;Dad. Dad! [Randy slowly comes out of his daydream]
3;2;Randy;Wow!
3;2;Stan;Dad, what are you doin?! You have to get started!
3;2;Randy;[looks at Stan] ...Right, right right.
3;2;;The Broflovski house. Kyle watches TV and Ike plays on the floor. The front door opens.
3;2;Gerald;Kyle, where's your mother?
3;2;Kyle;She's upstairs.
3;2;Gerald;Well, I have something to give to her! [runs by with a big erection in his pants] Don't worry, Kyle. Everything's gonna be okay between me and your mom.
3;2;Kyle;Really? Great! I don't have to worry about that anymore. [Ike hops onto the armchair next to Kyle]
3;2;;Another night on the cross.
3;2;Cartman;Hello-o.
3;2;;The Marsh house. The crowd is still clamoring outside.
3;2;Townsman 13;Look! There he is!
3;2;Townsman 14;Get him!
3;2;Randy;Uh. Please, everyone- [the crowd closes in and stones him]
3;2;Townsman 15;You're a dead man, Marsh!
3;2;Randy;[shielding himself from the stones] Please, just listen to me. I think I found the answer.
3;2;Townsman 16;[to Townsman 15] Could I borrow one of your rocks?
3;2;Randy;It's all about moderation. If you never fart, you combust, but if you always fart, you deplete the ozone. So we must fart only at appropriate times or when it's really, really funny.
3;2;Townsman 17;Huh? [the people hold their fire]
3;2;Randy;I know you all hate me, but please, for your own sake, fart in moderation. You can keep stoning me now, if you want. [most of the people drop their rocks, and Stan smiles through the window. A man throws one last rock] Ow.
3;2;;City Hall, three weeks later.
3;2;Mayor McDaniels;And so we salute Randy Marsh and his unified theory of moderation that has saved us all. [the Nobel medallion has been repaired and is back around Randy's neck.]
3;2;Stan;[to Kyle] See? My dad is the coolest after all.
3;2;Kyle;Well, my dad is, too.
3;2;Stan;Cartman!
3;2;Kyle;I forgot all about him. [they leave]
3;2;;The boys are not at the foot of the cross.
3;2;Stan;He's been up there for like, three weeks.
3;2;Kyle;Wow!
3;2;Stan;That's amazing!
3;2;Cartman;[in a slight falsetto] Hey you guys, I am really pissed off now.
3;2;Kyle;Dude! You're still alive, Cartman?
3;2;Cartman;Get me down from here!
3;2;Stan;Dude, you survived all this time on the fat stored up in your body?
3;2;Cartman;[who is now incredibly thin] Yes. And when I get down from here, I'm gonna kick you both right in the nuts!
3;2;;"""You and Me, Girl"" plays."
