3;2;;General Store. The boys are shopping…
3;2;Stan;[with an air pump] Is this what you're looking for, Kyle?
3;2;Kyle;No, I don't think so.
3;2;Kenny;[bringing a hair dryer] (How about this?)
3;2;Kyle;No, that's a hair dryer!
3;2;Manager;May I help you find something?
3;2;Kyle;"Yeah. Do you have any ""nurections""?"
3;2;Manager;Any what?
3;2;Kyle;I need to get a nurection for my dad.
3;2;Manager;Very funny, boys. Go on, beat it. [gestures to the exit with his thumb]
3;2;Stan;Why is that funny?
3;2;Kyle;Dude, my mom and dad keep fighting all the time. And both of them say it's because my dad doesn't have a nurection. So I want to get him one. [the boys are suddenly outside, with the door slamming shut behind them] Damn it! What the hell is wrong with everybody? [the boys walk away]
3;2;Stan;That's the fifth store we've been kicked out of. Why is it so hard to get a nurection?
3;2;Kenny;(I know, fucking seriously!)
3;2;Kyle;I just want a nurection so I can give it to my mom.
3;2;Man;[walks by with his lady] What?
3;2;Kenny;(Well, see you guys. I gotta go take the bus out of town.)
3;2;Cartman;Oh, where are you gonna go, Kenny? You gonna see your little girlfriend again?
3;2;Kenny;(Yeah, dude. She saved me.)
3;2;Cartman;Dude, you spend way too much time with that girl. If you don't-
3;2;Kenny;(Ach.) [Poof. Stan and Kyle turn. All three are left looking at a charred body]
3;2;Stan;Oh my God, they killed Kenny!
3;2;Kyle;You bastards!
3;2;Cartman;What the hell happened to him?
3;2;Stan;He just... ignited.
3;2;Man;[rushing up] What happened?
3;2;Woman;[rushing up] I saw it from across the street. He just caught on fire. [Barbrady drives up and screeches to a halt]
3;2;Officer Barbrady;[rushes up to the boys] Okay people, stand back. Give the little burnt boy some breathing room.
3;2;Blond man;I've heard about this. This is... spontaneous combustion. But it usually only happens to fat people near open flames.
3;2;Man 2;Is it contagious?
3;2;Woman;Am I going to spontaneously combust?
3;2;Man 3;I hope it doesn't happen to me.
3;2;Woman;This is very scary.
3;2;;City Hall,the Mayor's office. The Mayor is talking with someone.
3;2;Mayor McDaniels;The people are panicking about spontaneous combustion. That's why I've assembled this crack team of scientists to find out the cause of the phenomenon. You are the best scientific mind South Park has to offer.
3;2;Randy;...Uuuh. Mayor, I'm a geologist.
3;2;Mayor McDaniels;Right.
3;2;Randy;Well, uh I don't study human biology, I study the earth.
3;2;Mayor McDaniels;Look, you're the only scientist that lives in this town. You have to find an answer before more people combust. You do that, and you'll be the most beloved man in South Park. [Randy begins to daydream]
3;2;;The Most Beloved Man In South Park. Hands move him over the crowd.
3;2;Crowd;Randy! Randy! Randy! Randy!
3;2;Man;We love you, Randy.
3;2;Woman;[rushing up] Make love to me, Randy. Please!
3;2;;Returns.
3;2;Randy;Wow.
3;2;Mayor McDaniels;Marsh, I'm not asking you, I'm telling you! Find the cause of spontaneous combustion, or else!
3;2;Randy;Or else what?
3;2;Mayor McDaniels;[pounds on her desk] Exactly!
3;2;;First Church of South Park. The organ is heard as people gather for Kenny's funeral. Inside, Stan and Kyle hop up to the bier the coffin is on. Cartman tries a couple of times and finally makes it.
3;2;Stan;Dude, he looks so peaceful without his little orange coat on.
3;2;Kyle;Yeah. [The boys hop off the bier and move to the front row for the service as Priest Maxi approaches the coffin. He opens the Bible and reads]
3;2;Priest Maxi;The Lord giveth and the Lord taketh away. Sometimes the giveth seems a little disproportionate to the taketh. There seems to be a lot more takething going on, but there it is. Perhaps if more of you attended church on Sundays [Kevin falls asleep, Stuart reads Gazongas magazine and checks out its centerfold while his wife sniffs], the Lord would not have felt it necessary to punish us by takething this little boy…
3;2;Mr. Garrison;[to man to his left] Oh, here comes the guilt trip again.
3;2;Priest Maxi;Now, let us pray. [all close their eyes and bow their heads] Lord, though we have lost Neil Smith to free agency and Steve Atwater to the Jets, still, we hope our beloved Broncos can bring home another Super Bowl championship, and once again bathe in the glory of your light. Amen.
3;2;All;Amen.
3;2;Priest Maxi;[raises left arm and fist] Let's go-
3;2;All;Let’s go
3;2;Priest Maxi;Broncos
3;2;All;Broncos
3;2;Priest Maxi;Let’s go Broncos
3;2;All;Broncos, let's go! [The priest extends the fist and all rise and exit. Three men carry the coffin out]
3;2;Stan;Wow, that was short. [Priest Maxi stops them as they leave the pew]
3;2;Priest Maxi;Boys, I haven't seen you in church lately.
3;2;Kyle;Well, I'm Jewish.
3;2;Priest Maxi;You're not too Jewish to worship Jesus, are you?
3;2;Kyle;I guess not.
3;2;Priest Maxi;Good. Boys, how would you like to perform the Stations of the Cross this Friday night?
3;2;Stan;The what?
3;2;Priest Maxi;It's like a skit, where you reenact the death and glorious resurrection of Jesus Christ.
3;2;Kyle;Hey, resurrection! That's what my dad needs!
3;2;Priest Maxi;Huh?
3;2;Kyle;We'll do it! We'll do it!
3;2;Priest Maxi;Wonderful. Here's a book on how to perform it. Don't let me down, boys. [hands it to Kyle and walks away. The cover shows two excited kids under a radiant cross]
3;2;Kyle;Dude, this is great! You know all the Stations of the Cross, right, Stan?
3;2;Stan;I don't know, dude. I'm gonna have to go look in the Bible.
3;2;;Outside, some of the churchgoers are still around.
3;2;Tom;Good night, Jerry.
3;2;Jerry;See ya, Tom. Bye, Helen.
3;2;Helen;Bye, Jer- aaa! [poof. Now she combusted]
3;2;Jerry;Oh my God, another one.
3;2;Tom;Helen, no!
3;2;Jerry;What happened?
3;2;Man 5;[consoling Tom] God must be very angry with us. But why? [looks to the heavens] How have we angered you, Lord?
3;2;;Stan's house. Randy's in the basement doing preliminary work. He's working on some chemical reactions when the boys come down.
3;2;Randy;[to himself] Well, let's see. If they combust... no. Could be from the... no.
3;2;Stan;Dad, where's our Bible?
3;2;Randy;Not now, Stan. I have to find out what causes spontaneous combustion. Or else.
3;2;Stan;Or else what?
3;2;Randy;Exactly.
3;2;Stan;...What?
3;2;Randy;Right.
3;2;Stan;[after a long pause] Where's our Bible?
3;2;Randy;It's in the attic with the old LP's. [the boys start up the stairs...] Boys, did you notice anything uuuh strange about Kenny in the weeks leading up to his combustion? Ooh, what did he spend his time doing?
3;2;Kyle;He didn't do anything. He was always with his new girlfriend.
3;2;Randy;New girlfriend?
3;2;Stan;Yeah, he started seeing this girl and he spent a lot of time taking the bus to go visit her. What does that have to do with his death?
3;2;Randy;Maybe nothing... [close up] maybe everything.
3;2;Stan;...Well, we're gonna go work on getting Kyle's dad a nurection. [the boys go up the stairs and exit]
3;2;Randy;[resumes the reactions] Yes, yes, of course. I've got work to do. [the door closes] What?!
3;2;;Stan's room. Stan reads from the Stations of the Cross booklet while Kyle reads from the Bible.
3;2;Stan;Let's see: Jesus got crucified, then he died, then three days later he had his urection. Let's see, there's fourteen Stations of the Cross. Now, it says we can makes costumes out of sheets.
3;2;Kyle;This is gonna be fun.
3;2;Cartman;I'm gonna be Jesus!
3;2;Kyle;You're too fat to be Jesus!
3;2;Cartman;Oh, and like you're gonna do it, Jew?!
3;2;Kyle;Stan should be Jesus.
3;2;Cartman;Either I'm Jesus, or else, screw you guys, I'm going home! [gestures his intent.]
3;2;Kyle;You're such a fat baby!
3;2;Cartman;Well, I guess you guys can do the Stations of the Cross by yourselves. [gestures again, and again]
3;2;Kyle;All right, all right, you could be Jesus, you tubby cry-baby!
3;2;Cartman;[retorts] Stick and stones may break my bones, but I'm Jesus and you aren't.
3;2;;Back in the basement…
3;2;Randy;All right, all right, let's try it again. Kenny was standing here. Stan, Kyle and Cartman were walking around him. [four men dressed as the boys stand before him] Now, walk. [the men move around] Do you feel hot?
3;2;Kenny;Uh, no.
3;2;Randy;Damn it! How come you're not combusting? [throws down his clipboard]
3;2;Stan;Come on, Randy. You said we were gonna drink beer and watch the fight.
3;2;Townsman;[rushing in with several other people] Another one! Another one combusted! [pours out the ashes for Randy to see]
3;2;Randy;No! Has she been doing anything odd?
3;2;Townsman;No, she was just on her way to her new boyfriend's house.
3;2;Randy;Boyfriend. And they said Kenny had a new girlfriend.
3;2;Cartman;This is stupid. Screw you guys, I'm going home. [walks off]
3;2;Randy;No! I think I might have it.
3;2;;The First Church of South Park, night of Good Friday.
3;2;Priest Maxi;"Well, well, well. A lot of you came to church. Looks like we're a little ""nervous"" about this spontaneous combustion thing, huh?"
3;2;A few people;Yeah.
3;2;Priest Maxi;Well, on this blessed Friday let us give thanks for stuff, and things. [all bow their heads] Lord, is it so much to ask that you not let us suddenly burst into flame for no apparent reason? I mean, come on! Amen. [Stan and Kyle approach the pulpit, followed by Cartman] And now, some of our darling local children are going to perform the Stations of the Cross. [leaves, and Stan takes over]
3;2;Crowd;Awww.
3;2;Stan;Station One: Jesus is condemned to death by Pilate.
3;2;Kyle;Die! [hits Cartman, dressed as Jesus, with a stick]
3;2;Cartman;Ow! You can do what you will, but I am the Lamb of God.
3;2;Crowd;Awww.
3;2;Someone;Phew.
3;2;Stan;Station Two: Jesus takes his cross.
3;2;Cartman;[now carrying the cross] This cross is seriously heavy. Oh man, this is totally weak.
3;2;Stan;And then Jesus' disciple, Peter, denies he knows him. [this is not part of the Stations]
3;2;Cartman;Peter!
3;2;Kyle;I don't know you, dude.
3;2;Cartman;Oh, Peter. Weak, Peter. Lame. But I'm Jesus, so I'll forgive you, I guess.
3;2;;Night, the Mayor's office. She's wearing a mud mask in bed and reading Gazongas. The phone rings.
3;2;Mayor McDaniels;Mayor.
3;2;Randy;[calling from his lab] Mayor, I have it. I found out why people spontaneously combust.
3;2;Mayor McDaniels;Why?
3;2;Randy;"Uh, it's too complicated to explain over the phone. [his clipboard indicates].
Girlfriend --> DEAD
Boyfriend --> DEAD
Call a town meeting tomorrow"
3;2;Mayor McDaniels;Okay. If you're right about this, Marsh, you're going to be the most popular man in South Park.
3;2;;The Most Popular Man In South Park. Hands move him over the crowd.
3;2;Crowd;Randy! Randy! Randy! Randy!
3;2;Man;We love you, Randy.
3;2;Woman;[rushing up] Make love to me, Randy. Please!
3;2;;Returns.
3;2;Randy;Wow. [hangs up the phone]
3;2;Mayor McDaniels;[hangs up the phone] Shmuck!
3;2;;At the church, Stan continues the Stations. Cartman is stripped to his underwear.
3;2;Stan;Station Eleven: Jesus is nailed to the cross. [Kyle has tied Cartman to it]
3;2;Cartman;Oh! This has gone from weak to superweak! Things cannot get any more weak for me.
3;2;Stan;"[produces a crown of thorns] Then a crown of thorns was placed on Jesus's head, and Jesus was all like, ""Thanks."""
3;2;Cartman;Well, this sucks that I have to die, but if I die, everyone's sins will be forgiven. [Stan replaces Cartman's cap with the crown] So I guess it's cool. [Stan returns to the pulpit]
3;2;Stan;And then Jesus was lead away [Kyle leads Cartman out] to Mount Sinai, where he dies, and has a resurrection three days later.
3;2;Cartman;[on his way out the door] Hi, mom. [Stan leaves the pulpit and the priest returns]
3;2;Priest Maxi;Thank you, boys. Blessed be the name of Jesus!
3;2;Crowd;It's a great name, isn't it? [Stan exits]
3;2;;Stan and Kyle now carry Cartman on the cross and are headed towards a hill. Kyle has the heavier end.
3;2;Kyle;Hey, that went really well. They really liked it.
3;2;Cartman;Yeah. I told you I'd be a sweet Jesus, you guys.
3;2;Kyle;Aw man, at least the real Jesus didn't weigh 400 pounds!
3;2;Cartman;Up your ass with broken glass!
3;2;Stan;This spot looks good. [they drop the foot of the cross into the spot and lift the rest of the cross upright, then leave]
3;2;Kyle;Yeah. That looks pretty good.
3;2;Stan;Okay, cool. See you, Cartman.
3;2;Cartman;Hey, wait! Where the hell are you going?! [they stop and turn]
3;2;Stan;Huh I don't know. I'm going home, I guess.
3;2;Kyle;Yeah, me too.
3;2;Cartman;Well, get me down from here!
3;2;Kyle;Cartman, how stupid are you?! Didn't you read the Bible? We have to leave you up there until you die, and then you come back to life in three days.
3;2;Cartman;What?!
3;2;Stan;Yeah, dummy, you have to get a nurection.
3;2;Kyle;Then I can give it to my dad. [both turn and leave]
3;2;Cartman;Hey, uh I don't wanna be Jesus anymore! Don't leave me here, you guys! ...All right, that does it! Screw you guys, I'm going home! [looks around] Okay, I'm getting pissed now! [struggles to get loose, but doesn't get anywhere] God!
3;2;;City Hall, the next day. Stan and Kyle are present for the Mayor's announcement, along with much of the town.
3;2;Mayor McDaniels;All right, people. Scientist Marsh and I have been working very hard on the problem of spontaneous combustion, and we have finally come up with a solution. Mr. Marsh?
3;2;Randy;[approaches with a large book] The little boy combusted because he had a new girlfriend. It wasn't the girl that caused him to combust, it was the fact that Kenny did not want to pass gas in front of her. [displays a diagram of the digestive system] You see, as food is digested the natural processes give off a byproduct known as methane gas. [the next page is a diagram of the stomach, showing how food produces methane]
3;2;Randy;The methane gathers here in the bowel area [shows the intestines, or the bowels], where it causes pressure. Normally a person would expel this byproduct in the form of a pleasant fart. [shows the colon, where the gas collects and moves out] Should the gas not be expelled, [shows the gas trapped in the bowels] the methane can build up and then ignite, [shows the bowels exploding] leading to... disaster. [shows picture of Jocelyn Wildenstein, then closes the book] Kenny combusted because he held his farts in for too long.
3;2;Townsman;You mean, all we have to do is fart and we won't explode?
3;2;Randy;Exactly. [after a while, a fart is heard, then more farts follow as the townsfolk release their gases]
3;2;Mayor McDaniels;So, from this day forward, everyone in South Park will be required to fart on a regular basis to insure that nobody else spontaneously explodes.
3;2;Crowd;Randy! Randy! Randy! Randy! [Randy waves back gratefully]
3;2;Man;We love you, Randy.
3;2;Old Woman;[in a wheelchair] Make love to me, Randy. Please!
3;2;Stan;Whoa, dude, my dad's famous.
3;2;Kyle;Come on. Let's go see how Cartman is doing with his uh, urection.
3;2;;The boys go to the hill on which they left Cartman on the cross.
3;2;Stan;Wow, he died.
3;2;Kyle;Now we just gotta wait for his urection, and I can give it to my dad.
3;2;Cartman;[wakes up] Hey, there you guys are!
3;2;Stan;Cartman??
3;2;Cartman;You guys are in big trouble! Now get me down from here!
3;2;Kyle;How come you're not dead yet, Cartman?!
3;2;Cartman;You guys, I mean, seriously! Get me down!
3;2;Stan;Look, fatass: after you die and get resurrurected, you'll have all kinds of superpowers, just like Jesus.
3;2;Cartman;...Really?
3;2;Kyle;Yeah. So hurry up and die, you piece of crap! [he and Stan leave]
3;2;Cartman;[watches them leave] ...When I get all my superpowers, I'm gonna use them to smote you two assholes right off the planet! [to himself] Dude, superpowers are sweet.
3;2;;The boys are back in town, and they run across Mr. Mackey.
3;2;Mr. Mackey;Hi, boys.
3;2;Stan, Kyle;[imitating him] Hi, Mr. Mackey.
3;2;Mr. Mackey;Have you guys been sure to pass gas regularly so you don't spontaneously combust?
3;2;Kyle;We know how to fart, Mr. Mackey!
3;2;Mr. Mackey;Well, let me show you, just to be sure, m'kay? [moves his bowels as he hums,] Hmm, come on. Be good, now. [slaps his butt and lets loose]
3;2;Kyle;Jesus Christ! [the boys cover their noses with their jackets]
3;2;Stan;Sick, dude!
3;2;Mr. Mackey;I had a steak wrapped with bacon last night. [laughs]
3;2;Kyle;Dude, I think you pooed a lot.
3;2;Mr. Mackey;So, you boys understand you have to do that regularly, oh-mkay? [laughs]
3;2;Stan;Okay, okay, just go away! [Mr. Mackey leaves laughing, and the boys walk on]
3;2;Kyle;God, that was not cool at all, dude!
3;2;Liane;Oh, hello boys. Have you seen Eric around anywhere?
3;2;Stan;Uh. We've been taking care of him.
3;2;Kyle;Yeah. We're having him resurrurected.
3;2;Liane;Oh, all right. I was just at the store buying some apples.
3;2;Stan;Apples?
3;2;Liane;Yes. Apples. [farts] Ahapples, get it? [the boys cover their noses again]
3;2;Stan;Dude!
3;2;Kyle;Sick!
3;2;Liane;Stinky apples. See you, boys. [leaves]
3;2;Stan;I don't think I like this new law.
3;2;Liane;[returns] Squeaker! [farts, then leaves]
3;2;;The boys return to City Hall to see the rest of the ceremony. The people in the crowd all have their noses covered. A covered statue stands next to Randy.
3;2;Mayor McDaniels;And so I declare today Randy Marsh Day, where we shall remember forever how he freed us all from the threat of spontaneous combustion. Gentlemen? [her aides unveil a nicely muscled concrete statue of Randy]
3;2;Bearded Man;You're the best, Randy!
3;2;Randy;I am? I am, huh? I never knew the depth of my scientific genius until now.
3;2;Kyle;It's too bad Cartman can't be here to enjoy this.
3;2;Stan;Yeah.
3;2;;Back on the cross...
3;2;Cartman;[vultures hover above him] You guys, seriously! somebody get me down from here!
3;2;Officer Barbrady;[strolling] Nur nunur nunur nunur nunur nunur-
3;2;Cartman;Officer Barbrady! [Barbrady looks up to see Cartman on the cross and says nothing for a while]
3;2;Officer Barbrady;[taps his chin] T. T is for turtle. [turns and walks away] Nur nunur nunur nunur nunur nunur…
3;2;Cartman;Ey! Help me, you son of a bitch! [to himself] Huh, I'm gonna die up here.
3;2;;The Nobel Prize Awards. Looks like the Oscars...
3;2;Announcer;We now return to the 42nd Annual Nobel Prize Awards. Here again your host, Whoopi Goldberg. [the audience applauds]
3;2;Whoopi;[In elaborate dress and geisha hairdo] Republicans are so stupid. [the crowd laughs] I hate Republicans. [the audience laughs] Republicans are so stupid. [the audience laughs] And now, here to present the Nobel Prize for Science is Nick Nolte [fanfare. The audience applauds and Nick steps up]
3;2;Nick Nolte;"Science is good. Science is very important. This year's nominees are: [the candidates are shown as their names are mentioned]
Herald R. Pinkerton, for his further development of the grand unified theory of physics.
Randy Marsh, for his formulated break-wind theory of spontaneous combustion.
And Alphonse Mephesto for his seven-assed Galapagos turtle.
And the Nobel Prize goes to: [opens the envelope] Randy Marsh, for the theory of spontaneous fart things. [the audience applauds wildly]"
3;2;Mephesto;[in the audience] No! No, this can't be!
3;2;Randy;[at the podium, very excited] Whoa hoho, whoa! [grabs his head] Oh wow, oh, ah, I'm the best! Yeah! Yeah! Ah, it's just so amazing to be told that you're the best. I, I thought I was just a normal person like all of you, but... Yeah! Well, thank you for showing me otherwise! Yeah! I kick ass, yeah!
3;2;Mephesto;Fixed! Fixed! That was supposed to be my award, Kevin. I'll get him for this. Mark my words.
3;2;;Back in South Park, Stan and Kyle are on Kyle's couch watching the show.
3;2;Stan;Wow, my dad's the best! All other dads suck compared to my dad!
3;2;Kyle;Hey! My dad's pretty cool, too.
3;2;;In the master bedroom Gerald and Sheila look at Gerald's penis, to see if it'll rise.
3;2;Gerald;I'm sorry, honey.
3;2;Sheila;It's okay, [picks up the phone] I'll just call some 20-year old and have him come over.
3;2;Gerald;What?!
3;2;Sheila;[hands up] I'm just kidding.
3;2;Gerald;Kidding? Well, that's not funny! That hurt my feelings!
3;2;Sheila;Why?
3;2;Gerald;Why?! [the door opens]
3;2;Sheila;Kyle. [Gerald see him, too]
3;2;Kyle;Don't worry, guys. I'm getting a nurection as we speak.
3;2;Gerald;Huh?
3;2;Kyle;Well, actually, Cartman's getting a nurection. But then, we're gonna give it you. Sooo, buck up! [his parents just look at him. He grins and walks away]
3;2;Sheila;We have a very strange little boy, Gerald.
3;2;;Next day, Cartman on the cross. Stan and Kyle arrive to check up on Cartman.
3;2;Stan;Dude, he's still not dead.
3;2;Cartman;You guys, my mom is totally worried about me. You'd better let me down.
3;2;Kyle;She's not worried about you.
3;2;Cartman;Yes she is! I've been hearing her all day! Listen! Listen. [prepares for a bit of ventriloquism] Eric? Eric, where are you? I miss you very much.
3;2;Stan;That's not your mom calling!
3;2;Cartman;[still in falsetto] Yes it is, you guys. I'm serious now. This is Eric's mom and I want him home right now.
3;2;Kyle;How stupid do you think we are?! Now you die on that cross and get resurrurected before I kick your ass!
3;2;Cartman;You guys, it's too hot out here! I can't do this!
3;2;Stan;He is right. It has been getting really hot lately.
3;2;Kyle;Yeah, I noticed that too. Let's go get some ice-cold lemonade.
3;2;Stan;Hey, yeah! [they turn and walk away]
3;2;Cartman;"Oh! God-damnit! Urh! You guys! You guys wanna hear my ""I hate Stan and Kyle"" song?! Ahem."
3;2;Cartman;"I hate Stan and Kyle
I seriously hate Stan and Kyle..."
3;2;;City Hall. The Mayor and her aides are in shorts and T's.
3;2;Mayor McDaniels;My God, it's burning up in here! Can't we crank the AC up some more?
3;2;Aide 2;It's already on full.
3;2;Randy;[entering, wearing his Nobel medal] You wanted to see me, Mayor?
3;2;Mayor McDaniels;Yes, Marsh. We have a new problem, and I think only you can solve it.
3;2;Randy;I suspect you're talking about the dramatic heat wave.
3;2;Mayor McDaniels;Yes. The temperature is steadily rising every day. I want you to find out why.
3;2;Randy;Mayor, I think I'm a little overqualified for this. My scientific mind is best used on global problems.
3;2;Mayor McDaniels;All right, all right. Name your price.
3;2;Randy;Ten thousand. I have to protect my talent.
3;2;Mayor McDaniels;Done. Just find out what's happening.
3;2;Randy;Don't worry, Mayor. I'll find the cause. Or else. Or else what? Exactly. [they just look at him]
3;2;;Another night on the cross. The Last Temptation of Cartman.
3;2;Cartman;[whispering, hoping...] Hey you guys. Seriously. [Chef walks into view]
3;2;Chef;[startled] What the-? [sees Cartman on the cross with his head down] Oh, what now?!
3;2;Cartman;Chef! Chef!
3;2;Chef;[rushes up to him] Children, what the hell are you doin'?
3;2;Cartman;Just get me down from here! [Chef does] Oh, finally! My arms are killing me!
3;2;Chef;You children shouldn't be crucifying yourselves in this heat.
3;2;;Chef drives him into town.
3;2;Cartman;Sweet. Now, I'm gonna go kill those guys!
3;2;Chef;Eric, I have to tell you something, and it's really gonna bum you out.
3;2;Cartman;What?
3;2;Chef;It's really gonna piss you off.
3;2;Cartman;What?!
3;2;Chef;This is just a dream. You're still up on that cross.
3;2;Cartman;[waking up] Oh, damnit!
3;2;;Stan's house, basement. A Cheesy Poofs commercial ends as Stan comes down the steps.
3;2;Stan;Dad, where's the phone book?
3;2;Randy;Not now, Stanley. Without my scientific genius, the town is doomed. [Stan goes back up the stairs and exits. Randy mumbles] Let's see now, when exactly did the temperature start to go up?
3;2;;Jesus and Pals comes on.
3;2;Jesus;Our topic tonight is the rising temperatures in South Park. Let's go to the phones. [beep] Caller, you're on the air.
3;2;Stan;Yeah, um, Jesus, after you got crucified, how long did it take you to die and resurrect?
3;2;Randy;Stan?
3;2;Jesus;That's not the topic tonight. The topic is global warming.
3;2;Stan;Oh.
3;2;Jesus;Do you have an opinion on global warming?
3;2;Stan;Uh, it... sucks ass.
3;2;Jesus;Okay! Thank you caller. Well, let's go to our first guest, Dr. Alphonse Mephesto. [Mephesto appears and sits] Thank you for coming. You claim to know the cause of global warming in South Park.
3;2;Mephesto;I most certainly do! The cause of global warming is [brings out a picture of a man, with horns, mustache, and angry eyebrows drawn on] Randy Marsh! [Randy is stunned] It was Marsh's theory on spontaneous combustion that told everyone to fart all they want. Now all the methane from all those farts has ripped a hole in our ozone layer. We are all doomed to die!
3;2;Randy;Awww crap.
3;2;;City Hall, the next day. The town is gathered clamoring for Randy to come out.
3;2;Townsman;Go get him!
3;2;Townsman 1;We want answers!
3;2;Townsman 2;You've killed us all!
3;2;Townsman 3;Someone's got to pay!
3;2;Woman;It's out of control.
3;2;;inside the Mayor's office.
3;2;Mayor McDaniels;Boy, they're really pissed.
3;2;Randy;Well, they're right. We should have known that all that methane could adversely affect the atmosphere.
3;2;Mayor McDaniels;Well, let's go talk to them. Stick by me. [turns and walks to the door. Randy follows. She shows him out and quickly closes the door]
3;2;Randy;[turns to the door] Hey!
3;2;Townsman 4;You killed us all!
3;2;Townsman 5;Shove that Nobel prize up your ass! [Stan and Kyle approach]
3;2;Stan;Oh my God, what's going on?
3;2;Townsman 6;Now we either hold in our farts and spontaneously combust, o-o-or we let our farts out and kill our entire planet. Well I, for one, am not farting anymore! [he combusts and others gasp]
3;2;Randy;Uuuh, I- I'll try to find a solution.
3;2;Townsman 7;We don't want your solutions, phony!
