21;8;Cartman;No. I was just... trying to... figure out why you decided to drink 20,000 microanimals that were showing signs of intelligence.
21;8;Heidi;Whatever. It's Saturday, and I'm not in skewl.
21;8;Cartman;Yeah, you're, you're not in skewl.
21;8;Heidi;[goes back to eating chips] How come we never snuggle anymore?!
21;8;Cartman;[alarmed] Wha, what?
21;8;Heidi;We used to snuggle all the time and it's totally gone away! What happened?!
21;8;Cartman;Well, but honey, we still-
21;8;Heidi;SNUGGLE!
21;8;Cartman;[gets closer to her] Yes yes, let's, let's snuggle, yes. [she shares her blanket and snuggles]
21;8;Heidi;Goddammit, how come there's nothin' to watch on Saturday but kids cartoons?!
21;8;Blue Horse on TV;Hohall right, kids. Now let's do the hokey pokey. [begins to sing the song]
21;8;Heidi;Oooo. [her belly begins to move to the music] What's goin' on in here?
21;8;Cartman;Oh, what is goin' on in here?
21;8;Heidi;I feel somethin' moving around. I-it- [farts]
21;8;Cartman;Yeesh. [backs away]
21;8;Heidi;[farts again] SNUGGLE!
21;8;Cartman;Okay, okay, honey. [gets close to her again, but she farts again] Eughah, ah.
21;8;;NFL Headquarters, New York City, day. Roger Goodell sits in his office flanked by two other officials.
21;8;Roger Goodell;Well, did you have any luck, Mr. Jones?
21;8;Jerry Jones;I'm afraid, Commissioner, that the Special Ed Science Fair failed to produce more viable water bears.
21;8;Officlal 1;Then the NFL truly has no hope.
21;8;Officlal 2;We're done for.
21;8;Jerry Jones;Not quite. [a lab worker wheels something in and leaves] We were able to obtain somethin' else [picks up a beaker] that just might be our future. [pours the beaker into the volcano Nathan offered to him earlier]
21;8;Goodell and the officials;Ooohhhh!
