14;5;Tom Cruise;We figured you're pissed at South Park too, right Mrs. Streisand? [Barbra roars, turns around, and slashes the holding tower with her arm saw]
14;5;Tom Cruise;Oh, she's pissed all right.
14;5;;Someone's house, there is a knock at the door. The door opens, and Eric is standing outside.
14;5;Mr. Garrison;Eric, what are you doing here?
14;5;Cartman;Did you all lie to me? All of you, in that room, when you told me my mother was my father?
14;5;Mr. Garrison;What? N-No Eric, are you still worried about that old issue, I mean-
14;5;Cartman;I don't trust you. I want to talk to Mr. Hat.
14;5;Mr. Garrison;Eric, I haven't used Mr. Hat in a long time, and-
14;5;Cartman;I said GET. Mr. Hat!
14;5;;Garrison's bedroom. He reaches into a drawer and pulls out Mr. Hat.
14;5;Cartman;Put it on! [he puts it on] Do the voice.
14;5;Mr. Hat;Hello kids, it's me, Mr. Hat. [Cartman pulls his hand from behind his back, revealing Mitch.]
14;5;Mitch Conner;Good to see you Hat. Helluva night, isn't it?
14;5;Mr. Hat;I... I don't believe I know you.
14;5;Mitch Conner;The name's Mitch Conner, flew the same division as you back in Saigon. [Mr. Garrison lowers Mr. Hat]
14;5;Mr. Garrison;Eric, this is silly, why don't we just stop-
14;5;Cartman;Keep... your hand... UP!
14;5;;A street filled with lots of townspeople, Muhammad, and Stan
14;5;Randy;[shouting to the other side of the street] Alright gingers, we have Muhammad for you, now hand over the detonators. [huge group of gingers, all holding detonators]
14;5;Lead Ginger;Nuh uh, first you gotta prove that's still Muhammad in there! Have him step out of the bear costume...
14;5;Townspeople;Ohhhhhhh...
14;5;Stan;Dude, we can't do that
14;5;Lead Ginger;Show us it's Muhammad or South Park is finished!
14;5;;Back to Mr. Garrison's bedroom
14;5;Mr. Hat;Dammit, Mitch, you're asking questions that shouldn't be answered!
14;5;Mitch Conner;So you admit it. There was a cover up. [Mr. Garrison turns away]
14;5;Mr. Garrison;No, Mr. Hat, don't say anymore!
14;5;Mitch;Yeah, tell 'im whatcha know!
14;5;Garrison;Alright, Eric, your father was in the room the day of your DNA test, but the results were... tampered with.
14;5;Cartman;By who? Goddammit, Garrison, who is my father?
14;5;;Flash to townspeople on the street, then flash to gingers on the street then flash to Mecha-Streisand roaring
