18;4;Announcer;Oh my, it appears that an explosion has opend up a wormhole with Matthew McConaughey inside.
18;4;Matthew McConaughey;Mimsy! [the car levitates a bit, but as soon as the wormhole is gone, it falls back on the road]
18;4;Announcer;And there's the finish. It looks like Handicar has done it!
18;4;Timmy;Timmih! [the handicapped kids all cheer]
18;4;;The meeting room, day. Steve gives Timmy a ribbon
18;4;Steve;A big congratulations to our fundraising champion! After selling the Handicar rights to Elon Musk, Timmy has raised 2.3 billion dollars for summer camp. [the kids cheer] Great job to all of you. This is sure to be the best summer camp ever! [more cheering]
18;4;;Nathan's house, night.
18;4;Nathan's mom;All set for bed, honey?
18;4;Nathan;Yeah I like to sleep at nighttime.
18;4;Nathan's mom;All right, goodnight. [kisses him on the temple and heads for the door]
18;4;Nathan;Wait! [she stops] Wait, Mom? Can we talk?
18;4;Nathan's mom;Um... yes, o-of course. [sits down on his bed]
18;4;Nathan;This is very difficult, Mom. But um... You know how every year I go to summer camp? Well, I hate it. I hate it and I don't want to go anymore.
18;4;Nathan's mom;I'm sorry, I can't understand you honey. You're handicapped.
18;4;Nathan;What's to understand? I'm telling you I don't want to that stupid camp anymore!
18;4;Nathan's mom;You want water? Is that what you want?
18;4;Nathan;No! I don't wanna go to camp!
18;4;Nathan's mom;Ohhh yes, okay honey, I'll turn off the lamp. [gets up, turns it off, and walks out, closing the door behind her]
18;4;Nathan;No! That's not what I fucking said! [stumbles around in his room] Goddamnit, now I can't even see! Ow!
18;4;;Outside Nathan's room
18;4;Nathan's dad;What's he saying?
18;4;Nathan's mom;That he doesn't wanna go to summer camp this year, but I'll be damned if he's gonna ruin our Italy trip.
18;4;Nathan's dad;Right.
18;4;Nathan;[still stumbling in his room] Oh! Aah! Mimsy!
