18;9;;Kyle's house, day. Kyle runs home excitedly with something in his hand. He opens the front door and goes in. Gerald spots him
18;9;Gerald;There you are, Kyle. I was gonna see if you and your brother wanted to go down to the bowling alley.
18;9;Kyle;Nono Dad, please. I just got Call Of Duty: Advanced Warfare. Me and Ike are going to play it together.
18;9;Gerald;It's your day off. You boys really wanna spend it inside in front of the TV?
18;9;Kyle;Please Dad, I've been looking forward to this all week. Aaand it's me and Ike's bonding time. Really. This is good for our relationship.
18;9;Gerald;All right. [Kyle smiles, Gerald heads back to the kitchen] I swear I'll never understand you kids these days.
18;9;Kyle;Yes! [runs upstairs smiling.]
18;9;;Ike's room. Ike is at his computer eating Cheetos. Kyle knocks, then goes into the room
18;9;Kyle;Heeey Ike! Look what I got. [Ike looks over his shoulder] The new Call Of Duty! Do you wanna go downstairs and play?
18;9;PewDiePie;[on the monitor] Aww, look at all the bright colors.
18;9;Ike;...Meh. [goes back to watching the monitor and eating his Cheetos]
18;9;Kyle;Meh? Ike, we have a whole day to play XBox! Mom and Dad are leaving!
18;9;Ike;Maybe later, 'kay?
18;9;Kyle;[walks up to Ike] Well what are you watching?
18;9;PewDiePie;How's it goin' bros? My name's PewDiePie. I'm playing Call Of Duty: Advanced Warfare. Here we go. [breaks through a door and is met with gunfire] Agh! People are shooting at me, bros!
18;9;Kyle;You're watching someone play Call Of Duty and talk about it?
18;9;Ike;[claps] PewDiePie!
18;9;PewDiePie;There's lots of bullet! And I've gotta run! RUN FOR THE BUNKER! RUUUUN!
18;9;Kyle;Ike, we could go play the game downstairs. Isn't that better than watching some guy on YouTube playing it?
18;9;PewDiePie;Alright, I hope that's enough.
18;9;Ike;Meh.
18;9;PewDiePie;Uh, like I said, um... Look at this. Look at this. Ooohhh, gigrrig! [fires away at will]
18;9;;South Park Elementary Cafeteria, lunchtime
18;9;Kyle;Dude, I'm telling you. It's crazy. All my little brother wants to do is sit on YouTube watching this PewDiePie play video games. I swear, I don't understand kids these days.
18;9;Butters;What's a PewDiePie do?
18;9;Kyle;Google him. He's this guy from Sweden who has over 30 million YouTube subscribers. We didn't even know, but he's a bigger celebrity to kids than anyone. It just seems so lame.
18;9;Cartman;He plays video games and makes millions of dollars, and it's lame how?
18;9;Kyle;Because- because that's not even entertainment! I mean, it's just, just, rehashing shit, isn't it?? It's like everything these kids are into these days, you know, it's just... rehashed shit!
18;9;;Commercial for an upcoming concert
18;9;Announcer;This Saturday, at the Pepsi Center, it's Women of Rock! Miley Cyrus, Iggy Azalea, Nicki Minaj, and Lorde! [Randy] All on one stage, on one night! With a special appearance by Michael Jackson's Hologram!
18;9;MJ Hologram;Hee hee!
18;9;Announcer;Ticket proceeds help fight the gluten crisis in West Africa! It's a night of pure, pure estrogen! Tickets on sale now! [TeleChargeIt and TicketMastering info go up]
18;9;;Randy's garage, night. Randy runs inside to call someone in private
18;9;Randy;Yeah, it's me. I told you I can't play the concert!
18;9;Record producer;Come on, this is a great lineup.
18;9;Randy;Look, I do a lot of post-production enhancements to make my music sound the way it does, okay? I feel like if I play live I'm... really gonna disappoint people. I'm sorry, but the answer is no.
18;9;Record producer;I don't think you're really in a position to turn down this kind of gig.
18;9;Randy;What is that supposed to mean?
18;9;Record producer;I understand your son gave all your savings to Canada.
18;9;Randy;Yes, Freemium gaming.
18;9;Record producer;I'm sorry. Freemium gaming destroys lives. I lost my father to Candy Crush. [Randy sighs] You need this, Lorde. And the girls out there need you. You've got till tomorrow to think it over. [hangs up. Randy ends the call]
18;9;Randy;I love Candy Crush.
18;9;;The bus stop, day. The boys are there waiting for the bus
18;9;Kyle;All I wanted was to play one level of Call of Duty and you know what Ike told me? He said the living room was for old people.
18;9;Stan;I don't get it. The whole fun of Call of Duty is that you get to do the shooting.
18;9;Kyle;I know! But that doesn't matter any more! These kids don't wanna play the game, they just wanna watch people on YouTube play it. And you know why? Commentary.
18;9;Kenny;(Commentary?)
18;9;Kyle;Yeah. You used to sit in the living room with family and friends to hear their commentary on things. Now you can get it with a little guy in a window on the screen. Someone who just comments on stuff. I mean, really? Who would even WANT to do that?! [Cartman eyes his phone with Stan and Kenny look at Kyle]
18;9;;Cartman's room, later. He's set up a YouTube channel and is now broadcasting on it
18;9;Cartman;Hey bros, what's going on? This is CartmaaanBrah! Be sure to subscribe to my channel if you haven't already, 'cause subscribing makes you feel good! Uhh, so today I'm gonna comment on Call Of Duty. More specifically, I'm going to comment on my friends commenting on Call Of Duty, so let's start. [a recording of the earlier conversation plays]
18;9;Kyle;All I wanted was to play one level of Call of Duty and you know what Ike told me? He said the living room was for old people.
18;9;Cartman;That's Kyle the Jew again, talking about Call Of Duty to Stan.
18;9;Stan;I don't get it. The whole fun of Call of Duty is that you get to do the shooting.
18;9;Cartman;[reaches for some chips and eat them, chuckles, then] Stan is such a douchebag. He just agrees with Kyle no matter what.
18;9;Kyle;I know! But that doesn't matter any more! These kids don't wanna play the game, they just wanna watch people on YouTube play it.
18;9;Kenny;(Commentary?)
18;9;Cartman;There's Kenny commenting on Call of Duty. Kenny! Kenny! SPEAK UP!! SPEAK THROUGH THE HOOD KENNY!
18;9;Kyle;Yeah. You used to sit in the living room with family and friends to hear their commentary on things. Now you can get it with a l-
18;9;;The Marsh house, kitchen. Sharon is washing, Randy is drying, Shelly walks in excitedly
18;9;Shelly;Mom, Dad, Kelly and Stacy are going to the Women of Rock concert! Can I go with them?! [anxiously waits for an answer]
18;9;Sharon;I don't know, Shelly.
18;9;Shelly;But Mom, Lorde is playing! You can't not let me go or I'll hate you forever! [Randy and Sharon turn around]
18;9;Randy;Shelly, there's a good chance Lorde isn't goin' to show up.
18;9;Shelly;She will too! She has to show up, and if I don't get to see her I'm gonna kill myself!
18;9;Randy;And what if you go and Lorde doesn't sound that great in person?
18;9;Shelly;That doesn't matter, Dad! We love Lorde because she's real! Gosh, you guys don't understand anything!
18;9;Randy;You know, I think Lorde is going to play tomorrow.
18;9;Shelly;So can I go or not?!
18;9;Randy;If she means that much to you.
18;9;Shelly;Okay, yay, thanks, love you guys. [smiles and walks away]
18;9;Sharon;Sooo you're doing it? [smiles]
18;9;Randy;How can I let her down? Do you mind finishing up here? I think I should practice a little.
18;9;Sharon;Of course not. [Randy walks away and out of earshot] Anything to keep you away from cock magic.
18;9;;Ike's room, later. Ike is still at his computer eating Cheetos
18;9;Cartman;Uhh, so today I'm gonna comment on Call Of Duty.
18;9;Kyle;[goes into the room] Hey Ike, you wanna come watch TV with me?
18;9;Cartman;More specifically, I'm going to comment on my friends commenting on Call Of Duty, so let's start.
18;9;Kyle;Oh no! No, Ike! You are not watching him comment on things!
18;9;Kyle;All I wanted was to play one level of Call of Duty and you know what Ike told me? He said the living room was for old people.
18;9;Cartman;That's Kyle the Jew again, talking about Call Of Duty to Stan.
18;9;Kyle;[approaches the monitor] What the fuck?!
18;9;Stan;I don't get it. The whole fun of Call of Duty is that you get to do the shooting.
18;9;Cartman;[reaches for some chips and eat them, chuckles, then] Stan is such a douchebag. He just agrees with Kyle no matter what.
18;9;Kyle;Ike, that is enough! If you're interested in Call of Duty, go play it downstairs in the living room!
18;9;Cartman;God these guys are so annoying, aren't they? CartmaaanBrah!
18;9;Kyle;But that's all that matter now! It's just all ... and the new celebrity?
18;9;Ike;CartmaaanBrah!
18;9;;The neighborhood park, basketball court, day. Cartman, Stan, and Kenny are playing a game. Cartman has the ball. Kyle runs up, angry
18;9;Kyle;What do you think you're doing?!
18;9;Cartman;Shooting for a D in a game of Horsedick.
18;9;Kyle;You know what I mean! Why is my little brother watching you talking about us talking about him?!
18;9;Cartman;I have a YouTube blog where I comment on video games. Big whoop.
18;9;Kyle;I don't need Ike listening to you comment on anything!
18;9;Stan;What are you talking about?
18;9;Kyle;This fat fuck thinks he's PewDiePie! Because of him I can't get Ike to come out of his room!
18;9;Cartman;"Because of me?! I'm pretty sure I'm not the person who invented ""Let's Plays"", Kyle."
18;9;Kyle;"""Let's Plays""?"
18;9;Cartman;That's what they're called, dude. Get with the times. [turns to the basket and takes his shot. Kyle looks away and down]
18;9;;The Women of Rock concert at the Pepsi Center, night. Miley Cyrus is performing
18;9;Miley Cyrus;"There's a party going on and it's all right here, yehhhehehah!
Throw my hands in the air while I'm twerkin' this chair
There's a party going on and it's all right here, yehhhehehah!
And I'm movin' my hands while I'm shakin' my tits."
18;9;Stagehand;Alright guys, uh, Miley's about to finish up her set. So next we'll need you, Nicki Minaj, then Iggy Azalea who'll be performing with a hologram of Michael Jackson, and then finally you, Lorde. [walks out of the dressing room backwards] Have a great show, ladies.
18;9;Randy;Hey uh, listen, I, I thought I could do this, but it's not gonna work.
18;9;Record producer;You're nervous, it's understandable.
18;9;Randy;No I'm eh... I know for a fact that I don't sound the same live.
18;9;Record producer;You think those people out there care what you sound like? You're just another female pop star. Just go out there, pump your hips and rub your clit.
18;9;Randy;Hey! That's not what my music is about! I'm not reducing myself to that!
18;9;Iggy;Oh fuck you, Lorde! You think you're so much better than everyone!
18;9;Randy;No, I don't, Iggy. I just think that our younger girl fans need something a little more positive as role models.
18;9;Iggy;That's easy for you to say because YOU don't have a nice body! Is that why you're so high and mighty, Lorde?! Because you're jealous of this booty?!
18;9;Randy;Iggs, I really don't care to go through this again with you.
18;9;Iggy;'Cause let's face it! You got legs that look like a horse!
18;9;Randy;Fuck you! [they start fighting and break through a table full of finger food and drinks]
18;9;Record producer;Alright that's enough! [breaks up the scuffle and separates the two artists] Look at yourselves!
18;9;Iggy;You're an internet bullshit artist, Lorde!
18;9;;Kyle's house, night. The doorbell rings and Kyle answers it. Stan comes in
18;9;Stan;Hey, what's up?
18;9;Kyle;You're not gonna believe this.
18;9;Stan;Oh no, what now?
18;9;Kyle;I wanted to get Ike out of his room, so I invited all his friends over for a slumber party to play Dragon Age: Inquisition.
18;9;Stan;Yeah?
18;9;Kyle;Come on! [leads Stan upstairs]
18;9;;Ike's room. There are five other kids beside Ike in his room, and each one is using a tablet or a laptop, so no one is talking. Ike is watching PewDiePie on his monitor
18;9;PewDiePie;[giggling] He's just laying there.
18;9;Kyle;See? Look at this. Ike has all his friends over and they're just sitting around on their own computers barely talking to each other. Ike is watching PewDiePie play Dragon Age.
18;9;PewDiePie;"I'm going ""Dun dun dadadun dun dadadun."""
18;9;Kids;[in unison] PewDiePie!
18;9;Kyle;And this kid is watching Cartman commenting on people commenting on Dragon Age.
18;9;Butters;Well it's a really great game. The characters are so rich.
18;9;Cartman;Butters is such a butthole, oh my God! CartmaaanBrah!
18;9;Kids;CartmanBrah!
18;9;Stan;Dude, video games are meant to be played in a living room, not something to watch people comment on!
18;9;Conner;Okay Grandpa, we'll be sure to keep that in mind. [the kids laugh]
18;9;Stan;Grandpa?
18;9;Kyle;This is how they talk to us! [to Conner] You'd better watch your mouth, kid!
18;9;Kid 1;Yeah Conner, we're supposed to respect our elders, remember?
18;9;Kid 2;It's best to just make old people think they matter.
18;9;Stan;Oh, is that right?! Do you even know how to multiply?!
18;9;Kid 2;No sir. Thank goodness we have you to do that. [Ike laughs at PewDiePie's gameplay]
18;9;Stan;We're not being grandpas! Your guys's stuff is just seriously lame! Our generation's stuff is cool!
18;9;PewDiePie;Oh my God I killed him!
18;9;;Back at the Pepsi Center, Iggy Azalea is performing.
18;9;Iggy;"Missy who who?
That's all I do is rip off Missy.
Missy who?
Missy who? Missy who? Missy who, who? Missy who, who?

Alright bitches and hos, via hologram and shit, Michael Jackson! [two men from the Syntech Hologram Company get ready]"
18;9;Tech 1;And, cue the hologram! [a bunch of special lights come on and produce the hologram, and the hologram performs Michael's signature moves. The crowd goes wild as Michael's music plays. The hologram moonwalks like Michael did]
18;9;MJ Hologram;Hee hee. [as the crowd roars, Iggy starts twerking to the hologram]
18;9;Randy;They shouldn't rehash dead people. It's so wrong.
18;9;Nicki;Oh Lorde, you're such a purist.
18;9;Randy;Can't help it, Nick. Can't help feeling like... we're losing something.
18;9;;Wendy: The Wendy Williams Show, now on air. Wendy comes out in a blue dress and black jacket
18;9;Wendy;Hi everybody. I love you!
18;9;Audience;Thanks for loving me. I love you too.
18;9;Wendy;So I guess there's this new trend with young people where the celebrities they look up to most are YouTube commentators. Just ordinary people who sit in front of a mic and blab their opinions about everything while their mindless loyal followers cheer them on. Isn't that crazy?? [the audience cheers in agreement] Well let's meet one of these stars of the internet. Please welcome CartmanBrah! [Instead of Cartman himself appearing on the couch, Cartman's commenter window pops up - he's doing this via satellite]
18;9;Cartman;CartmaaanBrah!
18;9;Wendy;So can you explain to our audience members over the age of five what it is that you DO?
18;9;Cartman;Well, Wendy, I started by talking about people talking about video games, but now I'm branching out into talking about people talking about music and the arts as well.
18;9;Wendy;And why do you think young people-?
18;9;Cartman;CartmaaanBrah!
18;9;Wendy;...Why do you think young people are responding to this? [Cartman mocks the question by asking it back in nonsense syllables] I'm asking you a question! [Cartman continues with the nonsense replies]
18;9;Cartman;CartmaaanBrah! CartmanBrah! Be sure to subscribe to my channel, brahs.
18;9;;Back at the Pepsi Center, the MC is about to introduce Lorde. The crowd cheers loudly
18;9;MC;And now, give it up for the girl from New Zealand, LORDE!
18;9;Randy;Thank you! Thanks a lot! This is for all the royals out there! [begins playing an acoustic guitar. Shelly is in the audience with Kelly and Stacy] Lorde Looorde. I'm Lorde, ya ya ya-a-a. Sittin' on the toilet thinkin' 'bout how I'm not as rich as other people, ya ya ya. [the cheering dies down] Yaa ya ya ya, I'll never be, I'll never by royalty. Ya ya ya. But that'd be nice 'cause that'd be a nice fantaasy. [the mood of the audience begins to change] Women's bathrooms smell so nice, ya ya ya. Ya ya ya. [the audience begins to boo] And we'll never be- Lorde Lorde Lor- Lorde flushing- Lordy Lordy Lorde. Lor-uh, okay, uh. [turns right and the mic falls to the ground] Oh God. Sorry. [bends over to pick up the mic...] Uh hold on.[...but drops the guitar instead. The boos intensify] Hang on, uh. [to bail Lorde out of this mess, the technicians bring Michael's hologram back to the stage]
18;9;MJ Hologram;Hee hee. [the hologram runs through the audience] I'm free! I'm free!
18;9;Randy;[dusts himself off] Sorry folks, just one second here.
18;9;;The Pepsi Center entrance. Michael's hologram runs through the metal detector and begins to dance. Security guards are hot on his tail
18;9;MJ Hologram;Hee hee. Dah dadit dat ja!
18;9;Guard 1;Stop him. [another guard tries to grab the hologram, but realizes it can't be done. The hologram leaves the Center. The guards run out after it, and a guard guard gets on his walkie-talkie]
18;9;Guard 1;Michael Jackson's hologram is on the loose!
18;9;MJ Hologram;[leaving the parking area] Hee hee!
18;9;;The Pepsi Center stage. Lorde is still on stage getting booed.
18;9;Randy;"Ah ya ya. Okay, uh. Ah ya ya ya ya-a-a-a. [the boos don't stop, and Randy's vision becomes prismatic] Okay, uh, uh... [steps aside and begins to simulate rubbing his ""clit""] Oooo![hops onto the car on stage and continues the simulation] Oh yeah! Oh my clit! Oh yeah! Oooo yeah, flick that bean, yeah! [the boos are replaced by disgust. Shelly and friends are disappointed]"
18;9;Fan;Ogh! Lorde, ewww!
18;9;Randy;Oh, I'm so horny, yeah! Ooo, fuck, my clit's so big! Oooo! [fans begin to walk out of the concert]
18;9;;The Marsh house, dining room. Sharon, Randy, and Stan are having dinner
18;9;Randy;Could you um, pass the potatoes, Stan? [Stan reaches to his left and passes the potatoes to Randy] Great, thanks. [serves himself some potatoes] Well, nobody's talking. Does anyone have anything to talk about?
18;9;Stan;Why'd you have to rub your clit on stage, Dad?
18;9;Randy;I was told to!
18;9;Sharon;You were told to walk out in front of a hundred thousand people including little girls who look up to you, and start rubbing your clit.
18;9;Randy;Okay, hold on! A, I don't have a clit, so technically, I wasn't rubbing anything! And B, I didn't want to even perform tonight, but Stanley gave all our money to Canada through a freemium game, so if anyone rubbed their clit, it was him! [Stan hisses and leaves the table. Sharon just leaves. Some time later, Randy drops in on Shelly in her room and sees her crying on her bed, face down. He then notices that the Lorde poster on the wall is in tatters and ripped in half. Randy leaves and closes the door softly]
18;9;;Kyle's house, day. Kyle walks around a darkened living room, rubbing his left hand along the coffee table, then along the TV, and he finds them dusty
18;9;Kyle;It's dying. The living room is... dying.
18;9;;Randy's garage, night. Randy enters to talk to the record producer on the phone in private
18;9;Randy;Yeah, it's me. I need to fix this. How can I undo the clit-rubbing?
18;9;Record producer;What are you talking about? It's great! You're the most commented-on artist in the world right now! You're blowing up twitter and you're trending on CartmanBrah. #clitnubbin
18;9;Randy;Look, this isn't what I want! My music is supposed to be-
18;9;Record producer;It's not about the music, Lorde! It never was. It's about comments! And sister, you've got 'em!
18;9;Randy;This ends now. I'm gonna tell people the truth.
18;9;;The Rockies, day. A South Park City Transit bus is going to town, and Michael's hologram is in it. Everyone is on their iPhones or iPads
18;9;Passenger;Will you look at that? Everyone on their cell phones, nobody sayin' a word to each other. Call me a grandpa, but I still like commenting face to face with folks. You know what I mean, buddy?
18;9;MJ Hologram;Yes.
18;9;Passenger;You're headin' up to the mountains too, huh? Gonna do some skiin'?
18;9;MJ Hologram;No, I just need to... take care of some im-, important business.
18;9;Passenger;Oh, what kind of business? Oh are you a fisherman?
18;9;MJ Hologram;Yes. I mean, yes, that's all. I'm, I'm just gonna fish and hunt.
18;9;Passenger;Oh, you're a hunter? What do you prey upon?
18;9;MJ Hologram;[stands up] Nobody! That's ignorant!
18;9;Passenger;Well, you must have a favorite kind of prey?
18;9;MJ Hologram;Allegedly! Allegedly! That's ignorant!
18;9;Passenger;You know, excuse me for saying so, but you seem kind of... transparent.
18;9;MJ Hologram;...That's ignorant. I'm just cold.
18;9;Passenger;I'm saying it must make it easier to sneak up on your prey.
18;9;MJ Hologram;Allegedly! I'm weary of this conversation! Can we please stop talking, please?! Ignorant!
18;9;Passenger;[looks him over] Well, whatever it is you're after, I hope you get it.
18;9;MJ Hologram;Oh I will. Trust me, I will. [The bus enters South Park.]
18;9;;The Syntech Hologram Company, day. The record producer is with the tech working on the hologram problem
18;9;Tech 2;Ah, we've lost any ability to track the hologram's location. Ih...it looks like it reprogrammed its guidance systems.
18;9;Record producer;We paid a lot of money for that hologram. You'd better find a way to get it back!
18;9;Tech 3;Project Alpha?
18;9;Tech 4;Yes. That might be our only option.
18;9;Record producer;What is Project Alpha?
18;9;Tech 4;The first hologram we ever created to appear on stage. It was a prototype. But perhaps the best thing to stop a hologram-
18;9;Tech 3;Is another hologram. Bring up Project Alpha!
18;9;Tech 2;Sir, are you sure that we wanna-?
18;9;Tech 3;Bring it up! [Tech 2 gets to work. Everyone turns around and watches as the hologram is assembled]
18;9;Record producer;What is that?
18;9;Tech 3;Tupac.
18;9;Tech 4;"[approaches the hologram] Tupac? [the hologram is activated] Yo. The hologram of Michael Jackson is on the loose. We need you to ""take care of the situation."" [the hologram takes out a Glock hologram and cocks it, then he walks forward, then turns left and walks out]"
18;9;Tech 3;Godspeed, Tupac.
18;9;;The Syntech Hologram Company, outside. Tupac crosses the street and a car almost runs him down. The couple inside is in shock
18;9;Man;Oh my gosh, honey look it's Tupac! I told you them homies didn't cap his ass! [Tupac opens the driver's door, pulls the driver out and throws him to the ground, then gets into the driver's seat and takes off with the car and driver's wife. The driver gets up and pulls out his phone] Oh, this is going on Instagram! [takes the picture]
18;9;;The bus stop, day. Cartman's commenter window is there in his place
18;9;Cartman;Hey hey, how's it going, bros? This is CartmanBrah. CartmaaanBrah. And uhh, we are, it looks like we are at the bus stop now. [the other three boys walk into view] Yep, there's Kyle, Stan and Kenny looking stupid as ever.
18;9;Kyle;I don't know what the hell to do. The whole world's gone crazy.
18;9;Stan;Tell me about it.
18;9;Cartman;Uh oh, it looks like Kyle is taking issue with something again. Kyle's got a pro-blem. CartmanBrah!
18;9;Kyle;You know, you used to sit in the living room with your friends and family, and THEY were the ones commenting on whatever was on TV.
18;9;Cartman;[exasperated] Oh God.
18;9;Kyle;[notices the commenter window above the bus stop sign] Do you mind?!
18;9;Cartman;Oh, looks like Kyle is commenting on my commenter window, bras! Be sure to comment on that. #kyleisgettingfrustrated
18;9;Kyle;Dude! Nobody wants to hear you commenting on things!
18;9;Cartman;Oh really. Ten thousand subscribers and counting, brah!
18;9;;Buca de Faggoncini, day. Randy goes inside. The record producer is waiting for him at a table. Randy approaches, but doesn't sit down.
18;9;Randy;Thanks for seeing me. I've got my speech written. I'm ready to let the world know the truth. [the producer puts down his fork and wipes his lips off with a napkin.]
18;9;Record producer;Sit down, Lorde.
18;9;Randy;I'm not interested in being talked out of ending this. It's the right thing to do.
18;9;Record producer;[stands up and walks to a nearby bar] Do you know what an artist is now, Lorde? An artist is a conversation piece, nothing more. [pours himself a drink] Like a vase, or a kitschy side table. Just something for people to comment on. [turns around] The old ways are dying. We're not making money off records, we're making money off tweets. And you've taken it to a whole new level.
18;9;Randy;Well that's not a world Lorde ever wanted to be a part of.
18;9;Record producer;On the contrary. Lorde is going on the Jimmy Fallon show tonight and exposing her asshole for everyone to freak out about.
18;9;Randy;I'll do no such thing!
18;9;Record producer;Who said anything about you? [whips out a small remote control and presses a button on it. Some lasers turn on and assemble a new hologram. It's Lorde's hologram. It walks up to the producer and stands beside him. Randy is frightened and takes several steps back. Two bodyguards appear behind him, and he notices. The producer closes the blinds]
18;9;Randy;You can't just replace artists with holograms. Who will make the content?
18;9;Record producer;Today, commentary IS the content. And you, I'm afraid, are just in the way. [the bodyguards quickly escort him out]
18;9;;South Park Elementary, day. Mr. Garrison wipes off the previous night's work from the blackboard.
18;9;Mr. Garrison;Okay children, let's take our seats. Before we get started, Kyle has asked to say a few words. Go ahead, Kyle.
18;9;Kyle;[walks up to the front of the class and turns around. He reads from a sheet of paper] What is happening to our living rooms? There is a crisis in America, and-
18;9;Cartman;[his commenter window pops up] Looks like we're in the school now. Check out Wendy, she's flat as a pancake.
18;9;Mr. Garrison;What the hell is that?
18;9;Kyle;It's Cartman's stupid online persona!
