18;9;Cartman;Oh my dick's gettin hard again! It's protrudin' out my paaaaants!
18;9;Mr. Garrison;What the hell?
18;9;Cartman;This is the way of the future, Mr. Garrison.
18;9;Butters;It's true!
18;9;Cartman;Heh that's right, Butters will back me up on anything. He's such a bitch.
18;9;Butters;Heheyehah.
18;9;Kyle;There is a crisis in America! As families grow further and further apart-
18;9;Cartman;[mocking] There is a crisis in America. and we have to save our living rooms. Our living rooms are dying.
18;9;Kyle;Mr. Garrison, will you make him stop!
18;9;Mr. Garrison;I don't- I don't even understand what's happening.
18;9;Kyle;THIS is the reason why our living rooms are dying!
18;9;Cartman;[mocking] This is the reason why our living rooms are dying, so we've got to do something.
18;9;Mr. Mackey;Eric Cartman's commenter window to the principal's office, please? Eric Cartman's commenter window to the principal's office!
18;9;Cartman;What the hell did I do?
18;9;;Principal Victoria's office, later.
18;9;Principal Victoria;Eric, I've had a lot of complaints that your online persona is becoming a distraction.
18;9;Cartman;Well this sucks. Looks like I'm in the principal's office for just commenting on things.
18;9;Principal Victoria;Eric, I am talking to YOU!
18;9;Cartman;Adults so don't get what's cool anymore.
18;9;;The Marsh house. Randy rushes in through the front door
18;9;Randy;Sharon? Sharon!
18;9;Sharon;[comes down the stairs in her bath robe] Randy? What's going on?
18;9;Randy;They made a hologram of me, Sharon! They don't care about the music! They're REPLACING us!
18;9;Sharon;Oh my God! You mean, I just slept with a hologram?
18;9;Randy;The hologram's in our bedroom?
18;9;Sharon;Yes!
18;9;Tupac's Hologram;I've gotta be leavin' now, Sharon. I would leave you my number but I'm just a hologram 'n shit.
18;9;Randy;You slept with Tupac?! SHARON!
18;9;;The record producer's limousine, back seat. Cartman's commenter window is there with the record producer
18;9;Record producer;It's a brave new world, starting much sooner than we thought. What we need is someone who truly gets the changing of the guard. We have an army of holograms poised to start the next chapter in American culture. How would you like to be in charge of it all?
18;9;Cartman;[in his commenter window] Ohohoh, totally, brah! So sweet. Being in charge of stuff rules! CartmaaanBrah!
18;9;Record producer;Glad you feel that way. We have a lot to do together. We're about to take this to a whole new level.
18;9;Cartman;Ooohh, I love whole new levels! This is gonna be so totally awesome! CartmaaanBrah!
