20;8;;Tom's Rhinoplasty. A government agent speaks with Bannon.
20;8;Government agent;The political world is watching, Bannon. [gives Bannon a file] We need to make sure the president elect has a smooth transition.
20;8;Bannon;All indications are that his transition [flips a page] is going to be fine.
20;8;Surgeon;[walks by] We're just doing some finishing touches, but everything went well. You can see him now if you like.
20;8;Caitlyn;I'll go.
20;8;;Caitlyn walks into a technologically advanced room where Garrison is seen having a blond, push-back wig put on his head by a mechanical arm.
20;8;Garrison;[talks with Caitlyn] Well, do I look presidential?
20;8;Caitlyn;Honestly, you look twenty years younger.
20;8;Garrison;They really worked on my stank face. Look! Whenever I don't know what people are talking about, I just do this, [lowers his body] like look. [shows his stank face] I can do this. [shows his stank face again] This is, this is my stank face. [shows a different stank face] It's like, I'm not listening to you, see? [shows his other stank face] They did a really good job on my stank lips.
20;8;Caitlyn;It's an amazing transition.
20;8;Garrison;Now I feel ready to take care of business and do what really matters... [sits up straight] in just a minute, I'm gonna do the UV rays a bit longer.
20;8;;[the machine closes enseals Garrison]
20;8;;SpaceX. Cartman and Heidi walk to the desk.
20;8;Secretary;Can I help you?
20;8;Cartman;Hello. I understand that you're trying to get to Mars. This is my girlfriend, Heidi. She's really smart and really funny.
20;8;Secretary;...Okay.
20;8;Cartman;We've given up social media and we'd like to be somewhere as far from the internet as possible. Is it true Mars would have really shitty Wi-Fi?
20;8;Secretary;...That'd be an understatement, yes.
20;8;Cartman;Well, we'd like to go. We can't tolerate this world anymore and we'd like to talk to whoever we can about getting to Mars as soon as possible please.
20;8;Secretary;Uh-huh. Take a number and join the others.
20;8;Cartman;What others?
20;8;;[Cartman, Heidi, and the secretary turn their heads see a bunch of other people waiting, including Cher singing]
20;8;Cher;[garbled and auto-tuned] If I could turn back time...
20;8;Cartman;What the fuck, dude?!
20;8;Secretary;Lot of people want to leave the planet right now.
20;8;Cartman;Ah god dammit, is that Cher?!
20;8;Cher;[garbled and auto-tuned] Do you believe in leaving the world, oh...
20;8;;South Park Elementary, principal's office.
20;8;PC Principal;God [knocks down papers] dammit! [knocks down lamp] How the fuck did this happen?!
20;8;Mackey;[knocks the door and opens it] Uh, sorry PC Principal, but someone wants to speak with you.
20;8;PC Principal;I told you to leave me alone, Mackey! [slams fist on the desk] I'm not in the mood!
20;8;Mackey;But, but sir, the president elect is here. [moves away from Garrison]
20;8;Garrison;[enters the office with two Secret Service agents following him] So sorry for the intrusion. You're not too busy, I hope.
20;8;PC Principal;Uh, not at all. Please uh, have a seat, Mr. Garrison.
20;8;Garrison;Excuse me?
20;8;PC Principal;Uh, please have a seat, Mr... President.
20;8;Garrison;That's better, bitch. [sits down and takes out a piece of gum]
20;8;PC Principal;Certainly want to uh, congratulate you on the election.
20;8;Garrison;Do you remember the day you fired me, PC Principal?
20;8;PC Principal;I know we've had some differences, uh...
20;8;Garrison;"I was upset because a bunch of immigrants were changing my class and I believe your response was that I needed to go and ""learn their language"", ""be more open-minded""."
20;8;PC Principal;I'm sorry that your position here at the school was terminated.
20;8;Garrison;Are you really? [makes stank face] Are you really sorry? [makes different stank face] Because you see PC Principal, you helped create me. You insisted that I was a bigot, that I was an intolerant relic left over from another time. But now, I'm your president. And if there's one thing I've learned about becoming president, it's that your penis can get really dry. When all the skin on your penis is drying out from working so hard to get elected there's only one thing that can fix it, isn't there? Saliva, from a good friend who once doubted you. I need you to fix my problem, PC Principal, so that we can be even-stevens. What do you say, bud?
20;8;PC Principal;[is in complete shock]
20;8;;Outside of unknown club. Two people got out of the club. The berries head to a tiny door.
20;8;Unknown berries;Oh, 'member when it fell in her drink. Yeah, I 'member.
20;8;Memberberry 1;'Member when Han shot Greedo?
20;8;Memberberry 2;Sure, I 'member Greedo.
20;8;Tubbs;Ha, I 'member Greedo.
20;8;Memberberry 3;'Member?
20;8;Memberberry 1;[knocks at the small door]
20;8;Guard Berry;[opens small window] What's the password, 'member?
20;8;Memberberry 3;Yeah, I 'member.
20;8;Memberberry 1;You 'member?
20;8;Guard Berry;I 'member. [opens the door, lets the berries in, and then closes the door immediately]
20;8;;"Inside a Memberberry bar. Random berries keep on saying ""'Member""."
20;8;Memberberry 1;Ha ha, 'member this place? [hops away]
20;8;Memberberry 2;Sure, I 'member. [rolls away]
20;8;Memberberry 4;[hops away] 'Member the Tantive IV?
20;8;Memberberry 1;Oh, I love that ship. [stops moving]
20;8;Memberberry 3;[goes with the other berries and talks to an old berry] Hi, it's us, 'member?!
20;8;Don;Ah sure, I 'member.
20;8;Memberberry 4;We did the thing with throwing Mickey in the drink, 'member?!
20;8;Don;"Ah sure, I 'member; just 'cause of youse, we won the election."
20;8;Tubbs;Yeah yeah, 'member?
20;8;Don;Waiter, round of drinks for our heroes here, 'member?
20;8;Waiter Berry;I 'member.
20;8;Don;You done good poisoning the lady's drink. Now our man is in office, 'member? But I still have things I need you to do.
20;8;Tubbs;Hehe, hehe, I 'member.
20;8;;TrollTrace Headquarters: vault. Gerald repeatedly knocks on the exit door with all his might.
20;8;Gerald;Please, you have to let me outta here!
20;8;Dick;Skankhunt, stop!
20;8;Bedrager;[talks from above] Yes, please. You're making a very jackass of-a yourself.
20;8;Gerald;[walks to see Bedrager's face]
20;8;Bedrager;Well well, what do we have here? Looks like your little troll-party.
20;8;Troll 4;You Danish pricks, you tricked us!
20;8;Bedrager;We didn't trick you, your own government did. They thought if they handed you over to us we would agree not to go forward with the TrollTrace program.
20;8;Gerald;You can't hold people prisoner! I haven't done anything! People are gonna be looking for me!
20;8;Bedrager;[takes out his phone] By all means, [tosses the phone to Gerald] contact whoever you want. Of course, you'll have to tell them why you're here.
20;8;Dick;What are you gonna do with us?
20;8;Bedrager;We're going to use you to set the world on fire. When the servers go online, there will be chaos, panic, and war. And from the ashes, a new world will rise: a world where everyone is happy, and singing, and has no secrets, [yells] like Denmark! [punches a railing]
20;8;Dick;You think you can turn countries in the world against each other? Our president will never let that happen.
20;8;;Unknown supermarket.  Garrison and Secret Service agents enter the store.
20;8;Garrison;"Hey everybody! [walks to a checkout line, takes a mic, and hums ""Hail To The Chief""] Guess who's here? It's the President of the United Fucking States. [mic drop, then walks around the store] Oh, it's been a while since I've heard from you guys. Hi, Janice. [takes a small bottle of water from her shopping basket and opens it, tossing the cap away] Hello, Stephen."
20;8;Stephen;[looks away] Mr. President.
20;8;Garrison;[walks around the store some more] I was just, you know, passing through the old neighborhood [checks out a tomato paste can from another shopper] thinking about what laws I might get rid of, when suddenly, out of nowhere, my penis got really dry. You know if they have anything at this store for a dry dick? Huh? No? You guys can't think of anything? Oh, I know. What about [points to] Eduardo Hernandez? I believe it was Eduardo who told me I couldn't double-bag my groceries, even though he's from fucking Guatemala. Well, what do you think now, Eduardo? You wanna double-bag somethin' else? [his phone rings, and he pulls out out of his back pocket to answer it] This is the President.
20;8;First general;Sir, we need you at the Pentagon. It's a matter of national security.
20;8;Garrison;Oh, really? I'm kinda busy right now, jeez.
20;8;First general;Sir, the Danish have released a statement. I'm afraid... we may be going to war.
20;8;Garrison;War?
20;8;;Ike's room, day. He's playing a first-person shooter game when a Skype call comes in.
20;8;Gerald;Ike?! Ike, buddy, can you hear me?! I need you to do something, okay? Daddy needs your help! I need you to go to your browser and sign on to the school message board, okay? Can you do that for me? The school message board and then log in. Lowercase S, skank-hunt-4-2. You got it?
20;8;;The other trolls witness Gerald's actions.
20;8;Dick;Wow.
20;8;Anonymous821;Wow, what?
20;8;Dick;He's gonna have his son sign in and troll for him.
20;8;Gerald;"[covers his phone and faces the other trolls] If Skankhunt is still out there trolling, then they have the wrong guy! Get it?! It's called ""using your brain"", fatso!"
20;8;Anonymous821;So they'll blame your kid?
20;8;Gerald;Nobody cares if a kid trolls! What are they gonna do, get a slap on the wrist?
20;8;Dick;[stands up] Didn't you hear what that guy said? They're gonna set countries against each other! We have way bigger problems!
20;8;Gerald;"You don't know my fucking wife! [faces the phone] Ike, you got it? Great, pal! Okay, now I need you to go to the comment section, okay, and type in ""You should all get raped by gorillas"". You got that pal? Ike, ""You should all get raped by gorillas""! Come on, we have a lot of work to do here!"
20;8;;SpaceX. Heidi and Cartman sit next to each other on separate chairs.
20;8;Cartman;Jesus, I didn't think getting to Mars would take this long.
20;8;Heidi;You really think this is what we should do, babe? I gonna miss everyone.
20;8;Cartman;I know, but it'll be worth it, babe. We'll be left alone to make our new world better.
20;8;Butters;Hey, Eric! [seen right near Cartman]
20;8;Cartman;[speaks to Butters] What the hell are you doing here?
20;8;Butters;Well I want to get the fuck off this planet, but they told me I had to take a number.
20;8;Cartman;Oh no no no! You're a male chauvinist sexist pig, Butters. You don't get to go to Mars.
20;8;Butters;[shows complete fear] No, you don't understand. I've seen the light, I'm a changed man, I thought boys were being treated unfairly, but now I know... shit's about to get a lot worse.
20;8;;Outside of the White House. Memberberries start incoherent 'membering.
20;8;Memberberries;"'Member The Fugitive? '[Millions of Memberberries are 'membering.]' 'Member Aliens? '[They begin to jump the fence]' Here we are! Ah, yeah! I 'member. Come on, everybody, 'member? '[The large group of Memberberries continue 'membering.]' 'Member snow speeders? '[They approach the front door.]' Yeah, I 'member! 'Member not hearing? '[They breach the front door and pour into the main foyer.]' 'Member the invasion of Hoth? Haha! 'Member ""you rebel scum""? I 'member! '[They fill the entire floor of the White House entrance.]' Oh, 'member the rebel transports? '[Thousands of Memberberries open the door to the Oval Office, and pour in.]'"
20;8;Memberberry 1;"""We did it!"" 'Member? '[Five Memberberries take their place on the president's desk.]'"
20;8;Memberberry 2;Sure, I 'member!
20;8;Memberberry 3;What do we do now?
20;8;Memberberry 4;Don't you 'member?
20;8;Tubbs;Ooh, I 'member.
20;8;;Ike's room. Ike sets up the profile photo of Mrs. Herrera and a penis in a small Photoshop tab while Gerald is on Skype.
20;8;Gerald;Okay now make sure the little worm is in the woman's mouth, got it?
20;8;Ike;[puts penis in photoshopped mouth]
20;8;Gerald;"Now I need you to type ""You're a fat retard"" in the comments."
20;8;Ike;"[types in the comment section] ""You're a retard."""
20;8;Gerald;"No, you have to say ""a fat retard"", Ike! It's a nuance, but it's very important!"
20;8;Ike;"[types in the comment section] ""You are a fat retard."""
20;8;Sheila;[sees what Ike is doing and is in shock] Ike! What are you doing?!
20;8;Ike;What he says.
20;8;Gerald;[exits Skype chat]
20;8;Sheila;[walks into Ike's room and gets a closer look] It was you, all this time! What have you done, Ike?! Do you have any idea the damage you've caused?! How could my child be such a monster?! [answers the call on her phone] Yes yes, hello?!
20;8;Gerald;[talks on his phone to Sheila] Hey sweetheart, how's everything going?
20;8;Sheila;You have to come home from helping the government, Gerald! I just caught Ike trolling Mrs. Herrera!
20;8;Gerald;Are you serious?
20;8;Sheila;Yes! The school troll is our son, Gerald! You should see all the things he's posted on his computer!
20;8;Gerald;God dang it! Let me talk to him right now!
20;8;Shelia;[hands her phone to Ike]
20;8;Ike;Hello?
20;8;Gerald;"Hey Ike, just stay calm and act like I'm yelling at you, okay pal? Okay, give it a few seconds, wait. Good. Okay, now--now say ""I'm sorry, dad. I guess I'm just fucked up inside""."
20;8;Ike;No!
20;8;Gerald;"Ike, you have to listen to me. On your mother's life, this is a matter of national security! You have to say ""I'm sorry, dad. I guess I'm just fucked up inside""!"
20;8;Ike;[angrily] I'm sorry dad. I'm just fucked up inside.
20;8;Gerald;That was amazing, kiddo. It'll all be worth it, okay? I'll make this up to you. Give me back to your mom.
20;8;Sheila;[takes her phone back] Gerald?!
20;8;Gerald;He's full of shit, he's not sorry! If he felt sorry, he wouldn't be able to do it in the first place!
20;8;Sheila;I know!
20;8;Gerald;I'm gonna get home as soon as I can to deal with this, okay? We can deal with this together. Just don't say anything to anyone for now, all right?
20;8;Sheila;"Okay. Okay yeah, I love you too. I know. Bye. [ends the call and talks to Ike] You just sit in here until we figure out what to do; and if you get back on that computer, you are done, you got it?! [leaves Ike's room]"
20;8;Gerald;"[starts a Skype call on Ike's computer] Ike! Okay there's just a few more things I need you to do. I need you to type ""How'd you like a donkey dick?""."
20;8;;Pentagon. Garrison and four Secret Service agents walk to the general.
20;8;First general;[salutes] Welcome to the Pentagon, sir. I've been ordered to show you around. [turns around] This way, please.
20;8;Garrison;[follows the general] So I can do whatever the fuck I want in here now, right?
20;8;First general;Yes, sir. Here are all [gives Garrison a folder of classified information] our military secrets and all classified information.
20;8;Garrison;[takes folder] Okay, good.
20;8;First general;[stops everyone by the Drone Program entrance] This is the Drone Program. In there you can kill anyone on Earth remotely. Here's the keys. [gives keys to Garrison]
20;8;Garrison;Thanks!
20;8;;[everyone continues walking]
20;8;First general;In here is satellite surveillance where you can monitor anyone's conversation live.
20;8;Garrison;Oh that will come in handy.
20;8;First general;Extreme interrogation [stops everyone] room in case you find interrogation necessary.
20;8;Garrison;Oh hell yeah, it's necessary. Let's do it.
20;8;First general;"[gives Garrison a briefcase] And here of course is the famous ""football"", where you could order a nuclear attack in four minutes. [walks away]"
20;8;Garrison;Love me some football. [follows the general]
20;8;First general;[stops everyone by the Diplomatic Strategy entrance] And finally, in here, is the diplomatic strategy and negotiating room. [opens the doors, having everyone enter the room]
20;8;;People in the room are noticing high alerts across the world.
20;8;Garrison;Well, jeez, this doesn't look very fun.
20;8;Second general;Thank God you're here sir. We need your guidance.
20;8;;SpaceX. Butters sits next to Cartman by his left side.
20;8;Butters;Loolooloo, I've got some apples. Loolooloo, you've got some too.
20;8;Cartman;Butter, Butters! You expect people to believe that you went from being the biggest asshole in the school to a softhearted feminist like me? Fat chance.
20;8;Butters;No no, believe me. I'm a changed man. Girls are really smart, and they'll be running the country soon, and they deserve total respect.
20;8;Cartman;Yeah? You just forgot one thing, that women are funny too. That didn't occur to you, did it, Butters?
20;8;Butters;Well I don't think there was ever any question women are funny. Remember that movie 9 to 5 with Lily Tomlin and Dolly Parton?
20;8;Heidi;Oh yeah, that movie was funny.
20;8;Butters;Well I laughed my butt off and it never even occurred to me that they were women. I don't know why things changed. I don't know why people make such a big deal about women and comedy now. I mean what about Carol Burnett? She was great.
20;8;Heidi;Wow, I guess you're right.
20;8;Cartman;Yeah, I mean, when women make vagina jokes I think it's the funniest thing ever!
20;8;Butters;Yeah, well I swear I don't care how many times Amy Schumer talks about her vagina, I laugh every time.
20;8;Cartman;[looks at Heidi, then at Butters, then in a low voice] Oh, I see what you're doing.
20;8;Heidi;What, babe?
20;8;Cartman;Oh nothin', babe. I'm just... Do you think you could tell me some jokes?
20;8;Heidi;[giggles] Why do you want me telling you jokes all the time?
20;8;Cartman;Because you're [glares at Butters] fucking hilarious.
20;8;Heidi;Well, did I tell you the one about the skeleton and the skunk?
20;8;Butters;[laughs] That's already funny! [Cartman gets frustrated and makes a fist with his left hand]
20;8;;The Pentagon
20;8;Second general;All around the world, countries are mobilizing armies and preparing defensive countermeasures.
20;8;Garrison;Why? What the hell happened?
20;8;First general;This is everything you need to know about the TROLL TRACE program.
20;8;Garrison;What's TROLL TRACE?
20;8;First general;A plan by the Danish to release the full internet histories of everyone on Earth.
20;8;Second general;The previous administration tried to work with the Danish by handing over several trolls, but the plan didn't work.
20;8;First general;The entire world has become very uncertain and unstable.
20;8;Second general;We think we should order all navy vessels to the Bering Sea.
20;8;Garrison;For what?
20;8;First general;Because when the Chinese are able to see all our e-mails and online activity, we believe they will most likely attack us. Also, there are ground troops mobilizing in Paris because the French believe when we see all their e-mails, we will most likely attack them.
20;8;Third general;Mr. President, sir! The Russians are asking what we intend to do about the Danish.
20;8;Garrison;Well, why are you asking me?
20;8;Second general;Please, sir, we have very little time before this escalates beyond our control.
20;8;;The Kremlin, Russia, day. What follows is what's on the video, although the language is said to be Russian.
20;8;Aide 1;Президент Путин, Датское утверждает, что они всё ещё готовы включить программу Troll Trase.
20;8;Putin;Это всё, что я сказай, всё, что я сделай на Интернет будет доступно моей подруге?
20;8;Aide 1;Да, кажется так.
20;8;Putin;Датское должно быть оставновлены! Мы нужно знать, как Соединённые Штаты стоят на этом! [behind him, the phone rings at his desk and a second aide pops in to answer it]
20;8;Aide 2;Э... Господин президент, Овальный кабинет. [Putin walks to the phone]
20;8;Putin;Да, это президент Путин.
20;8;Memberberry 3;'Member the Death Star?
20;8;Memberberry 1;Ahahaha, 'member cutting open tauntauns?
20;8;Memberberry 4;Yeah, yeah, 'member the Force? [the berries chuckle]
20;8;Putin;Что это такое?
20;8;Tubbs;Heheh, heheh, yeah, sure, I 'member.
20;8;Memberberry 1;Member McGy-?
20;8;Tubbs;Sure, I 'member.
20;8;Memberberry 3;'Member?
20;8;Memberberry 2;Heheh, hey hey hey, 'member the Cold War?
20;8;Memberberry 1;Oh I loved the Cold War! That was fantastic!
20;8;;SpaceX, day. Everyone is still waiting for the ride to Mars.
20;8;Tour assistant;Okay, Numbers 204 through 215, you can come on through.
20;8;Cartman;[leaves with Heidi] Oh, finally.
20;8;Butters;Hey, that's me too. Yippee!
20;8;Tour assistant;Right in here, everyone. [The group, which includes Cher, walks in, and the door slams shut behind them]
20;8;Elon Musk;Hello, everyone, and welcome to the tour. I'm Elon Musk. Are we gonna have some fun today?
20;8;Cartman;Oh great, a stupid tour guide. Can we just talk to someone important please? We want to go to Mars.
20;8;Elon Musk;And getting anywhere takes ingenuity. Oh, Mrs. Door? Would you mind... opening, please?
20;8;PA door voice;[interactive doors] Yes, Elon. [the doors rattle, but don't open. Elon turns and opens them manually. A chime plays as the doors open, and Elon leads the group onto the factory floor]
20;8;Elon Musk;The only way for humankind to survive is with imagination and technology. Cars that run on electricity. Solar panels that replace roof shingles. Even food that changes form. You see this? It's a pizza, only four inches long. And yet, when heated, it expands to make enough pizza to feed a hundred people. I call it the pizza... pocket.
20;8;Cartman;[whispering to Heidi] They already have Pizza Pockets.
20;8;Elon Musk;Who would like to see the Hyperloop? A new mode of travel that can take you from here to Dubai in nine minutes.
20;8;Cartman;Excuse me, Mr. Musk, this is all super interesting and shit, but can we see the Mars rocket now?
20;8;;Meanwhile, at the Pentagon...
20;8;Staffer 1;Sir, India is moving aircraft carriers into the Gulf of Mexico.
20;8;Garrison;Well why would we care about Mexicans?!
20;8;Staffer 2;[in winter fatigues] Sir, a message from Saudi Arabia. They say they pinky-promise not to look up our Internet history if we pinky-promise not to look up theirs.
20;8;Garrison;Well what does that even mean?!
20;8;Staffer 3;[in winter fatigues] Still waiting on if we should send troops into Japan, sir.
20;8;Garrison;I don't know, jeez!
20;8;First general;Sir, it's the UK Secretary of Foreign Affairs calling from London. He says they have advice for you.
20;8;Garrison;What?
20;8;Boris Johnson;Yes, hello? Things aren't looking good here. We just want to say, whatever you do, don't eat the membberries.
20;8;UK aide;[overhearing] Don't eat the membberries. They are bad.
20;8;Garrison;Memberries?
20;8;Boris Johnson;I'm afraid everyone here who ate the memberries wanted to go back in the past, you see. Hasn't worked out too well for us.
20;8;UK aide;We shouldn't have ate the memberries!
20;8;Boris Johnson;The memberries cloud your judgement. They get inside your head, you see.
20;8;Garrison;Get inside your head... Wait a minute... Nobody gets in my head, you limey bitch! Are you insulting me?! Stop wasting my time! 'Cause I'll have you here on a plane in five hours suckin' my dick!! [slams the phone down on the receiver]
20;8;UK aide;What'd he say?
20;8;Boris Johnson;I believe they've eaten the memberries.
20;8;UK aide;Ooh, dear!
20;8;UK aide 2;Ooh, dear!
20;8;;SpaceX tour, day. The tour is winding down.
20;8;Elon Musk;Here you see our Falcon 9 full-thrust rockets. They are actually able to take off into space and land safely back on Earth for reuse. [the group moves back to the lobby] Well, I certainly wanna thank you all for joining our tour today. You've been a wonderful group. Give yourselves a round of applause.
20;8;Groups;Huh?
20;8;Cartman;Whoawhoawhoawhoa, what about going to Mars?
20;8;Elon Musk;Mars? We're still about ten years away from going to Mars. Maybe eight.
20;8;Groups;Awwww.
20;8;Cartman;No, no nonono, we have to go now!
20;8;Elon Musk;Well I'm sorry, but it's a bit more complicated than a pizza pocket. Going to Mars is gonna take a lot of very smart people working very hard for a very long time. Now, if you don't mind, I have hundreds of more tours to do. [turns to exit the lobby]
20;8;Butters;Mr. Musk, wait! [Musk turns around] Maybe we can help you get to Mars sooner. I'm not sure if you know our friend, Heidi. She's really smart, and really funny. [Cartman flashes an angry face at Butters]
20;8;Elon Musk;Like... how funny?
20;8;;"The White House. Some member berries have formed a group and are performing ""Africa"". A vintage car horn is heard and the mob boss arrives with some henchmen. ""Sing Sing Sing"" blares from the radio."
20;8;Don;Out of the way, 'member?
20;8;Berry Henchmen;You'd better 'member if you know what's good for youse! [the car moves through the crowd, down the corridors and into the Oval Office]
20;8;Memberberries;Hey look, it's them. 'Member? Sure, I 'member. [the mobster berries get out of the car]
20;8;Don;Ey, youse did good. Who's in charge, 'member?
20;8;Memberberry 3;We decided he's in charge.
20;8;Memberberry 1;No, we said I'm in charge, 'member?
20;8;Memberberry 4;No wait, I 'member. We all said he's in charge. [leans to the left]
20;8;Memberberry 2;Oh yeah, I 'member.
20;8;Don;Wrong. [shoots Member Berry 2 clear through. Member Berry 2 collapses and bleeds out green juice]
20;8;Memberberry 3;Waaah!
20;8;Don;'Member stormtroopers?
20;8;Memberberry 2;Sure, I 'member.
20;8;Don;Not those stormtroopers! The real old ones. People wanna 'member? They're gonna 'member.
