20;8;;The Broflovski house. Kyle comes home from school and is about to go upstairs when he sees Ike in a corner, in time out. Ike has his head against the wall.
20;8;Kyle;Ike? [Ike looks back at Kyle, then puts his head on the wall again] What are you doing?
20;8;Sheila;Don't talk to him! He is in big trouble!
20;8;Kyle;Well what'd he do?
20;8;Sheila;It's him, Kyle! Your brother is the internet troll who's caused all this pain in our community!
20;8;Kyle;What?
20;8;Sheila;It was him all along. Now we have to figure out what to tell people when they learn this ugliness came from our family. [walks back into the kitchen]
20;8;Kyle;You made people quit Twitter? You started a war between boys and girls? You...?
20;8;;Kyle stops and thinks back to the clues he's heard in recent days.
20;8;Heidi;"I call it ""Emoji Analysis"". It isn't a student, it's an adult."
20;8;Sheila;This ugliness came from our family!
20;8;Heidi;I think it's one of the parents.
20;8;Gerald;You're suppose to just laugh and make fun of shit.
20;8;Ike;Daddy called you a pussy.
20;8;Kyle;[stops thinking back] Oh my God. Oh my God! Ike, come on! [grabs Ike's hand and rushes out the front door with him. Sheila hears the front door open and looks around for her boys. She reaches the open front door]
20;8;Sheila;Kyle? Ike?! Whatwhatwhaaat?! [her voice echoes around the neighborhood]
