6;17;Santa;[with a gun on each arm] Come on, kids! [turns around and rushes up the stairs. The kids follow]
6;17;;The building's rooftop. Santa leads the boys out while firing at the pursuing Iraqi soldiers.
6;17;Santa;Get to the sleigh! Get to the sleigh! [the boys run by screaming as Santa mows the soldiers down with both semiautomatics. More soldiers pour out, more bodies pile up. The boys sit down in the sleigh, and Stan and Kyle take the reins]
6;17;Mr. Hankey;Start the sleigh!
6;17;Stan;Uh, on Steven, on Fluffy, on Horace, on Chantel. Uhh...
6;17;Kyle;On Skippy, on Rainbow, on Patches, on Montel. [the sleigh begins to move forward and Santa runs out of ammo. He drops the guns and heads for the moving sleigh. He hops in and the remaining soldiers fire at the departing sleigh. The sleigh goes up and away]
6;17;Cartman;Look at me, I'm riding high in Santa's sleigh. It's Christmas special time for me-
6;17;Kyle;Oh shut up, Cartman! Your Sweet Christmas act isn't fooling anybody!
6;17;Cartman;Eh, it's not an act, Kyle! All I wanted was for these people to understand what Christmas means.
6;17;Santa;You're right, kid. [turns the sleigh around]
6;17;Mr. Hankey;What are you doin', Santa?
6;17;Santa;I came to bring Christmas to Iraq and by God I'm gonna do it! [presses a button on his dashboard.]
6;17;;"Panels on either side of the sleigh body open up to reveal bombs and a controller rises up in front of Santa. He releases the reins and fires a rocket. It heads for a building and Iraqis move out of the way. It hits its target, but instead of destroying it, the bomb decorates the building in Christmas cheer. Strings of lights decorate the windows and a Christmas tree appears at the door. ""Joy To The World"" plays as snow comes down from the sky. The Iraqis approach in wonder."
6;17;Santa;Hohoho! Merry Christmas! [the sleigh sails above a street and Santa strafes the buildings on either side with more bombs. Each of the buildings is decorated with lights and Christmas trees, and presents appear under the trees. The sleigh goes down another street and bombs another building. It too is decorated]
6;17;Soldier;[directing another soldier with a bazooka ready to fire] Dakadaka!
6;17;Stan;RPG, four o'clock!
6;17;;Santa activates a laser, which rises over the boys and fires at the soldier's bazooka. It becomes a giant candy cane. The soldiers are surprised. Santa fires at a group of people holding baskets of bread and a woman holding a chicken. The baskets become gifts, while the chicken becomes a large gingerbread man. A rifle in one man's hands becomes a Christmas wreath.
6;17;Mr. Hankey;Boy, things are starting to look Christmasy now!
6;17;Santa;Merry Christmas! Hohoho!
6;17;;Santa makes another pass down a decorated street and drops five more bombs. They leave behind five snowmen. The Iraqis are surprised and confused by all these presents. The kids are terribly pleased with theirs.
6;17;Santa;Merry Christmas to all, and to all a good night! Hohohohoho!
6;17;;South Park City Hall. Jimmy is still singing Twelve Days of Christmas. The mayor's assistants are asleep and the mayor is getting sleepy.
6;17;Jimmy;And a p-p-par-tridge in a p-peeeaaar treeee. [a moment of silence follows. No more is heard from Jimmy]
6;17;Mayor McDaniels;That's it? That's it! The song's over! We can light the tree! [heads for the dais. Her aides follow. The townsfolk rouse themselves.]
6;17;Townsfolk;[cheering heartily] Hurrah! Woohoo! Yay!
6;17;Jimbo;Oh, finally!
6;17;Mayor McDaniels;Go on, Jimmy! There's only five more seconds until Christmas! [hands him the detonator by which to light the tree. The townsfolk are glad with anticipation, making fists. Jimmy lowers the trigger, the tree lights up and goes dark, and then a bulb explodes]
6;17;Townsfolk;Awwww!
6;17;Randy;Christmas is ruined again! [they begin to disperse, but jingle bells stop them in their tracks]
6;17;Santa;[heard over the jingle bells] Ho ho ho! [Santa flies over the gathering and drops a bomb on the tree. It blazes forth with bright lights]
6;17;Townsfolk;WOW!!! [cheering and applause follow. The sleigh lands and the occupants disboard]
6;17;Randy;Stan!
6;17;Sheila;Kyle!
6;17;Kyle;[runs up to his parents] Mom! Dad! We rode on Santa's sleigh!
6;17;Stan;[runs up to his parents] We brought Christmas to Iraq!
6;17;Santa;"[approaches the dais] Everyone! Everyone, can I please have your attention? [Cartman approaches his mom; they hug each other] Christmas is a very special time of year, but... this year it almost didn't happen. There's a man named Jesus who gave his life to save me. And so I declare that every year on Christmas Day, we should remember Jesus for what he did, and thank him for it. From now on, Christmas will be a day for remembering a brave man named Jesus."
6;17;Townsfolk;[cheering heartily] Hooray!
6;17;Santa;Now, if you'll all excuse me, I've got a lot of work to do. [leaves the dais]
6;17;Mr. Hankey;I'll help you, Santa!
6;17;Santa;[gets into his sleigh and looks over at the boys] Oh, and boys, you might want to check under the Christmas tree. [the boys are surprised, then happy. Stan leads them to the presents. Santa takes the sleigh off the ground and away] Ho ho ho! Merry Christmas! [the boys reach their presents and check them over. For a moment they look like the Iraqi kids. Their looks change back to normal as they rip off the wrapping. They all get the same gift]
6;17;Stan;Wow! Look, you guys! Santa got us all Haibo dolls! [Cartman's joy vanishes]
6;17;Cartman;Oh, God-damnit!
6;17;Kyle;Cartman, I thought all you wanted was a Haibo doll!
6;17;Cartman;Yeah, but not if you guys have one, too! Now it's worthless and gay! God-damnit I'll never try to be nice again! [kicks the toy away. The camera zooms out enough for a fourth person to walk into the shot]
6;17;Stan;Well, all in all, I have to say this was a pretty special Christmas. [Kenny walks into the frame.]
6;17;Kenny;(Hey guys. What's goin' on?)
6;17;Stan;Oh, hey Kenny.
6;17;Kyle;Dude, where have you been?
6;17;Kenny;(Oh, I've just been hanging out.)
6;17;Kyle;Well come on! We gotta tell you what happened. I'm sure glad it's over with. [walks away with his Haibo doll. Stan follows with his Haibo doll, and Cartman follows with an angry look]
6;17;Stan;Yeah, but I feel like things are finally back to normal.
6;17;Kenny;(Yeah.)
