6;3;;Commercial.
6;3;Cartman;Wha'evah! Wha'evah! [walks up to a seat next to his mom's and sits there] Maury, my mom can't control me, I'm tough! Go on, aks hurh!
6;3;Maury;Ms. Cartman, what does your son like to do?
6;3;Liane;Ooo, he loves playing with his Clyde Frog and Wellington Bear.
6;3;Cartman;[under his breath] Mom, we're pretending, remember? Sex and drugs.
6;3;Liane;Oh, I mean, sex and drugs.
6;3;Studio audience;Oooohhh!
6;3;Cartman;[hops off his chair and tries the audience] What-evah! What-evah! [snaps his left-hand fingers back and forth] I'll do what I waunt!
6;3;Vanity;Oh, what-evah. You ain't tough, ho! I roam with gangs!
6;3;Cartman;Oh yeah?! I roam with twelve gangs! And we only commit hate crimes! What-evah! I'll do what I waunt! [sits back down]
6;3;Vanity;What Evah! You ain't bad! You ain't nothin'! I ditch class and go shoot heroin in the school bathroom!
6;3;Cartman;What-evah! I ran for Congress and won. Then I had sex with an intern, killed her, and hid her body! What-evah, I'll do what I waunt!
6;3;;"Outside the building, the freaks have gathered and are now on strike - ""FREAK OUT 2K2""."
6;3;Man with terrible skin condition;What do we want?
6;3;The Freaks;Better prizes!
6;3;Man with terrible skin condition;When do we want them?
6;3;The Freaks;Now!
6;3;Man with terrible skin condition;What do we want?
6;3;The Freaks;Better prizes!
6;3;Butters;[muttering along] Better prizes.
6;3;Man with terrible skin condition;When do we want them?
6;3;The Freaks;Now!
6;3;Butters;Never. [approached the Man with Terrible Skin Condition] Sir, I really gotta go home. My parents are gonna be sore at me.
6;3;Man with terrible skin condition;Napoleon, you need to understand something: for a union to work all members must be prepared to make sacrifices and stick together.
6;3;Butters;But I gotta get back to my family.
6;3;Man with terrible skin condition;[drops his sign and drops on one knee next to Butters] We're you family too, Napoleon. We're like you. When we look at you we don't even see the testicles on your chin. We see the testicles in your heart. [back to the freaks] What do we want?
6;3;The Freaks;Better prizes!
6;3;Man with terrible skin condition;When do we want them?
6;3;The Freaks;Now!
6;3;Butters;Aw. hamburgers, this just keeps on gettin' worse. [joins the others in the strike. Several police cruisers pull up and police pour out of them]
6;3;Police captain;Okay folks, we're gonna have to move along.
6;3;Man with foot on head;Why? We're a union and we have a right to picket.
6;3;Police captain;I'm sorry, but the government does not recognize you as a union. You'll have to go.
6;3;Middle Dwarf;What are you saying? That because of our appearance our organization is less important?
6;3;Police captain;Now now now, I'm not telling you people that your union doesn't matter, I'm just telling you that you're not really... people.
6;3;Man with foot on head;...Alright, that does it! It's time to bring out the big guns! Prepare the video sabotage!
6;3;Butters;Oh no, not the video sabotage, uh.
6;3;;Maury Povich show, back to out-of-control-child segment.
6;3;Announcer;Who is the most out of controlled child? We're back with Maury.
6;3;Maury;We're here, talking with moms who think their children are out of control.
6;3;Vanity;What evah!
6;3;Cartman;I slaughtered five baby seals with my bare hands. What-evah! I'll do what I waunt!
6;3;Maury;[walks to the third woman on the panel] Now let's meet Joline. Joline says that her daughter is also out of control, that she's flirting with older men, and, she's only four months old.
6;3;Studio audience;Aawwww.
6;3;Joline;Mmhmm, that's right Maurih.
6;3;Maury;Let's bring her out: here's Chantal! [Chantal crawls out amid audience boos. The camera focuses on her diaper. Chantal reaches Joline, who picks her up and sits her on the chair next to hers] So Joline, exactly how is your daughter out of control? You say she flirts with older men? [Chantal plays with her rattle]
6;3;Joline;Maurih, it's like this: Whenever I have friends over to the house Chantal will come waltzin' in the livin' room completely naked!
6;3;Studio audience;Ooohhh!
6;3;Vanity;Whatevah. I helped in a drive-by shooting.
6;3;Cartman;What-evah. I digitally put Jabba the Hutt back into the original Star Wars movie! I'll do what I waunt!
6;3;Maury;Wow, that is out of control!
6;3;Joline;Why, just last night I had three gentlemen callers over to my house, and Chantal took her clothes off right in front o' everybody!
6;3;Studio audience;Boooo! [Chantal drops down and starts wiggling.]
6;3;Joline;You see? [Her diaper drops, then her top.] There she goes. There she goes. [Chantal shows her butt to the audience] OH! YOU GOD-DAMNED WHORE!
6;3;;The screen behind them sputters and changes. The Maury Povich logo disappears.
6;3;Man with foot on head;[appearing] Attention Maury viewers.
6;3;Maury;What the hell is this? [another image replaces the one of Man with Foot on Head]
6;3;Elephant man;"A lot of decent hard-working freaks in America are losing their talk-show jobs to freaks of a different nature. Sure, everyone in this great country of ours is a freak, but true, physically deformed freaks must be recognized, for it's these real freaks that make you all feel better about yourselves for not being one. So next time you're watching television, make sure it's a show with ""freak"" freaks, and not just with people that are freaks because they're stupid trailer trash from the South. That's what we mean when we say, ""Look for the True Freak label"" [his image fades to that of the True Freak label]"
6;3;Butters and the Freaks;"[Butters sits atop a True Freak label box and starts off] Look for the True Freak label
[four freaks join in] When you are watching a TV talk show
[a side shot of more freaks streaming their way to the box] Remember somewhere,
[a shot of the audience] our union's growing
[a front shot of the freaks walking in] Our wages going to feed the kids.
[a front shot of more freaks walking in] And run the house-
We work hard, but who's complaining?
[a zoom-out shot as the freaks crowd in around Butters] With TFU we're making our way!
[a pan shot] So always look for the True Freak label,
[a full crowd shot] Because you need us right here in the U.S.A.!
[the Maury Povich logo is restored]"
6;3;Maury;Ah, sorry America, a little glitch there, heh. Anyway-
6;3;Man;They're right. We should have never crossed that picket line. Come on, honey. [takes her hand and leads her out. Other audience members begin to grouse and leave]
6;3;Maury;[pleading] Wait! Come back, uh-... Maybe we can make the other out-of-control kids take... their clothes off, too!
6;3;Cartman;[hops off his chair and steps forward] Whatevah! I'll crap in Maury's pants! [more audience members leave]
6;3;Cameraman;Sir, the ratings have just started to plummet.
6;3;Maury;Ah, those damned freaks! [throws his microphone against the back wall and heads for the exit]
6;3;;Outside the Maury Povich studio. A door opens and Maury steps out. The freaks stop and wait.
6;3;Maury;I gave you shoes! And groceries! And this is how you repay me?! [the freaks simply look back at him] Very well. Just come upstairs and... we'll negotiate! [goes in and slams the door shut. A few seconds later the freaks cheer their victory]
6;3;Man with foot on head;We did it! The strike worked!
6;3;Man with terrible skin condition;Now we can go on with our careers!
6;3;Butters;Whoa, thank God that's over. Now I can get back home. [drops his sign and moves off. An angry Cartman catches up to him]
6;3;Cartman;Butters, you have screwed me out of a prize for the last time! [rips the balls off Butters' chin. The freaks react immediately and fall silent]
6;3;Butters;Oh. Double hamburgers.
6;3;Man with foot on head;Jesus Christ! That out-of-control kid ripped poor Napoleon's balls right off!
6;3;Incredibly obese black man;Get him!
6;3;Cartman;Aaahh! [three freaks trail behind with a boiling pot of water]
6;3;Incredibly obese black man;Get him! Get him! [the freaks charge at Cartman, who runs off in fear]
6;3;Butters;Hey. Things actually turned out... okay for me this time. [a taxicab pulls up and screeches to a halt]
6;3;Stephen;[quickly exits the cab with Linda] Butters!
6;3;Butters;[anticipating] Oh I know.
