8;12;Butters;[bolts out of the closet] HAAAAH! [Bab looks out from the closet, grinning]
8;12;Mr. Slave;Hon, will you just tell these girls that being a whore isn't such a great thing.
8;12;Paris;What isn't great about it? What's more to life than partying?
8;12;Mr. Slave;Look girls, I've partied a lot. Okay? And I'm telling you, there's more to life.
8;12;Paris;You don't even know what partying is, loser. [brushes him off]
8;12;Mr. Slave;Sweetie, really, don't go there, okay?
8;12;Paris;Oh I went there. I went there, took some pictures, and flew back already.
8;12;Girls;Ooooo!
8;12;Annie;Wow, what a bitch. [smiles]
8;12;Mr. Slave;"Sweetie, listen, I know you've done some ""partying"" in your private little rich life, but you don't even wanna know the kind of stuff I've done. I'm the real whore, and I'm telling you, it isn't great."
8;12;Paris;Oh yeah?! I challenge you to a whore-off!
8;12;Girls;Ooooo!
8;12;Men;[popping up out of nowhere] Whore-off! Whore-off!
8;12;;South Park's Whore-off. A gazebo is set up for the event in South Park Square. A crowd gathers.
8;12;Official;"Ah, testing? Hello? [taps the mic a few times] Okay uh, welcome everyone. Uh, the South Park Chamber of Commerce is pleased to bring you the first annual ""Who Is The Biggest Whore"" showdown. [the crowd cheers]"
8;12;Bebe;Mr. Slave has no idea what he's in for.
8;12;Red;Paris is gonna rock his world.
8;12;Official;Ah, I'm... not quite sure how we... start this competition off, but uh-
8;12;Paris;[gets off her chair and walks over to the mic] I'll show ya how we start it off. [the music starts and she kisses him hard and grabbing his crotch]
8;12;Crowd;Ohhh! [the girls are grinning, Wendy looks at the girls' reactions. Paris then has five men on stage with her, and one of them is licking her leg. Mr. Slave simply observes]
8;12;Wendy;[approaches Stan and friends, and Mr. Garrison] What is Mr. Slave doing? He-he's just sitting there.
8;12;Herbert Garrison;Give him time, Wendy. Give him time. [cheers him on softly] Come on, Mr. Slave.
8;12;Paris;[throws the men off] Back off! None of you losers are enough for me! [whips out a pineapple from behind her back and stuffs it up her vagina] Eeeaaagh. Oh yeah. Aaaargh. [some gasps] Tada! [the crowd cheers and fireworks go off]
8;12;Randy;Oh, no she di'int. [the crowd continues cheering]
8;12;;Mr. Slave makes his move: he gets off his chair and walks over to Paris, then moves her around till he's satisfied she's where he wants her to be. The crowd falls silent and Mr. Slave walks back to his chair.
8;12;Mr. Slave;"[dusts himself off and coughs] Jesus. [takes off his pants and takes a running leap towards Paris. He lands on her head and proceeds to swallow her up through his ass, with each swallow accompanied by a grunt. The first swallow takes her head; the second, her chest; the third, her abdomen and lower back; and the fourth takes the rest of her body.] Ohoho, Jesus. [the girls are stunned at what they just saw. The adults, the boys, and Wendy all cheer]"
8;12;Herbert Garrison;Now, that's a whore! [Stan and friends are still stunned. Mr. Slave goes back to his chair and puts on his pants]
8;12;Bebe;Wow, I guess Paris isn't such hot shit after all.
8;12;Mr. Slave;People, don't applaud me. I'm a dirty whore. [the crowd falls silent] Being spoiled and stupid and whorish is supposed to be a bad thing, remember? Parents, if you don't teach your children that people like Paris Hilton are supposed to be despised, where are they gonna learn it?! You have to be the- [feels something in his stomach] ooohooho, Jesus Christ. You have to be the ones to make sure your daughters aren't looking up to the wrong people.
8;12;Mr. Stevens;The homosexual is right. From now on, Bebe, you're going to dress like a little girl. [the crowd disperses and the girls walk up to Wendy]
8;12;Bebe;Wendy, we're sorry we called you names. Like not-stupid and not-spoiled.
8;12;Red;Yeah, and I didn't mean to say you weren't a whore.
8;12;Wendy;That's okay, you guys. [Butters and his family are shown next]
8;12;Chris;So-so that's it? No two hundred million dollars? Well, Butters, I hope you're happy!
8;12;Butters;[turns right and walks away] I'm a bad bear. I'm a very bad old bear.
8;12;Chris;You're a grounded old bear.
8;12;;Deep within Mr. Slave's intestine, Paris is trying to claw her way out.
8;12;Paris;Oh my God, it's so gross! Let me out of here! [a light comes on in front of her - it's the Frog King] What the fuck is that?
8;12;Frog King;Paris, you must find the way out of this place or you'll surely die.
8;12;Paris;What?
8;12;Frog King;Make your way to the small intestine. There you will meet the Sparrow Prince, who can guide you to Catatafish. Now go, Paris Hilton. Make haste! [disappears]
8;12;Singers;"[End of Stupid Spoiled Whore Video Playset. Some singers sing the following song as Paris begins her journey]
A great adventure is waiting for you ahead.
Hurry onward Paris Hilton or you will soon be dead.
The road ahead is filled with danger and fright
But push onward, Paris Hilton, with all of your might.
Paris Hilton... Paris Hilton, Paris Hilton
Paris Hilton... Paris Hilton, Paris Hilton
Paris Hilton... Paris Hilton, Paris Hilton
Stupid whore!"
