8;13;;Park County Police Station, night. Montage. Yates types away at his computer, then analyzes his left hand again, then returns to the keyboard. He then goes to the lab and looks over his notes. Next to him are two hands, one right and one left. He rotates the right hand so both thumbs point to the left, from his POV, then takes more notes. He develops some pictures in the darkroom and finds matching hands. He works with a 3D model drawing with another computer, then traces his left hand on a wall and takes measurements. He returns to the lab and works with some chemicals. Next he chops some firewood into smaller chunks. Next he's at a gym jumping rope. Next he's at a beach far from South Park playing volleyball with some women. Next he's repairing the body of a car with a welding torch...
8;13;Yates;[back at the station, looks in on Murphy] Murphy, do you remember what I was supposed to be doing?
8;13;Murphy;Oh. Uhhh... Oh. Something about hands, sir? Uh, for the serial killer?
8;13;Yates;[snaps his fingers] Oh right! The hands! Right! [the montage resumes]
8;13;;Again he goes to his computer and types away then he's back at the lab taking pictures of the two fake hands there, then makes silhouettes of a dog, then models another hand in the computer and gets a match.
8;13;Yates;Oh my God. Murphy! [Murphy appears quickly.] You're not gonna believe this.
8;13;;Michael Deets house, basement. Michael Deets has resumed showing his pictures to Cartman. A picture of him at Ocean World's Splash Zone is shown, then a blank. He turns the projector off.
8;13;Michael Deets;That's it, no more pictures. [walks in front of Cartman and faces him, then pulls out a sharp knife] Time to die.
8;13;Cartman;No, please! I'm sorry I gave other people credit for your killings. Ahah, it was, it was very wrong for me to lie about the other psychics and get them arrested.
8;13;Michael Deets;Your hand will be one with the others.
8;13;Cartman;Please just let me go! Ah, I'm gonna tell everyone I'm not really psychic! I've learned my lesson! Please, I don't wanna- [spots the detectives descend the stairs and approach the room] I don't wanna have to use my psychic mind missile on you! [begins to concentrate and make noises]
8;13;Yates;Hold it right there, killer! [Michael Deets turns and rushes at them with the knife. Yates fires three shots into him, killing him. The detectives advance, and Yates fires a forth shot into the body, looks around, and fires a fifth shot, getting blood splattered on himself]
8;13;Cartman;You got here just in time. He was gonna kill me because he was insanely jealous of my incredible psychic ability.
8;13;;Hell's Pass Hospital, day. The detectives, the psychics, Mr. Johansen, Dr. Docter, Cartman, Stan, and Kenny are present.
8;13;Yates;Well young man, you did an amazing thing. Not only did your psychic visions help us catch the killer, but a lot of innocent people are out of jail.
8;13;Tom Johansen;Yes, thank you very much, Kyle.
8;13;Female psychic;Yes, thanks.
8;13;Murphy;You're certainly a better psychic then Eric.
8;13;Kyle;No, don't you see? Cartman never had psychic visions. And neither do these people. The plain simple truth is that nobody is psychic. There's a logical explanation for every psychic story you've ever heard.
8;13;Murphy;Do you think that's true?
8;13;Yates;It must be true. The kid is psychic. [thinks a moment] But I don't suppose it really matters much. Because in the end, the way I caught the killer was with... good old-fashioned police work. Come on, Murphy. [they leave the room and then the hospital]
8;13;Female psychic;[addressing Cartman] Well young man, I guess that just leaves one score to settle.
8;13;Cartman;You can't hurt me.
8;13;Male psychic;Then let this be our final battle! [the psychics face Cartman once again and battle him with their power. Nothing happens, but there's a lot of noise.]
8;13;Kyle;[irritated] Just stop it! [at the top of his lungs] Stoop iiit!! [the lights go out as the bulbs shatter, then the shelf above his bed falls and everything on it hits the floor. The psychics and Cartman stop their battle and witness all this] There's a logical explanation for that.
