8;6;Stan;You just gotta pretend you're Blanket until we can get the real Blanket somewhere safe.
8;6;Kenny;Aren't I too big to be Blanket?
8;6;Kyle;[seething as he climbs the ladder] I don't think Mr. Jefferson pays enough attention to his son to notice. Come on! [Stan and Kenny follow]
8;6;;Blanket's bedroom. Blanket silently cries and the door creaks open.
8;6;Stan;Blanket, you in here?
8;6;Blanket;[excited] Hi guys!
8;6;;Stan, Kyle, and Kenny spread out and hop onto Blanket's bed.
8;6;Kyle;Shh, Blanket, we're gonna take you away for a little while, okay? [Kenny looks around]
8;6;Blanket;You are? Oh, thank you, thank you, thank you!
8;6;;Kyle whisks Blanket away, Stan motions Kenny into place.
8;6;Stan;All right dude, get in his bed.
8;6;Kenny;[gets under the covers] All right, but you guys owe me for this.
8;6;Stan;Dude, whatever. At least you finally get to do something. [hops off and leaves]
8;6;;Santa Barbara Police Department, Snetzl's desk. His phone rings and he picks it up.
8;6;Snetzl;Santa Barbara Police Department, this is Snetzl.
8;6;;Park County Police Department, Yates' desk.
8;6;Yates;Hello, this is Sergeant Yates over at the Park County Police Department in Colorado.
8;6;Snetzl;Yes, sergeant. What can I do for you?
8;6;Yates;Well, we've been trying to frame this guy who just moved into our town, and the fil-o-fax says he moved from your area. One Martin Jefferson?
8;6;Snetzl;Hm. No, we never had any rich African-Americans named Jefferson here. If we had, we would have framed him ourselves.
8;6;Yates;Well, he doesn't really look that black.
8;6;Snetzl;Yeah, I don't, uh... Hold on a second. There was one we framed a couple of times, but the black bastard was so rich he made bail and disappeared before the trial.
8;6;Yates;You say he disappeared? What did you frame him for?
8;6;Snetzl;We, uhhh, found some kids that had stayed over at his place, and we asked them to lie and make up some false molestation charges.
8;6;Yates;Molestation, nice.
8;6;Snetzl;Yeah, it was a lot of work. Took years, but we were finally able to arrest him. Then we planted some evidence, took embarrassing photos of his penis, and threw him in a dirty prison cell with feces on the walls. You should have seen him squirm!
8;6;Yates;That's damn fine police work, sergeant. Damn fine.
8;6;Snetzl;Heh, yeah, but the point is this guy didn't really look black either. We had to sneak in while he was asleep and get a DNA sample to be sure.
8;6;Yates;[rises from his chair. Other officers draw near] Jesus Christ Monkeyballs! It must be the same guy!
8;6;;The Jefferson house. Cartman knocks on the front door again.
8;6;Cartman;Mr. Jefferson, hello?!
8;6;;The bathroom. Stan, Kyle, and Blanket prepare a carry-on bag.
8;6;Kyle;Come on, Blanket! We gotta go before your dad sees us.
8;6;;They turn towards the window next to the tub and head to it. Michael appears behind them.
8;6;Michael;What are you doing with my Blanket?
8;6;;The boys freeze. Kyle turns around and sees a disjointed, disheveled Jefferson in a Thriller outfit. The camera does a vertigo effect. Michael walks up to the boys.
8;6;Michael;Come on, Blanket, play with me. Jeechabee durtah! Hee! [an outstretched arm]
8;6;Stan, Kyle, Blanket;Haaaaa!
8;6;Stan;Go, go, ruuun! [the boys run out of the bathroom]
8;6;Mr. Jefferson;[whispers as he walks] Sutah!
8;6;;The Hallway. The boys run towards the stairs.
8;6;Stan, Kyle, Blanket;Haaaaa!
8;6;Michael;[rounds a corner onto the hallway] Wuchatennah! Jamonah! Heehee!
8;6;Stan;[The boys enter Blanket's room] Oh Jesus!
8;6;Kenny;What the hell is going on, you guys?
8;6;Michael;[enters and heads for Blanket's bed] My Blanket! Let's play, Blanket! [pulls Kenny out of the bed]
8;6;Kenny;Nonono wait, I'm not Blanket!
8;6;Michael;[tossing Kenny up into the air] Wee, he can fly! He can fly!
8;6;Kenny;Aaaah! Aaaah, stop! A-
8;6;;Kenny's head goes through the ceiling and blood runs down his body. It begins to drip from his feet.
8;6;Stan;Oh my God, he killed Kenny!
8;6;Kyle;You bastard!
8;6;;Michael turns around and sees the boys.
8;6;Michael;Blanket? Blanket! Come play! [slowly approaches the boys]
8;6;Blanket;Nooo! [Stan turns to leave]
8;6;Kyle;[grabs Blanket's hand and leaves as well] Come on!
8;6;;The Jefferson house, front lawn. Kyle opens the front door and the boys exit.
8;6;Stan;Run, Blanket, Run!
8;6;Blanket;[stumbles] Ah!
8;6;Michael;[exits] Dainduh! Dainduh Dainduh!
8;6;Kyle;[Kyle and Stan help Blanket up] Hang on, Blanket!
8;6;;The three run off and a floodlight turns on, blinding Michael.
8;6;Mr. Jefferson;[shielding his eyes] Dugh! Heehee! Ja-!
8;6;Yates;[through his bullhorn] Freeze, Jefferson! The gig is up! You are wanted for child mo-les-tation!
8;6;Cartman;[hops to Mr. Jefferson's defense, standing in front of him] No! I am sick and tired of people harassing Mr. Jefferson! [a crowd, including the boys' parents, gathers] All I've been hearing since Mr. Jefferson moved here are sick lies! That he molests children, that he's a bad father, that he has plastic surgery!
8;6;Michael;It's ignorant.
8;6;;His lower jaw literally drops to the ground. He bends down, picks it up, and pops it back in place.
8;6;Cartman;Sure, maybe Mr. Jefferson's a little different. But that's because he had to work all the time when he was young and missed out on his childhood. What's wrong with wanting to have the innocence and beauty of a child?
8;6;Kyle;[returns with Blanket] All right, let's just say all the bad things said about Mr. Jefferson are lies! Let's say the police department does just go around spending their time framing people for crimes they didn't commit! Let's say it's all made up, and Mr. Jefferson is just a nice guy who's trying to be a child because he never got to have a childhood. Well that's fine, except for that he HAS children now! And when people have children, they have to grow up!
8;6;Michael;[closeup for a few seconds] You're right. I've been so obsessed with my childhood that I've forgotten about his. I thought having lots of rides and toys was enough, but... Blanket doesn't need a playmate. He needs a father, and a normal life. Chickuckoo gainuh. [genuflects behind Blanket] Blanket, I wanna give away all my money. I- I wanna get a normal job and... take a shot at raising you in a normal setting.
8;6;;Blanket removes the ornate mask, and Blanket blinks while shielding his eyes. Blanket moves over to his friends.
8;6;Blanket;Look everybody! I'm a normal little boy.
8;6;Yates;[approaches with Harris] Well, if you're gonna give away all your money, then, I guess we can drop all those charges. No point in putting another poor black man in jail.
8;6;Kyle;All right! Things just might work out!
8;6;Michael;Things can always work out, as long as we know we have the power to change.
8;6;;Music begins to play as the neighbors and officers gather around him.
8;6;Michael;"We all have the power to change if we search inside our hearts
And we start to heal the wounds of all our yesterdays
And you know it might be hard, but all you've got to do is start,
And you can change all of your evil molesting ways.
Jejabee durtah! Hee-hee! OOOOH! Jejabee durtah! Hee-hee! Jamonah! butcha-tamonah! Chich-cha!"
