19;5;Butters;[thinks a moment and jumps through a glass window on the second floor] YEEAAAAAGGHH! [hits the snow hard]
19;5;;South Park Community Center, Night, Shameless America Charity Event. Guests arrive in limousines. Gerald steps out of one and goes inside. Randy is hosting. Fanfare plays
19;5;Randy;Alright everyone, thanks for coming to help raise money to stop shaming, and put hamsters through college.
19;5;Guest;What'd he say?
19;5;Randy;And now, a woman who knows about shaming firsthand, supermodel Gigi Hadid.
19;5;Gigi;Alright, everyone enjoying themselves? How's that filet mignon? [approving comments all around] You know, we're all here for a really important reason. Because everyone should-
19;5;Stephen;Randy, Randy, we've got a problem.
19;5;Randy;What?
19;5;Stephen;Reality's here. He's trying to crash the party.
19;5;Randy;Reality? Who let him in? Shit! [leaves to face him]
19;5;Reality;[making a nuisance of himself at a table, spills a glass of wine] Woo, nice wine, huh? What do you think of that? [tips another glass over] You know what I think of your pretty flowers? [grabs the centerpiece bouquet and throws it to the ground, then dumps a guest's dinner on his lap] There you go. How do you like that? [Randy and Stephen arrive]
19;5;Randy;Alright buddy, let's go.
19;5;Reality;I shit on all of you!
19;5;Randy;Seagal?! [Steven Seagal approaches with gun drawn and aimed at Reality]
19;5;Reality;"[to Seagal, Randy, and three guests] Fuck you, fuck you, fuck you, fuck you, fuck you! [jumps over the table and rushes the stage, then grabs the mic from Gigi Hadid] Give me that, you stupid bitch! [she walks off] What a lovely charity event. I suppose you're all feeling pretty good about yourselves, hm? What have you done? You've raised $300 by spending half a million on filet mignon and crystal glasses. [crowd is silenced and ashamed at themselves] Look at you, Vin Dipshit. You think fat-shaming is wrong, so in response you show off your abs. You're the one fat-shaming, idiot! What's the matter with you people?! You're saaad that people are meeean? Well I'm sorry, the world isn't one big liberal arts college campus! We eat too much; we take our spoiled lives for granted, feel a little bad about it sometimes! No, you wanna put up all your shit on the Internet and have every single person say ""Hooray for you!"" Fuck you. You're all pricks. And I've got news for you! While you've all been sitting here trying to feel good, the little boy who sucked all your shit is about to die from it!"
19;5;Seagal;What?
19;5;;Hell's Pass hospital, later. Butters is in a recovery room with tubes going into him and wires attached to him. Steven Seagal and Vin Diesel are there with the plus-sized models, Demi Lovato, Gigi Hadid, PC Principal, Stephen, and others
19;5;Demi Lovato;Oh my God. What have we done?
19;5;Seagal;Jesus, I d-I didn't even think.
19;5;PC Principal;I guess... I asked too much of one kid.
19;5;Randy;Listen, everybody. [the group splits in two so the camera can see him] I think there's a way to try and make this right for everyone.
19;5;;"A third commercial. We're back in the poor community. ""Amazing Grace"" plays with an organ, and a choir joins in later"
19;5;Randy;"To date, Shameless America has raised over $40,000. With that money, we are putting more and more iPads into these people's hands. [all the kids look at the iPads, not sure what to do with them] With iPads, these people can finally help more Americans get rid of negativity on their social media. [Jojo returns with an iPad, handing it to Randy] Oh, thanks Jojo. I'm shame-free now, and you can be too. For just $1 a day, one of these beautiful children will protect you from trolls and make your Internet a safe space. [a screen pops up with ""We won't rest until America is #completelyshameless""] We won't rest until America is completely shameless. The world can be brutal, but Shameless America is going to continue to take steps to make sure everyone has a safe space... forever."
19;5;;South Park Town Square, day. The stage is set for a hanging. Reality has a noose around his neck, and Butters is set to be the executioner. Butters is out of the hospital with a head brace and a crutch
19;5;Butters;Are you sure this is a good idea?
19;5;Randy;Uh huh. [Butters pulls the lever and the trap door opens underneath Reality, making him drop and hang. After some choking, Reality dies and the crowd erupts in cheers]
