19;5;;South Park Elementary, day. Cartman sits in PC Prinicpal's office hyperventilating, teary-eyed. PC Principal and Mr. Mackey both look at him.
19;5;PC Principal;So these guys made fun of your weight and made you feel ashamed?
19;5;Cartman;[voice shaking terribly] Yes, I was just trying to do my job as a food critic and they all ganged up on me and said I was fat.
19;5;PC Principal;Alright, why don't you take me back to what happened?
19;5;Cartman;"I was in the locker room. I was in my underwear and these kids walked by [Craig and Clyde appear around the corner] Then I looked in the mirror and I thought I looked kind of ripped, and so I asked one of the kids [Clyde] if he would take a picture of me [holding two dumbbells, one in each hand] and he did. And I looked at the picture and I looked pretty ripped, so later at home, I put the picture up on my Yelp account and I typed in ""Don't I look ripped?"" and I thought people would be stoked on me. Then this morning I saw the comments on Twitter and some people called me names and said I wasn't ripped, and they said that I was fat and I didn't have muscles. The Internet made fun of me and [is overcome with emotion and hyperventilates. PC Principal sniffs and clears his throat.]"
19;5;Mr. Mackey;Well, Eric, maybe you shouldn't have put a picture of you in your underwear up on social media.
19;5;PC Principal;[jumps up and faces Mr. Mackey] Hey! You got a fuckin' problem, Mackey!
19;5;Mr. Mackey;N-No, PC Principal.
19;5;PC Principal;Because body-shaming is fuckin' serious, and I'm not gonna allow that shit in my school! [faces Cartman] Nobody should have to feel that kind of shame!
19;5;;Whole Foods Market, day. Liane walks out with her groceries, Randy walks around inside marveling at all the stuff. Next, he's in Checkout 5 having his purchases scanned.
19;5;Cashier;Okay. sir, looks like your total is $37.83.
19;5;Randy;[pulls out his wallet and takes out $40] Alright.
19;5;Cashier;[checks the monitor] Okay, and, would you like to add a dollar donation to help hungry kids around the world?
19;5;Randy;[real quiet] Oh, uh, no, that, that's okay.
19;5;Cashier;Sorry?
19;5;Randy;[real quiet] I'm, I'm good.
19;5;Cashier;[having trouble hearing him clearly] I'm sorry, you don't want to give the dollar to hungry kids?
19;5;Randy;[real quiet] Not today, thank you.
19;5;Cashier;"Okay, no problem. [punches in the last few numbers into the register.] A window's gonna come up and ask if you're helping the hungry kids, just hit ""No, I'm not."""
19;5;Randy;[real quiet] Oh, come on.
19;5;Cashier;"Try hitting it again. It's the box below the one that says, ""Sure, I'd love to help however I can."" [Randy hits the button again... and again a few more times, but it only beeps twice. The cashier looks at it.] Ah, darn thing. Sorry. Most people give the dollar. I can do this manually. [turns to the register and taps a few keys]"
19;5;Randy;Look, I give money to charity a lot, okay?
19;5;Cashier;Oh, sure you do.
19;5;Randy;I do. I just don't want to every time I shop for food.
19;5;Cashier;"That's completely understandable. [reads something] ""Have customer speak on the-"" Oh-okay. if you can just speak into the voice decoder and say ""I'm not giving anything to the hungry kids."""
19;5;Randy;"[leans in and speaks into the ""decoder""] I'm not giving anything to the hungry kids. [his voice echoes throughout the store, and everyone takes notice]"
19;5;Cashier;Okay, that's got it. So with the ice cream, the vodka, pizza pockets, and nothing for hungry kids, that's $37.83. [getting a bit sarcastic] Oh, don't forget your change.
19;5;Randy;Look, if I give money every time I went grocery-shopping, I would be-!
19;5;Cashier;[cuts him off] Thanks for shopping, sir. Next, please.
19;5;Randy;[takes his paper bag full of groceries and leaves] Dick!
19;5;;PC Principal's office, moments. PC Principal opens the door and Kyle walks in.
19;5;PC Principal;Morning, Kyle. Have a seat right there. [Kyle takes the seat next to Cartman and is instantly displeased] You probably heard that Eric here has been dealing with some body shaming? [Cartman is still whimpering]
19;5;Kyle;Uh huh.
19;5;PC Principal;Well, Eric and I have been talking, and we've decided it's probably best for him to get off of social media.
19;5;Kyle;Yeah probably.
19;5;PC Principal;So what we're looking for is a student volunteer. Somebody who can put the things Eric wants up on the Internet for him and also filter through all the comments and make it more of a safe space for him.
19;5;Kyle;Wait, what?
19;5;Cartman;I said you were perfect because you're really good at getting all your schoolwork done on time [gathers his thoughts] so you'd probably do a really good job.
19;5;Kyle;You want me to run Cartman's Twitter and Yelp account and only give him the good comments?
19;5;PC Principal;That's right.
19;5;Kyle;No.
19;5;PC Principal;Kyle, you know what body-shaming is, right? How much it can hurt someone's life? All you have to do is check out all the comments, type out just the positive ones, and give that to Eric on paper.
19;5;Kyle;If he doesn't like what people say on Twitter, he can get off. [Cartman begins to cry]
19;5;PC Principal;Okay, Kyle, well maybe you'd like two weeks' detention instead.
19;5;Kyle;[a bit stunned, considers his options] Give me... give me detention.
19;5;PC Principal;You sure about that?
19;5;Kyle;Yeah, I'll take the detention.
19;5;PC Principal;That's two weeks' detention for you, bud! I'll see you at 4! [Kyle looks at Eric, gets up, and leaves. Next, PC Principal is talking to another student] And when we said someone should probably help Eric by filtering out any negative comments, he mentioned you by name.
19;5;Wendy;Is this a joke?
19;5;Cartman;I'm not a joke!
19;5;PC Principal;Nothing funny about this, Testaburger! This is a big problem in our country!
19;5;Wendy;I'm not doing it.
19;5;PC Principal;And that's two weeks' detention for you! Congratulations! [Wendy looks at Eric, gets up, and leaves. Next, PC Principal is talking to another student] So, any comments that seem inappropriate or hurtful in any way, you need to delete and not include in your daily report to Eric. [Butters is shown next to Cartman now]
19;5;Cartman;I wanted someone smart and hard-working!
19;5;Butters;Do I gotta?
19;5;PC Principal;You want detention?
19;5;Butters;Well, if I get detention, uh, I'll get grounded.
19;5;PC Principal;Then you start today! Butters, it's your job to make sure Eric has a safe space.
19;5;;Whole Foods Market, day. Randy is at a salad bar creating his own salad. A female shopper is making one too, and their tongs clash over greens
19;5;Female shopper;Oh, ahhh, I'm sorry.
19;5;Randy;Oh no, my, my fault.
19;5;Female shopper;Isn't it great having a Whole Foods?
19;5;Randy;This is where I come for lunch every day. Gotta eat healthy to stay fit. [pleased at this encounter. He turns to leave and sees the cashier from before, who waves back at him. To himself] Aw, shit, it's that guy. [as no one else is waiting, he goes ahead and makes his purchases]
19;5;Cashier;Aand how are you today, sir?
19;5;Randy;Great. [leans in and in a low voice] Uh, listen, before you ring me up, I just wanna let you know I'm not gonna be giving extra money to charity, so can we, can we just skip that part?
19;5;Cashier;Oh, no problem, sir, they've updated the system so it's a lot more streamlined now. Find everything you need today?
19;5;Randy;Yeah, thanks.
19;5;Cashier;There we go, and that's... Okay, and would you like to give a dollar to hungry kids today?
19;5;Randy;[softly] No. I said no, before.
19;5;Cashier;"Oh that's right. Okay, there's a picture of a little hungry boy. Will you just press on his belly? [Randy does so, and hears ""Oww, owww."" The cashier checks the readout] Okay, that's got it. So, with the no help for hungry kids that's $18.87. [Randy hands him a $20 bill] Out of 20. [the cashier gives him some change back in the coin return tray] Your change is right there, just pull the sandwich out of the little girl's mouth. [a cardboard cutout of a little girl hides the coin return]"
19;5;Randy;This is not streamlined!
19;5;Cashier;It's just the new change dispenser, sir. [Randy then goes ahead and tries to pull the sandwich away]
19;5;Randy;[a couple of grunts later] I can't.
19;5;Cashier;Yes, she's a hungry one. You've gotta pull hard.
19;5;Randy;Dammit! The sandwich isn't coming out.
19;5;Cashier;Try putting your foot on her face. [Randy promptly does this. He also notices the woman he bumped into earlier in Checkout 4 and flashes a smile to her. Finally he pulls the sandwich out of the cutout's mouth and gets his change and his groceries] Have a nice day, sir!
19;5;Randy;I was having a nice day! [leaves the store]
19;5;;South Park Elementary hallway, day. Cartman puts his books into his locker and closes it. As he walks away, Butters appears around the corner and catches up to him.
19;5;Butters;[sounding quite tired] Eric, hold up.
19;5;Cartman;There you are. You have my social media comments?
19;5;Butters;Yeah. Yeah, right here. [hands him the papers] I just finished this morning.
19;5;Cartman;[reviews them] Mm-hm. Hm-oh, that's nice. Oh great. This is all the Twitter comments?
19;5;Butters;Yeah. And the people commenting on your Yelp page starts here. [points to the first comment on the current page]
19;5;Cartman;Okay, nice. Oh ni- oh, very enthusiastic. This is so great! [turns around and walks by Kyle, who's at his locker.] Oh Kyle! You thought me having someone edit my social media would make me look stupid? You should see all the comments I'm getting. People are actually really stoked on me now.
19;5;Butters;It's a pretty brutal job sifting through all that darkness.
19;5;;South Park Elementary gym, later. The whole school is in attendance as PC Principal introduces someone.
19;5;PC Principal;"Alright everyone, listen up. In order to better understand the negative effects of body-shaming, we have a- [points to someone on the bleachers] HEY, LESLIE! PUT A FUCKIN' SOCK IN IT! [Leslie was whispering to Esther again, and again she backs off slowly] We have a guest speaker today who will challenge our perceptions of physical beauty. [steps towards a screen upon which is a graphic that says ""NO MORE FAT SHAMING""] So please welcome action star and hero, Steven Seagal. [claps a few times, then puts the mic into a mic stand and steps aside as music plays. Real life pictures of a slimmer Seagal from his early films pop up as a slide show]"
19;5;Steven Seagal;"[voice-over] You've got a problem with me? I'm your worse nightmare. I have no fear of death, more important, I don't fear life. [gun shot sound effect. The slide show ends and an obese Seagal walks into the gym with a gun drawn. He gets to the mic and begins to whimper, and lowers the gun] I'm a big action movie star and people are pretty stoked on me. And then I put a picture of myself up on the Internet and I had my shirt off and I said ""Do you think I'm ripped?"" and some people commented saying I didn't look ripped, that I was fat, and they called me Steven Se-boom-boom, so I put another picture on the Internet and I thought people would be stoked on me, but they said that I looked like a fat turd, and they said I wasn't buff. [hyperventilates] Body-shaming isn't cool, and, if p-people shame you on the Inter n-net, you have to make sure that you stay, you stay strong and tell everyone you're proud of how you look, like this. [begins to shuffle dance and clap as ""Got To Be Real"" starts playing]"
19;5;;The school hallway, later. Steven is headed out and PC Principal catches up to him.
19;5;PC Principal;Hey, Seagal! Listen, that was a really amazing talk you gave to the kids.
19;5;Steven Seagal;[sniffs] Thank you.
19;5;PC Principal;I can see that you're in a lot of pain, bro. I've got someone who I think can help.
19;5;;PC Principal's office. An exhausted Butters is sitting next to a sobbing Seagal as PC Principal makes his case
19;5;PC Principal;So I want you to do for Mr. Seagal the same thing that you're doing for Eric Cartman.
19;5;Butters;But, PC Principal, I really don't have time.
19;5;PC Principal;This man took the time to come to your school and help spread body-shaming awareness! I think you can give him a little of your time!
19;5;Butters;Yes sir...
19;5;;Whole Foods Market, later. Randy is back to buy more groceries. He's back at Checkout 5 with the same cashier as before
19;5;Cashier;Find everything you needed today?
19;5;Randy;Yes.
19;5;Cashier;Okay, looks like your total comes to $37.98. Would you like to give a dollar to help feed hungry kids?
19;5;Randy;Yes, I would like to give a dollar.
19;5;Cashier;[surprised] You want to give a dollar?
19;5;Randy;Yes, I will.
19;5;Cashier;"[excited sounding] Oh wow, okay! So that's $10 for the beer, $4.20 in chocolate-covered peanuts, $26 in filet mignons, [sarcastically] and one dollar for hungry kids around the world. On ""amount of donation"" it will say $10, $20, or $50, can you just press the ""$1"" box? [Randy does so and bells, sirens, and colored lights go off. The cashier gets on the mic and says] Attention shoppers, somebody just joined the $1 club, giving one whole dollar to help feed hungry children. [quickly goes around the checkout] Here's your T-shirt! [quickly slips it on Randy and takes a picture, then prints the picture. The shirt says ""I Gave $1.00 to End Hunger."" The cashier pins the picture on the ""$1"" cork board, which was empty before] Ho, won't the kids be thrilled when they get their piece of that big impressive dollar. [walks back to his register and sings] For he's a jolly good fellow, for he's a jolly good fellow, for he's a jolly good fellow! He ended world hunger. [Randy takes his groceries and leaves, whimpering]"
19;5;;Butter's house, afternoon, bedroom. Butters is toiling away at his computer.
19;5;Butters;Yech. Oh God that's terrible. Jesus.
19;5;Demi Lovato;[sitting on Butters' bed] Yeah. No, I'm telling you, Tracy, it's the greatest thing ever. I'm getting all my Twitter and Instagram comments on paper, and the nasty mean stuff, all gets edited out.
19;5;Butters;Whoa my God. Wugh.
19;5;Demi Lovato;Yeah. And the coolest thing? Ever since I started using this service, all of my followers are actually way more stoked on me. So cool, right?
19;5;Cartman;Butters!
19;5;Butters;[startled] Yeah!
19;5;Cartman;"[at the bedroom door] What the hell is this? The last report you gave me has a comment that says ""This picture of you burned my eyes, fatso!"""
19;5;Butters;Well, I'm sorry, Eric. I, I guess it slipped through the cracks. I'm overloaded with all the new people.
19;5;Cartman;What new people? [walks up to the computer]
19;5;Butters;Well, I've got Demi Lovato [points to her] to take care of now, and Lena Dunham just put a picture of her asshole on Twitter, and wants only the positive comments.
19;5;Cartman;Dude, fuck Demi Lovato! She's fuckin' hot, she's not being fat-shamed!
19;5;Demi Lovato;[stands up] Am so! But I don't care. People just have to accept my body the way it is.
19;5;Cartman;Butters, I want this fixed by tonight! You got that?!
19;5;Butters;Okay, Eric. [Cartman walks away]
19;5;;"A commercial. ""Amazing Grace"" plays with a female voice. A poor community is shown. Randy walks among the poor folk"
19;5;Randy;This is a place where hope is scarce. These people are hungry. Little Jojo here might not eat today. But does that mean it's okay for cashiers to ask us for money while we're in the checkout line? It isn't right, and it isn't fair. Just $2 a day adds up to 62 goddamned dollars a month if you go to Whole Foods as much as I do. Nobody should have to feel the shame, the humiliation, of being asked to add money onto their grocery bill. Help now. Let's make grocery stores a #SAFESPACE for all. Together, we can make a difference.
19;5;Girl;Because charity-shaming hurts everyone. [Randy holds her a bit closer]
19;5;;PC Principal's office, day. He and Mr. Mackey are talking to someone
19;5;PC Principal;You know, if there's one thing I really respect, it's plus-sized models who challenge the idea of what makes a woman beautiful. These ladies are gonna be part of a big ad campaign for plus-sized lingerie, and we wanna make sure they're protected from any harassing comments.
19;5;Butters;[Butters is seated across from PC Principal with an entire row of plus-sized women in lingerie] Do I have to, sir?
19;5;PC Principal;Hey, they're gonna putting themselves out there, and all I'm asking you to do is go through their social media and delete the two or three comments that are mean.
19;5;Butters;PC Principal, ah, I don't think you quite realize how much negative stuff I have to sift through.
19;5;PC Principal;I know it's a lot, but I just really need you to help these plus-sized models. And Vin Diesel.
19;5;Butters;Vin Diesel too??
19;5;PC Principal;Look bro! You've done an amazing job with Eric Cartman. You have really turned his life around, and other people deserve... to be as happy as he is.
19;5;;South Park Elementary hallway. A piano begins to play a song, and Cartman sings first. Soon, an abstract space appears in which are tiny rooms - a safe space - one for each person singing
19;5;Cartman;Everyone likes me and thinks I'm great in my safe spaaaace.
19;5;Seagal;My safe spaaaace.
19;5;Cartman;[eating in a restaurant, Butters hands him more comments] People don't judge me and haters don't hate in my safe spaaaace. [An exhausted Butters is hard at work in his room]
19;5;PC Principal;Your safe spaaaace.
19;5;Cartman and Seagal;[standing in a floating tiny room] Bully-proof windows, troll-safe doors, nothing but kindness and healing.
19;5;Randy;You might call me a pussy, but I won't hear you in my safe spaaaace.
19;5;Seagal;My safe spaaaace.
19;5;Cartman;Bully-proof windows.
19;5;Demi Lovato;[standing under a spotlight] If you do not like me, you are not allowed in my safe spaaaace.
19;5;Plus-sized models;My safe spaaaace
19;5;PC Principal;[inside the pricipal's office with Butters, he then hands Vin Disel more comments] Look and you will see there's a very select crowd in your safe spaaaace. [Steven Seagal is resting on a bed in his safe space]
19;5;All;My safe spaaaace.
19;5;Cartman;People that support me.
19;5;All;Mixed in with
19;5;Cartman;More people that support me.
19;5;All;And say nice things. Rainbows all around me, there is no shame in my safe spaaaace.
19;5;Randy;My safe spaaaace.
19;5;Cartman;Bully-proof windows. [a change in tempo as villianous music plays and a masked villain enters the video.]
19;5;Reality;I am going to tear down your safe space! Brick by brick, I shall smash it with glee!
19;5;Cartman;What? Who is that?
19;5;Reality;You cannot stop me from getting inside! I am cold and I am hard, and my name... is Reality.
19;5;Demi Lovato;Oh no, not reality! Somebody stop him!
19;5;Cartman;I'll take care of him, Demi! [shoots lightning from his hands, and the various people in their safe spaces are now dressed to dance!]
19;5;All;[faster rock music begins playing] You can't ruin our lives, Reality!
19;5;Cartman;Our safe spaces will keep you out!
19;5;Reality;Drat!
19;5;All;We can face almost anything!
19;5;Cartman;But Reality we can do without!
19;5;Reality;Nooooo... [vanishes, as the original piano music resumes]
19;5;Cartman;Bully-proof windows.
19;5;All;Troll-safe doors. [slowing down] My Safe Spaaaaaaaace! [all stop]
19;5;Cartman;That was nice.
19;5;;Whole Foods Market, day. The cashier at Checkout 5 sends one shopper off
19;5;Cashier;All right, thanks, have a great day. [Randy steps up] Good afternoon sir.
19;5;Randy;[self-assured] Oh, hello. You might know Steven Seagal [who steps up, with his gun aimed at the cashier]
19;5;Steven Seagal;You wanna play with me?
19;5;Randy;And this is Vin Diesel.
19;5;Cashier;Oh, hello gentlemen.
19;5;Randy;It'd be... a really bad idea for you to charity-shame me today. These guys are here to protect my safe space.
19;5;Cashier;"That's great. [hums to himself as he scans Randy's items]

This little piggy went to market.
This little piggy stayed home. 
This little piggy was in Fast And The Furious, [Vin Diesel begins to whimper and walks away]
and this little piggy goes direct to cable.[Steven Seagal begins to whimper and walks away]


[jabs Randy in the belly] And this little piggy just bought fifty-three dollars in beer and frozen pizzas. Would you like to make a dollar donation to hungry kids today?"
19;5;;"A second commercial. We're back in the poor community. ""Amazing Grace"" plays with a deep male voice, and Demi Lovato walks in"
19;5;Demi Lovato;Look around you. What do you see? People who are slim. Skinny. But not everyone can have nice bodies like them. Just imagine it. Putting your pictures up on Twitter just to have some people write comments about your weight. It happens, all too often.
19;5;Randy;[taking over] But it doesn't stop there. People also can be shamed for other traits viewed as negative. Mike here was shamed for not being a good recycler.
19;5;Demi Lovato;"And so together, we have created #shamelessAmerica, [a screen pops up with ""let's work towards a #shamelessAmerica.""] so no one is ever labeled..."
19;5;Fat woman;Tubby.
19;5;Man with cap;Bad with tools.
19;5;Woman 2;Dyke!
19;5;Man 2;Butter butter dirty line cutter.
19;5;Randy;Let's work together to create a completely shameless America.
19;5;Boy;[emaciated] Because shaming hurts everyone. [Randy holds him a bit closer]
19;5;;Butters' room, night. He's editing out negative comments on Demi Lovato's social media pages before printing them
19;5;Butters;"[reading through online messages] ""Hey Demi Lovato, I bet your vagina has a-"" [begins to gag] oh. Oh God. Oh, that's horrible [picks up a waste basket and vomits into it] Augh. [coughs] Jeez. Delete. Delete that too. [continues reading comments aloud] ""I'd like to stick my wiener into those fat rolls of-"" [villianous piano music begins to play] Oh God! [Reality sneaks into his room and paces behind Butter's chair] Uh, delete! ""You aren't fat, but my dick is-"" Whoa, God."
19;5;Reality;HaHAA!
19;5;Butters;GAAAHHH!
19;5;Reality;So you're the one trying to destroy me, eh??
19;5;Butters;What? [falls out of his chair. Reality tries to grab him, but misses. Butters runs to a night stand]
19;5;Reality;You little shit! Keep me out, will you?
19;5;Butters;I don't know you, sir!
19;5;Reality;You can't stop me! [tries to grab Butters again, but breaks the lamp on the night stand] I'm going to kill you! [jumps up to fall on him. At that moment, the bedroom door opens]
19;5;Stephen;Butters! What are you doing?!
19;5;Butters;[panicked] Well-ll, the man! Uh, the man is gonna get me! [Butters points to where Reality was standing only for the shot to widen showing he is no longer there]
19;5;;Whole Foods Market, day. The cashier is ringing Randy up.
19;5;Cashier;And some chocolate-covered almonds. Vanderpump Sangria mix.
19;5;Randy;"Yeah, um, I'm a little tired because I'm actually hosting a huge fundraiser for my charity organization [shows off his shirt: ""#ShamelessAmerica""] that I'm sort of the head of."
19;5;Cashier;That's great, sir. Ice cream sandwiches.
19;5;Randy;Yeah, we're gonna raise a lot of money. Celebrities are coming. Demi Lovato is givin' a hundred thousand for the event.
19;5;Cashier;Wonderful. Rotisserie chicken. Oh yep, gotta have that Frank's hot sauce.
19;5;Randy;I just thought, you know, a fundraiser dinner was sort of the appropriate place to ask for donations.
19;5;Cashier;That's great, sir. Okay, your total is $37.85, and would you like to give a dollar to help put a hamster through college?
19;5;Randy;[stunned] ...What? Did you not hear anything I said? I'm - I'm doin' all this stuff.
19;5;Cashier;"Not a problem, sir. [takes out a hamster from behind the counter] If you could just press the N0 button and tell the little hamster he's not going to college. Just look him right in the eye, sir, and say ""Not today, buddy."""
19;5;Randy;Actually, my big fundraising gala is helping put hamsters through college too.
19;5;Cashier;[Excited] Oh, really? Wow. Did you hear that, Banjo? You've got support. [puts the hamster back behind the counter] Well, you have a nice day sir. [hands Randy his receipt] And thank so much for being so generous.
19;5;Randy;You're welcome. [takes his groceries, but has no bag to put them in. He doesn't mind]
19;5;;South Park Elementary hallway. Stan, Kyle, Davíd and Kenny walk along when Cartman interrupts them.
19;5;Cartman;Hey, Kyle. You wanna see what people said about my dick pic? Everyone's pretty stoked on it.
19;5;Kyle;There's more than two people on the Internet.
19;5;Butters;The man! The man the man the man the man! [runs around the corner completely naked] The man he's gonna get me! He shadows me everywhere! [stops another student and gets in his face] Do you see the man?!
19;5;Kyle;[turns him around] Butters, what are you doing?! [the other student leaves]
19;5;Butters;Well, he's gonna get me!
19;5;Kyle;Dude, Butters, you're seeing things! Sifting through all the horrible stuff people say on the Internet is making you lose it!
19;5;Butters;[breaks free and runs off] The world is darkness! The man is coming!
19;5;Stan;Dude, Butters! [he and Kyle give chase. Butters goes up a flight of stairs]
19;5;Butters;Aaaaa! Aaaaa!
19;5;;Kindergarten, day. The teacher quizzes the kids on a story
19;5;Teacher;And what color is the little ball the kittens are playing with?
19;5;Butters;[runs into the classroom] Run for your lives, you little fuckers, the man is coming! [the kids scream as Kyle enters the room. Stan, Davíd and Kenny follow him in]
19;5;Kyle;Butters, listen to my voice.
19;5;Butters;The man is gonna get me if I don't stop!
19;5;Kyle;Then stop, dude! Butters, all this isn't worth it. Just. Take, the detention, dude.
