23;7;;"Board Girls Gaming Club, day. The girls compete against Heather and defeat her soundly. First up: Blood Rage. Heather makes her move; Nichole looks on passively and blows a gum bubble until it pops, then knocks off one of Heather's pieces. Heather is stunned. Next game is War of the Ring. Heather is frowning, but makes her move; Tammy is chatting away on the phone as she rolls the die and knocks off some of Heather's miniatures. Tammy sits back and smiles as the kids cheer her on. Next is Twilight Struggle. Nichole places her cards all over the map as Heather looks on in awe. After she places her last card, she rejoices in victory. Heather lifts her hands in gripping rage. Heather then participates in Board Girls Gaming Club, with Kelly tutoring her. Heather and Kelly then face each other and play. Next game is Concordia. Tammy again faces Heather and waits for Heather to finish her move. Then Tammy pulls off a series of card moves and defeats Heather. This song plays throughout the montage:

Tabletop bloodbath, nothing left to say.
Your moment is here, time to make 'em pay, Strong Woman. Strong Woman. Strong! Woman!
Smoke the competition, show 'em what you got.
All your painted miniatures are really paying off, Strong Woman. Strong Woman. Strong! Woman!
Hey wow! Who's the Strong woman now?
And hey you! Thought you were the best, but you're about to lose
To the Board Girls. They got the moves.
They pummeled you at Alchemists and kicked your ass in Carcasonne
Board Girls, they know all the rules.
They watch Rodney Smith, Tom Vasel, and Becca Scott.
Hey, cool. They made you look a fool
And hey, sweet, Take a step down; you just got beat
By the Board Girls!"
23;7;Heather;Do you think that's fair?! You only won 'cause you dumb girls memorized the rule books! When I play games, I just wanna be a pirate or a spaceman! [Cartman joins her]
23;7;Cartman;That's right! You and your stupid rules!
23;7;Heather;I may identify as a woman now, but I grew up a boy, so you have an unfair advantage over me!
23;7;Cartman;Yeah, an unfair advantage, stupid girls! Come on, Ms. Swanson. We can go make our own club. [they turn and walk out together. Once they're gone, the girls erupt in cheers]
23;7;;The Principal - er, Charles - house, day. Pete and Strong Woman get home and go inside.
23;7;Strong Woman;[before entering.] You sure you're ready for this?
23;7;Pete;I just wanna get it over with. [they enter, and the babies are happy to see them]
23;7;Babies;Mommy! Yay!
23;7;Strong Woman;Yes, kids, and look who else is here.
23;7;Babies;[they look at him for a few seconds] Daddy! Yeah Daddy! Dada!
23;7;Emory;Dada. I love you.
23;7;Pete;I... I don't understand.
23;7;Strong Woman;They don't care. They must see the nuance to this whole situation.
23;7;Pete;You're right! They realize that raising a gender-based issue of strength doesn't necessarily make one a bigot or a bully. All this time we were worried what the PC babies would think.
23;7;Strong Woman;And we didn't realize that our little babies are growing up. [they laugh and start to play with the babies.]
