4;11;Mr. Garrison;"Look, you can't counter a profane command with an idle threat! You must extinguish it with a vulgar suggestion! When a child says, ""Suck my balls,"" you say, ""Present them."""
4;11;Ms. Choksondik;Oh.
4;11;Mr. Garrison;Now, let's try it again. [gathers the books up and repositions them on Ms. Choksondik's hands and head, then stands to her left. She resumes balancing on her left foot and concentrates.] SUCK MY BALLS!
4;11;Ms. Choksondik;Pre-sent them?
4;11;Mr. Garrison;[softens] Good. [Ms. Choksondik relaxes a bit and opens her eyes] Very good. [with authority] You're ready to move on to the next level. But I warn you: we will now be diving deep into your own psyche. These children know what scares you, and so we, too, must face those demons.
4;11;Ms. Choksondik;I'm ready. I'm not afraid.
4;11;Mr. Garrison;[ominously, gruffly] You will be! You will be! [coughs] You will be.
4;11;;South Park, a house. Eight boys approach it: Stan, Kyle, Cartman, Butters, Kevin, Tolkien, Tweek, and Clyde. Stan knocks
4;11;Stan;God-damnit, this is ridiculous.
4;11;Nerd #2;[opens the door angrily] What?!
4;11;Stan;Dude, can you please just stop fighting with your friend and build another machine so we can travel back in time to the third grade?
4;11;Nerd #2;"Look! There aren't 73 episodes of Star Trek, there are 72! ""The Menagerie"" was a 2-parter that counts as one episode! Pizza-face is wrong!"
4;11;Cartman;Who the hell cares?!
4;11;Nerd #2;I know! Why does he have to be such a dick about it?!
4;11;Kyle;Wouldn't it be better to just agree with him and forget the whole thing?
4;11;Nerd #2;No, because he's WRONG!
4;11;Kyle;Look. You guys built a machine together that can bend time. If you'll just agree with him, you can build another one and usher in a whole new era of science!
4;11;Nerd #2;And live in a world of 72 original Star Treks? I don't think so! I don't want to live in that world. [slams the door shut]
4;11;Cartman;God, these guys are such geek dumbasses!
4;11;Stan;I know.
4;11;Butters;"Yeh-hah. They don't even realize that ""The Menagerie"" originally was the pilot and later got split up into two episodes, eh ha ha. Ha ha. [pauses to see if anyone responds] Hahahaha, eh the, eh the dumbasses."
4;11;Stan;Wait a minute! I've got it. [knocks again]
4;11;Nerd #2;[opens the door angrily] What?!
4;11;Stan;Dude, if you guys build another time machine, you can travel back in time and ask the creator of Star Trek how many episodes there were!
4;11;Nerd #2;[thinks for a moment] Dude, Jesus, you're right.
4;11;;"South Park, the ""Matterhorn."" Mr. Garrison takes Ms. Choksondik to a gnarled, giant willow tree on a mountainside forest"
4;11;Mr. Garrison;This is it: The Tree of Insight. You must go in and face what lives inside.
4;11;Ms. Choksondik;What lives inside?
4;11;Mr. Garrison;Hell if I know. I wouldn't go in there.
4;11;Ms. Choksondik;Oh, alrighty. [enters the base of the tree and through the hewn hallway, then sees a light at the other end.] What the? Why there's nothing in here but an exit to the other side! [peers through it, then pulls back] There's nothing in here at all. ...Oh, and I actually thought my mental demons would be in here. [thinks for a moment] Wait a minute. Maybe there's not supposed to be anything in here. Maybe I'm supposed to see that I alone do have the strength to reach the kids! [clenches her fists] I think I get it now! [walks out the other end]
4;11;Mr. Garrison;[bides his time and sighs] Hey, hurry up in there! [under his breath] Jesus. [knocks on the tree entrance] You're taking too long in the damn Tree of Insight! [looks at the entrance, then looks in] You in there?! [enters the hallway himself] Hey, where the hell did she go? [a few more steps, and rumbling begins] What the? [the entrance closes and a mirror Garrison, clean-shaven, appears. The unkempt Garrison shivers] Haaa! Who? Who are you?
4;11;Clean Garrison;[surely] I am you. [approaches the unkempt Garrison] I am your gay side.
4;11;Unkempt Garrison;My gay side, uh- I DON'T HAVE A GAY SIDE!!!
4;11;Clean Garrison;You must face me at last. [the two of them just stare at each other]
4;11;;"South Park, the ""Matterhorn,"" moments later..."
4;11;Unkempt Garrison;You aren't real! You can't be!
4;11;Clean Garrison;It is me, your darkest fear. Your gay self, incarnate.
4;11;Unkempt Garrison;What do you want?
4;11;Clean Garrison;I want you to not fight me anymore. To accept me, once and for all.
4;11;Unkempt Garrison;Why?
4;11;Clean Garrison;Don't you see? [approached the unkempt one] All these years, your pain, your confusion, it comes from one place. Your denial of who you are. [his voice softens] Of who... we are.
4;11;Unkempt Garrison;But I'm not gay! Everyone just thinks I am!
4;11;Clean Garrison;Oh, stop it! What about the time you looked at Counselor Mackey's penis in the men's locker room?!
4;11;Unkempt Garrison;I was just comparing size!
4;11;Clean Garrison;For seven minutes?!
4;11;Unkempt Garrison;Aaa! [turns away in despair]
4;11;Clean Garrison;And what about the time you masturbated to the men's 100-meter swimming relay at the Olympics?!
4;11;Unkempt Garrison;I was beating off to the chicks!
4;11;Clean Garrison;THERE WERE NO CHICKS!
4;11;Unkempt Garrison;OH, DAMN YOU SPIRIT! HAUNT ME NO LONGER!
4;11;Clean Garrison;ADMIT IT!
4;11;Unkempt Garrison;NO!!!
4;11;Clean Garrison;YOU HAVE TO STOP LYING TO YOURSELF AND GET A G-
4;11;Unkempt Garrison;ALRIGHT, ALRIGHT, I ADMIT IT! I'M GAY!!! [camera zooms in as Garrison comes to terms with this admission] I'm...gay. I'm gay! [rises] I am gay! You hear that everyone? [goes towards the exit] I'm gay! I'm gay! I'm gay and it... [gets emotional] and it feels good.
4;11;;South Park Elementary, Ms. Choksondik's classroom, a few days later. Where the chalkboard used to be are just some boards hastily put up, along with a DO NOT CROSS line and three safety cones to guard this makeshift board.
4;11;Ms. Choksondik;Alright, children, I hope you all did your- [the class once again has goggles on and the two nerds are back together in the back of the class ready to activate another machine --- a microwave oven with a duck tied to it.] Oowhat is going on now?! [three kittens run up and frolic near her breasts]
4;11;Cartman;Haha, Teacher, we're traveling back in time to third grade!-God-damnit you guys, you seriously said this time you'd snap into it with me.
4;11;Ms. Choksondik;[cups her ears] Oh Good Gravy, not this again.
4;11;Cartman;Yes! We've had a new time machine built: this one out of a simple microwave oven and a duck [the contraption is shown and the duck quacks.] Au revoir, teacher! Perhaps we shall see you in the past, hahaa. Gentlemen? [the nerds activate their controllers]
4;11;Ms. Choksondik;Children, I will have order!!
4;11;Nerd #1;I can't wait for Gene Roddenberry to tell you how WRONG you are! Just like when you said there were no two-parters of Battlestar Galactica!
4;11;Nerd #2;There WEREN'T!
4;11;Nerd #1;"The episode called ""Gonzo on Ice Planet Zero"" was a two-parter."
4;11;Nerd #2;No it WASN'T!
4;11;Stan;Oh, son of a bitch!
4;11;Nerd #1;I'll kill you! [the nerds start slapping each other again. Nerd #2 throws his controller at Nerd #1, and the controller hits the floor. The microwave is activated and soon blows up along with the bird, leaving behind a portal]
4;11;Cartman;There it is! Come on, everybody! [the kids move towards the portal]
4;11;Ms. Choksondik;Children, get back into your seats!
4;11;Cartman;No way, lady!
4;11;Ms. Choksondik;Eric, I mean it!
4;11;Cartman;You can suck my balls!
4;11;Ms. Choksondik;[strikes a meditative pose as the camera does some vertigo, then] Present them. [everyone stops what they're doing and looks at her. Nerd #2 was about to strike Nerd #1 with a desk.]
4;11;Cartman;...What?
4;11;Ms. Choksondik;"You said, ""suck my balls."" Well, go ahead. Whip 'em out, and I'll suck 'em."
4;11;Stan;[softly] Thah... That's what Mr. Garrison would've said.
4;11;Cartman;Touché, teacher. Touché.
4;11;Ms. Choksondik;Now, children, listen to me. Why do you want to go back in time? Life isn't about going back, it's about going forward. Yes, there are times in our life that we wish we could relive, but, if we already lived them perfectly, why live them again? The adventure of life is that there's always something new. New challenges, new experiences. A fun game is a game that gets harder as it goes. So it is with life. Do you understand?
4;11;Stan;Dude. Sh-she's right.
4;11;Kyle;Yeah. And you know, now that I think about it, third grade wasn't all that great, either.
4;11;Stan;Yeah. Third grade sucked! Cartman, why the hell did you try to make us think third grad was so great?!
4;11;Kyle;Yeah! You suck, Cartman! [the kids return to their seats, leaving Cartman alone]
4;11;Cartman;What??
4;11;Ms. Choksondik;Alright, students, that will be quite enough! If you're ready, let's continue on... with the fourth grade. [as she turns to write her name on the makeshift board, a noise is heard]
4;11;Timmy;AAAAAAA! [reappears covered in items from every time period in history]
4;11;Kyle;Hey, Timmy's back!
4;11;Stan;Dude, it looks like he's been all over time! He must have such cool stuff to tell us.
4;11;Timmy;[shifts a bit here and there] Eh, Timmih.
4;11;;South Park Elementary, Principal's office. Chef talks with Mr. Mackey and Principal Victoria
4;11;Chef;You know I'm always here to help, Principal Victoria. [the door opens]
4;11;Mr. Garrison;[skips in happily] Ey, guess what everybody?! I'M GAY!!! [the other three look]
4;11;Principal Victoria;Mr. Garrison?
4;11;Mr. Mackey;What?
4;11;Mr. Garrison;I'm as gay as a gymnast on shore leave!
4;11;Principal Victoria;You admit it? You admit it! [the three of them gather around him smiling]
4;11;Mr. Mackey;Oh, that's great, Mr. Garrison. You've finally come to terms with yourself!
4;11;Mr. Garrison;[fairly bouncing with joy] Yeah, it feels really good!
4;11;Principal Victoria;Well, congratulations!
4;11;Mr. Mackey;Yeah, congratulations!
4;11;Mr. Garrison;You know, I, I feel like I can start anew. If it's alright with you, I'd like to go back to teaching the third grade!
4;11;Principal Victoria;Oh. I'm sorry, we don't hire gay people. [silence, then Chef, Mr. Mackey, and Principal Victoria laugh as Mr. Garrison stews]
