10;12;Shvek;Hahahaha, you believe in a supernatural being. [gets a syringe to the neck] Oh my Science. [his head explodes and the battle is over. The UAA closes in on Cartman, its guns drawn]
10;12;Cartman;I'm just a little boy from the past who wants to play Nintendo Wii.
10;12;;The UAA ship's bridge. Cartman enters with UAA members escorting him.
10;12;UAA member 1;Put me through to the Allied Atheist Allegiance!
10;12;UAA member 2;[black hair] Onscreen.
10;12;UAA member 1;Look, Allied Atheist Allegiance! We have the time child!
10;12;AAA leader;Science damn you, United Atheist Alliance!
10;12;UAA member 1;Now you see, foolish sea otters, that we are the atheists in control!
10;12;AAA leader;It won't make a difference! This is the dawning of the sea otter! Know this, time child! I shall smash your skull like a clam on my tummy!
10;12;Cartman;What??
10;12;AAA leader;Otters! The time has come! Sound the nafferty!
10;12;Sea otters;The nafferty! [a giant otter walks over to a very fanciful horn and blows into it.]
10;12;AAA leader;[rises on a platform and turns around. A lens drops down from a contraption he has to his left ear and lands on his nose] So, it begins!
