10;1;Kyle;We're all here today because Chef has been such an important part of our lives. A lot of us don't agree with the choices Chef has made in the past few days. [Elton John is present] Some of us... feel hurt... and confused that he seemed to turn his back on us. [Stan, Cartman and Kenny look down at their feet] But we can't let the events of the last week take away the memories of how much Chef made us smile. [they perk up a bit] I'm gonna remember Chef as the jolly old guy who always broke into song. [Timmy and Jimmy are sitting together] I'm gonna remember Chef... as the guy who gave us advice to live by. [Terrance and Phillip are present, weeping quietly] So you see, we shouldn't be mad at Chef for leaving us. We should be mad at that little fruity club for scrambling his brains.
10;1;Randy;Yeah.
10;1;Mr. Mackey;He's right. [soft applause rises from the crowd]
10;1;Kyle;And in the end, I know that somewhere out there... there's the good part of Chef... that's still alive in us all. [smiles]
10;1;;'The SAC house, operating room. The club members have gone down to retrieve Chef and put him on the table. Mr. Connolly and two of his men quickly get to work'
10;1;Mr. Connolly;Is it working? Is it working?
10;1;Tech;Yes. We've got a pulse!
10;1;Mr. Connolly;Get him in the ICU suit! Hurry! [an ICU suit is fitted onto Chef] We have done it! Good! Raise him up! [Chef and the operating table are tilted upright - but this Chef looks like Darth Vader. He has a glowing red spatula in his right hand] Chef, can you hear me? Say something.
10;1;Darth Chef;Hello there, children. How would you like some Salisbury Steak?
10;1;Mr. Connolly;Yes, go on.
10;1;Darth Chef;And for desert, how would you children like to suck on my chocolate salty balls?
10;1;Mr. Connolly;Oh? You mean like chocolate candy?
10;1;Darth Chef;No, I mean my balls.
10;1;Mr. Connolly;Yes, YES! Hahahahahahaaa!
