10;2;;San Francisco. Cartman is now in the Haight-Ashbury district. People look and move on
10;2;Man;Yeah, it's like, San Francisco is more of a European city, like Paris or Milan.
10;2;Cartman;[checking in] Butters, are you there?!
10;2;Butters;[making sure the cord is taut] I'm here, Eric.
10;2;Cartman;I've started to enter the smug. I'm about a quarter mile in. Can you give me an EL?
10;2;Butters;[now reading a map] You must be nearing Union Square. Did you see a fountain to your left?
10;2;Cartman;Yes. It's just beyond yet another wine and cheese store.
10;2;Butters;Wait, uhh, eh take your next right. You've got to start heading west.
10;2;Cartman;Turning right at O two four niner. [turns right at the corner and continues walking]
10;2;;Dawson's Junkyard, day. Stan is still manning the controls. He drops a red hybrid into the masher, and a cube of twisted red metal slides out and drops onto the ground
10;2;Randy;That's it. That's that the last one.
10;2;Ranger McFriendly;Keenan? Keenan, we've smashed the last hybrid!
10;2;Keenan;Harry, the smug from Clooney's speech is about to hit the other smug system! Get everyone inside! [the townsfolk hear the warning and run around all over the place. Keenan says softly, deeply] God help us.
10;2;;Over northeast Nevada, the speech's smug nears the supercell. From the ground, the smug is seen floating along quickly, reciting Clooney's speech. It runs into the super cell and stops talking. Immediately, lightning envelopes the super cell and spreads to San Francisco and South Park
10;2;;San Francisco, under the Perfect Storm of Self-Satisfaction. Stuff begins to roll down the street on which Kyle lives. Cartman approaches his house
10;2;Cartman;Butters?! Butters, I think I'm here! 2419 Castillo?!
10;2;Butters;That's it! Eric, hurry! Somethin's goin' on out here!
10;2;;The Broflovski house. Gerald and Sheila are thoroughly spent from the party, so they don't take notice of the storm outside. Cartman opens the door and the sound of thunder fills the house
10;2;Cartman;Mr. Broflovski! Mr. Broflovski, there a smug storm! We have to go!
10;2;Gerald;[Slowly, blissfully] Being smug is a good thing. [farts in his armchair, bends down to inhale it]
10;2;Cartman;Oh my CHRIST! [runs up to Kyle's room and kicks the door open. Kyle and Ike are as wasted as Gerald and Sheila are. They sit on the floor with their backs against Ike's bed] Kyle? Kyle!
10;2;Kyle;The acid. Dude, I'm totally tripping balls.
10;2;Ike;I'm totally tripping balls. I'm totally tripping balls.
10;2;Cartman;[trying to shake Kyle to his senses] We have to get out of here! Now! [lightning strikes the house, which begins to burn. The lights begin to flicker, and the camera zooms in on Cartman, who continues shaking Kyle] Kyle! Kyle!! [the screen goes black]
10;2;;Fade in to South Park, the morning after. People begin cleaning up. The storm dealt a heavy blow to South Park
10;2;Network anchor;And now, the worst appears to be over. Last night's smug storm... has left thousands homeless. All across the Midwest, people are picking up the pieces. Cities like Denver and South Park are heavily damaged, but still all right. However, San Francisco, I'm afraid... has disappeared completely up its own asshole.
10;2;Stan;No...
10;2;Randy;I'm sorry, Stan. I'm sorry your gay little song killed your friend.
10;2;Clyde;Hey! Hey, Stan! You're not gonna believe it! You've gotta come see!
10;2;Stan;What?
10;2;Clyde;It's a miracle!
10;2;;Downtown South Park, day. The Broflovskis are back in town, safe and sound and glad to see everyone. Everyone marvels at their return. The Marshes arrive. Stan spots Kyle and runs up to him
10;2;Stan;Kyle!
10;2;Kyle;Hey Stan.
10;2;Stan;Dude, what happened?? [grins]
10;2;Gerald;We don't know. We were all passed out and... next thing we know we just woke up on a bus heading here.
10;2;Mr. Mackey;It's like you had a guardian angel, m'kay? [Butters looks to Cartman for any reaction. Cartman puts his left index finger to his mouth, indicating that Butters should keep his mouth shut about this]
10;2;Stan;[gives Kyle a brief hug] Dude, I'm so glad you're not dead.
10;2;Richard;So I guess there's nothing left to do now but... rebuild.
10;2;Randy;Yeah. First off, we're all gonna need new cars.
10;2;Gerald;And let's make sure nobody gets a stupid hybrid, right? [everyone seems to agree and discusses it...]
10;2;Kyle;NO! Hybrid cars are a good thing!
10;2;Mr. Mackey;But hybrid cars are the leading cause of smug, m'kay?
10;2;Kyle;Hybrid cars don't cause smugness, people do. [silent reactions all around] Look, hybrid cars are important. They may even save our planet one day. What you all need to do is just learn to drive hybrids and not be smug about it.
10;2;Randy;You mean... drive in hybrids... but not act like we're better than everyone else because of it.
10;2;Kyle;Yeah!
10;2;Randy;I'm... [puts his hands over his lower belly] I'm not ready...
10;2;Gerald;I don't think I can do it either.
10;2;Mr. Mackey;It's simply asking too much.
10;2;Randy;Perhaps... one day... we can learn to drive hybrids without being smug about it, but for now... the technology is just too much for us.
10;2;Gerald;"Come on, everybody! Let's go buy wasteful gas guzzlers! [everyone likes the idea; they all disperse]"
10;2;Cartman;[walks up to Kyle] Well, looks like you're back for good, huh Kyle?
10;2;Kyle;Yeah, I guess so.
10;2;Cartman;We just can't get rid of you, can we, you sneaky Jew rat!
10;2;Kyle;Don't belittle my people, you fucking fatass! [turns and walks away angry]
10;2;Cartman;Ah, that's better. [smiles]
