10;9;;the POV changes to that of a dead-end alley. The camera descends from on high as the 911truth man runs down the alley. It stops descending when Stan and Kyle round the corner. The man reaches a chain-link fence and tries to climb it. The boys come in closer. The man fails to climb the fence and drops to the ground when the boys reach him.
10;9;911truth man;[begins to plead] No. Please. Pleeease!
10;9;Kyle;Dude! What the hell is going on?!
10;9;911truth man;Don't kill me! I, I just do what they say!
10;9;Stan;What who said?
10;9;911truth man;I have a family. Please don't kill me!
10;9;Kyle;Dude, we aren't going to kill you. [just then a gunshot is heard and the 911truth man falls dead... again]
10;9;Stan;Oh God!
10;9;Bearded man;[appears with the smoking gun] It isn't safe here, boys. Follow me!
10;9;Kyle;Who the fuck are you?!
10;9;Bearded man;There's no time! come on! [the camera pans up but stays focused on the three folks as the boys follow the bearded man out of the alley.]
10;9;;A mansion, night. The bearded man escorts Stan and Kyle in and leads them to his library
10;9;Kyle;Do you mind telling us what the hell is going on??
10;9;Stan;Who are you?
10;9;Bearded man;[pours himself a drink] I'm a detective, and I'm afraid that you kids have been double-crossed.
10;9;Kyle;You f-figured this thing all out?
10;9;Bearded man;Not me. My mystery-solving sons. Come on in, boys. [the Hardly Boys enter] My boys were researching who went number two in the urinal at your school when they discovered something odd, which gave them a clue.
10;9;Frank;Gave us both a clue.
10;9;Mr. Hardly;That clue led them to a 9/11 conspiracy group party, where they got a lot more clues.
10;9;Joe;I was getting a clue like every two minutes.
10;9;Frank;I got such a raging clue that I almost shot clue goo all over Joe.
10;9;Mr. Hardly;Those clues pointed out that all the 9/11 conspiracy theories could be disproven scientifically. And that's when Frank got his biggest clue.
10;9;Frank;It was huuuge.
10;9;Mr. Hardly;That all the 9/11 conspiracy Web sites are run by the government. The 9/11 conspiracy... is a government conspiracy.
10;9;Stan;Aw Jesus...
10;9;Kyle;Why would the government want people to believe they caused 9/11?
10;9;Mr. Hardly;For a government to have power, they must appear to have complete control. What better way to make people fear them than to convince them they are capable of the most elaborate plan on earth?
10;9;Bush;"[off-screen] That's quite enough, Hardly! [the camera shows him entering with his staff] Don't believe what he says, boys; we caused 9/11. [brings forth a manila folder] It's all right here in these secret documents, [hugs the folder tight] but you'll never get them. [turns around as he yawns, dropping the folder to the floor behind him. No one picks it up]"
10;9;Kyle;I knew it! You didn't plan 9/11 and you really didn't shoot that guy!
10;9;Bush;[dropping the act] Boys, you don't understand. People need to think we are all-powerful. That we control the world. If they know we weren't in charge of 9/11 then... we appear to control nothing.
10;9;Kyle;Well why don't you just tell people the truth?!
10;9;Bush;We do that too. And most people believe the truth. But one fourth of the population is retarded. If they wanna believe we control everything with intricate plans, why not let them?
10;9;Mr. Hardly;Just one thing, Mr. President: How the devil did you know we were all here? [a close-up of Kyle. A gun appears next to his left temple. The camera moves clockwise as it refocuses on Stan, who's got the gun aimed at Kyle. Stan must have told the President]
10;9;Stan;How come you couldn't just go home, dude? That's all we had to do!
10;9;Kyle;Stan! What the fuck?!
10;9;Stan;It was all planned out!
10;9;Kyle;You knew this whole time? Why?
10;9;Stan;Because it was me. I'm the one who took a dump in the urinal.
10;9;Kyle;[backs away a bit] What??
10;9;Stan;The stalls were full and I didn't wanna miss recess! I didn't think it would turn into such a big deal!
10;9;Kyle;So you blamed the government?!
10;9;Mr. Hardly;And the government was more than willing to take the blame, so long as it made them look responsible for 9/11!
10;9;Stan;[lowers his pistol] Oh man, now everyone's gonna know. Why did the stupid Hardly Boys have to be so good at solving mysteries?
10;9;Kyle;So wait, wait: Stan took a dump in the urinal and he contacted the conspiracy Web site? But the conspiracy site was run by the government?
10;9;Stan;Yuh.
10;9;Kyle;So then, who was responsible for 9/11?
10;9;Stan;Whattaya mean? A bunch of pissed-off Muslims.
10;9;Frank;[giggles] Yeah. What are you, retarded? [The President and his staff laugh heartily]
10;9;Mr. Hardly;Well, it looks like this mystery is solved. It's time for the culprit to finally pay!
10;9;;The boys' room at South Park Elementary, day. Stan is cleaning the urinal under Mr. Mackey's supervision
10;9;Mr. Mackey;When you dook in the urinal, it's bad, m'kay! [Stan squirts some cleaning fluid onto the urinal basin] How would you feel... if somebody came into your home, m'kay, pulled down their pants and laid a big mud monkey right on your mom's face? [Stan laughs] Oh you think that's funny, huh?! Yeah, that's real funny!
